,Unnamed: 0,source,title,url,published_at,description,content,fetched_from,published_at_parsed,combined_text,relevance_score,summary
54,54,ComputerWeekly.com,UK data reforms become law,https://www.computerweekly.com/news/366626126/UK-data-reforms-become-law,2025-06-20T11:15:00Z,"UK passes wide-ranging data protection reforms designed to ‘simplify’ organisations’ sharing and processing of data, but it remains to be seen whether the changes will be accepted by the European Commission when it comes to renewing its UK data adequacy decis…","The UKs Data Use and Access Bill has become law, with the government claiming it will save working people money and time while injecting £10bn into the British economy over the next decade.
The bill… [+5833 chars]",newsapi,2025-06-20 11:15:00+00:00,"UK data reforms become law. UK passes wide-ranging data protection reforms designed to ‘simplify’ organisations’ sharing and processing of data, but it remains to be seen whether the changes will be accepted by the European Commission when it comes to renewing its UK data adequacy decis…. ",0.42254156,"The UK's Data Use and Access Bill aims to inject £10 billion into the UK economy over ten years. The bill simplifies data sharing and processing for UK organizations, impacting data startups. The EU adequacy decision renewal is uncertain, posing risks for cross-border data flow.
"
75,75,Tom's Hardware UK,16 billion accounts exposed in one of the largest data breaches in history — enormous data haul holds two accounts for every human alive,https://www.tomshardware.com/tech-industry/cyber-security/16-billion-accounts-exposed-in-one-of-the-largest-data-breaches-in-history-enormous-data-haul-holds-two-accounts-for-every-human-alive,2025-06-19T15:16:14Z,"A collection of entirely new data leak datasets has been uncovered by security researchers, exposing 16 billion new records to the public. The data was sourced from around the world, with breaches on this scale easily contributing to massive future attacks.","One of the largest data breaches ever seen has recently hit the public, sharing 16 billion brand-new leaked login credentials. While major data breaches of this scale are typically full of billions o… [+2620 chars]",newsapi,2025-06-19 15:16:14+00:00,"16 billion accounts exposed in one of the largest data breaches in history — enormous data haul holds two accounts for every human alive. A collection of entirely new data leak datasets has been uncovered by security researchers, exposing 16 billion new records to the public. The data was sourced from around the world, with breaches on this scale easily contributing to massive future attacks.. ",0.39061853,"A massive breach exposed 16 billion accounts, providing attackers vast credential stuffing opportunities. This leak contains two accounts for every person, globally amplifying potential harm. Security researchers warn this unprecedented data haul significantly increases risks of future attacks and account compromises.
"
45,45,GlobeNewswire,"South Africa Data Center Market Investment Analysis Report 2025-2030: Coverage of Data Center Investors - Africa Data Centres, Digital Parks Africa, Equinix, NTT DATA, OADC, Teraco, Microsoft, & More",https://www.globenewswire.com/news-release/2025/06/20/3102814/28124/en/South-Africa-Data-Center-Market-Investment-Analysis-Report-2025-2030-Coverage-of-Data-Center-Investors-Africa-Data-Centres-Digital-Parks-Africa-Equinix-NTT-DATA-OADC-Teraco-Microso.html,2025-06-20T14:47:00Z,"The South Africa Data Center Market is poised for substantial growth, increasing from USD 2.16 billion in 2024 to USD 3.40 billion by 2030 at a CAGR of 7.85%. Johannesburg leads data center expansion, bolstered by investments from tech giants like Google and …","Dublin, June 20, 2025 (GLOBE NEWSWIRE) -- The ""South Africa Data Center Market - Investment Analysis &amp; Growth Opportunities 2025-2030"" report has been added to ResearchAndMarkets.com's offering.… [+9741 chars]",newsapi,2025-06-20 14:47:00+00:00,"South Africa Data Center Market Investment Analysis Report 2025-2030: Coverage of Data Center Investors - Africa Data Centres, Digital Parks Africa, Equinix, NTT DATA, OADC, Teraco, Microsoft, & More. The South Africa Data Center Market is poised for substantial growth, increasing from USD 2.16 billion in 2024 to USD 3.40 billion by 2030 at a CAGR of 7.85%. Johannesburg leads data center expansion, bolstered by investments from tech giants like Google and …. ",0.37551907,"South Africa's data center market will grow from $2.16B to $3.40B by 2030, demonstrating a compound annual growth rate of 7.85%. Johannesburg is the primary hub for expansion, drawing significant data center investment from major technology companies. Key players like Africa Data Centres and Teraco are major market participants, shaping the competitive landscape.
"
66,66,ComputerWeekly.com,Government hires chief data officer,https://www.computerweekly.com/news/366626086/Government-hires-chief-data-officer,2025-06-20T07:09:00Z,"Former head of data, management, governance and capability development at the Ministry of Defence (MoD), Lindsay Mason, was appointed government chief data officer in early June","The Department for Science, Innovation and Development (DSIT) has appointed Lindsay Mason as government chief data officer (CDO).
Mason, who previously was the head of data, management, governance a… [+3115 chars]",newsapi,2025-06-20 07:09:00+00:00,"Government hires chief data officer. Former head of data, management, governance and capability development at the Ministry of Defence (MoD), Lindsay Mason, was appointed government chief data officer in early June. ",0.3645038,"Lindsay Mason was appointed government CDO in June, now working for DSIT. Mason previously led data management, governance, and capability development at the MoD. The CDO's responsibilities will likely involve strategy and standardization across government datasets.
"
55,55,GlobeNewswire,"Automotive Data Cables Market Outlook 2025-2034 | V2X Technology Enhances Digital Mapping for Safer, Efficient Driving",https://www.globenewswire.com/news-release/2025/06/20/3102627/28124/en/Automotive-Data-Cables-Market-Outlook-2025-2034-V2X-Technology-Enhances-Digital-Mapping-for-Safer-Efficient-Driving.html,2025-06-20T10:51:00Z,"The Automotive Digital Mapping Market is set to reach USD 9.6 billion by 2025, with a projected growth at 14.2% CAGR, hitting USD 31.7 billion by 2034. Integral for navigation, V2X communication, ADAS, and autonomous driving, innovations feature HD mapping, A…","Dublin, June 20, 2025 (GLOBE NEWSWIRE) -- The ""Automotive Data Cables Market Outlook 2025-2034"" has been added to ResearchAndMarkets.com's offering.
The global automotive digital mapping market is p… [+5249 chars]",newsapi,2025-06-20 10:51:00+00:00,"Automotive Data Cables Market Outlook 2025-2034 | V2X Technology Enhances Digital Mapping for Safer, Efficient Driving. The Automotive Digital Mapping Market is set to reach USD 9.6 billion by 2025, with a projected growth at 14.2% CAGR, hitting USD 31.7 billion by 2034. Integral for navigation, V2X communication, ADAS, and autonomous driving, innovations feature HD mapping, A…. ",0.360202,"The automotive digital mapping market will reach $9.6 billion by 2025, growing at a 14.2% CAGR. HD mapping and V2X technologies are critical innovations driving safer, efficient autonomous driving. Data startups should focus on digital mapping for navigation, ADAS, and V2X communication.
"
19,19,Elearningindustry.com,Data Privacy In AI-Powered L&D: Protecting Learner Information,https://elearningindustry.com/data-privacy-in-ai-powered-ld-protecting-learner-information,2025-06-21T19:00:46Z,"Worried about how AI affects learner data? Here, we show you practical strategies to strengthen data privacy when using AI in your L&D programs. From better vendor choices to encryption and learner transparency, discover how to protect personal information.
T…","Why Data Privacy Should Be A Priority When Using AI In L&amp;D
When you're using an AI-powered LMS for your training program, you may notice that the platform seems to know exactly how you learn bes… [+7745 chars]",newsapi,2025-06-21 19:00:46+00:00,"Data Privacy In AI-Powered L&D: Protecting Learner Information. Worried about how AI affects learner data? Here, we show you practical strategies to strengthen data privacy when using AI in your L&D programs. From better vendor choices to encryption and learner transparency, discover how to protect personal information.
T…. ",0.3545404,"AI-powered L&D requires careful vendor selection, prioritizing providers with robust data protection policies. Encryption is crucial, securing sensitive learner data both in transit and when stored; 73% cite encryption as essential. Transparency with learners about data collection and usage builds trust, vital for adoption of AI-driven L&D.
"
107,107,Fox News,10 signs your personal data is being sold online,https://www.foxnews.com/tech/10-signs-your-personal-data-being-sold-online,2025-06-18T14:00:52Z,A personal data protection guide revealing 10 signs your information is circulating among data brokers and practical strategies to regain control of your digital footprint.,"Your personal data is probably being sold right now. Scam calls, junk emails, and weird login alerts aren't random. They're warning signs that your information is being circulated through data broker… [+10570 chars]",newsapi,2025-06-18 14:00:52+00:00,10 signs your personal data is being sold online. A personal data protection guide revealing 10 signs your information is circulating among data brokers and practical strategies to regain control of your digital footprint.. ,0.34584352,"Personal data being sold causes scam calls, spam, and login alerts, signaling data broker activity. Data brokers compile and sell personal information, impacting nearly all internet users, showing broad reach. Recognizing suspicious activity and actively managing online presence are crucial steps to regain digital footprint control.
"
7,7,Torrentfreak.com,Sky Views Personal Data as a Potential Weapon in IPTV Piracy War,https://torrentfreak.com/sky-views-personal-data-as-new-weapon-in-iptv-piracy-war-250622/,2025-06-22T10:23:03Z,"Ireland's Data Protection Commission (DPC) says it has been ""engaging with Sky for some time"" over the use of personal data to crackdown on streaming piracy, including IPTV services accessed via set-top boxes. Ongoing engagement and a meeting between the DPC …","Sky’s war on TV piracy has raged for well over thirty years and despite the passing of time, the goal remains the same. 
In broad terms, pirates retain their original goals too, but how that can be … [+4915 chars]",newsapi,2025-06-22 10:23:03+00:00,"Sky Views Personal Data as a Potential Weapon in IPTV Piracy War. Ireland's Data Protection Commission (DPC) says it has been ""engaging with Sky for some time"" over the use of personal data to crackdown on streaming piracy, including IPTV services accessed via set-top boxes. Ongoing engagement and a meeting between the DPC …. ",0.31972295,"Sky is working with the DPC to combat IPTV piracy, potentially using personal data as a weapon. The DPC is actively ""engaging with Sky"" regarding their data use in anti-piracy efforts. Sky's decades-long fight against piracy indicates it views data as vital in the ongoing war.
"
59,59,Marketplace.org,"Bytes: Week in Review – Trump's mobile venture, online data brokers used to target MN victims, and an OpenAI-Microsoft breakup",https://www.marketplace.org/episode/2025/06/20/trumps-mobile-venture-openai-microsoft-breakup,2025-06-20T10:04:00Z,OpenAI and Microsoft are reportedly caught up in protracted behind-the-scenes negotiations that are in danger of boiling over into public conflict. Prosecutors say the man accused of assassinating a Minnesota Democratic lawmaker used online data brokers to he…,"OpenAI and Microsoft are reportedly caught up in protracted behind-the-scenes negotiations that are in danger of boiling over into public conflict. Plus, prosecutors say the man accused of assassinat… [+891 chars]",newsapi,2025-06-20 10:04:00+00:00,"Bytes: Week in Review – Trump's mobile venture, online data brokers used to target MN victims, and an OpenAI-Microsoft breakup. OpenAI and Microsoft are reportedly caught up in protracted behind-the-scenes negotiations that are in danger of boiling over into public conflict. Prosecutors say the man accused of assassinating a Minnesota Democratic lawmaker used online data brokers to he…. ",0.3180803,"OpenAI and Microsoft face contentious negotiations, risking a public conflict that could restructure AI partnerships. Data brokers were allegedly used to target a Minnesota lawmaker, exposing privacy vulnerabilities.
"
