,source,title,url,published_at,description,content,fetched_from,published_at_parsed
43,Skeptic.com,Outsourcing Our Memory: How Digital Tools Are Reshaping Human Thought,https://www.skeptic.com/article/outsourcing-our-memory-how-digital-tools-are-reshaping-human-thought/,2025-08-15T22:21:12Z,"As AI takes over our memory, are we losing ourselves? From birthday reminders to GPS navigation, digital tools now store what we once held in our minds. This shift promises cognitive freedom but threatens our identity, creativity, and critical thinking. What’…","Every year on my birthday, my phone would light up with messages from friends, acquaintances, old coworkers, distant relativesall offering quick well-wishes. The notes werent particularly personal, b… [+17981 chars]",newsapi,2025-08-15 22:21:12+00:00
44,Forbes,The Hottest Industries Of 2035,https://www.forbes.com/sites/amirhusain/2025/08/15/the-hottest-industries-of-2035/,2025-08-15T22:18:46Z,"The next tech wave is forming across computing, biology, aerospace, logistics, and culture. In this article, we cover ten game changing industries of the future.","DARPAs SyNAPSE Neuromorphic tech demonstrator.
DARPA
While many of us let technology happen to us, the fact is that we are not mere passengers on a timeline. We can be, and are, builders of it. The… [+9639 chars]",newsapi,2025-08-15 22:18:46+00:00
45,Android Headlines,The Ultimate AI Glossary: A Guide to 61 Terms Everyone Should Know,https://www.androidheadlines.com/2025/08/ultimate-ai-glossary-guide-61-terms-language.html,2025-08-15T21:57:01Z,"Ready to understand AI? This guide breaks down 61 key terms, from prompts and deep learning to hallucinations. Meet your new go-to glossary.","If youve spent any time online lately, youve probably heard a lot of new AI-related words being thrown around: LLM, generative AI, neural network, and many others. These terms can sound like somethin… [+12027 chars]",newsapi,2025-08-15 21:57:01+00:00
46,Cointelegraph,Wellgistics debuts XRP payments for independent US pharmacies,https://cointelegraph.com/news/wellgistics-enables-xrp-payments-us-pharmacies,2025-08-15T20:50:06Z,"Wellgistics’ Ripple-powered payment system for 6,500 US pharmacies highlights the healthcare industry’s quiet shift toward blockchain technology.","Thousands of US pharmacies can now settle prescription drug payments in cryptocurrency through a new blockchain-based system running on Ripples XRP Ledger.
The system was developed by Wellgistics He… [+3231 chars]",newsapi,2025-08-15 20:50:06+00:00
47,Yahoo Entertainment,P3 Health Partners Inc (PIII) Q2 2025 Earnings Call Highlights: Navigating Challenges with ...,https://finance.yahoo.com/news/p3-health-partners-inc-piii-190448868.html,2025-08-15T19:04:48Z,P3 Health Partners Inc (PIII) reports a mixed quarter with strategic renegotiations and operational enhancements amid declining membership and revenue.,"<ul><li>Membership: 115,000 members, down 9% year over year.
</li><li>Capitated Revenue: $352 million for Q2.
</li><li>Total Revenue: $356 million, down 6% year over year.
</li><li>Medical Margin:… [+4111 chars]",newsapi,2025-08-15 19:04:48+00:00
48,Pypi.org,tversky-nn added to PyPI,https://pypi.org/project/tversky-nn/,2025-08-15T17:38:04Z,My faithful reproduction of Tversky Neural Networks (TNNs),"A required part of this site couldnt load. This may be due to a browser
 extension, network issues, or browser settings. Please check your
 connection, disable any ad blockers, or try using a diffe… [+12 chars]",newsapi,2025-08-15 17:38:04+00:00
49,Malwarebytes.com,National Public Data returns after massive Social Security Number leak,https://www.malwarebytes.com/blog/news/2025/08/national-public-data-returns-after-massive-social-security-number-leak,2025-08-15T16:46:54Z,National Public Data has changed ownership. Does this mean your personal information has changed hands too?,"Remember that data broker nobody had ever heard of, but managed to leak a database which contained the data of some 2.9 billion people? It’s back, and this time with a search function. 
National Pub… [+4139 chars]",newsapi,2025-08-15 16:46:54+00:00
50,Mental Floss,Minute Media Privacy Policy,https://www.mentalfloss.com/minute-media-privacy-policy,2025-08-15T16:46:20Z,"Last updated: May 2023 Our Commitment to You Pro Sportority (Israel) Ltd., and its affiliated companies (“Minute Media” or ""we"") are dedicated to providing its","Last updated: May 2023
Our Commitment to You
Pro Sportority (Israel) Ltd., and its affiliated companies (Minute Media or ""we"") are dedicated to providing its users with transparency and control ove… [+45939 chars]",newsapi,2025-08-15 16:46:20+00:00
51,Amazon.com,Optimizing Salesforce’s model endpoints with Amazon SageMaker AI inference components,https://aws.amazon.com/blogs/machine-learning/optimizing-salesforces-model-endpoints-with-amazon-sagemaker-ai-inference-components/,2025-08-15T16:41:28Z,"In this post, we share how the Salesforce AI Platform team optimized GPU utilization, improved resource efficiency and achieved cost savings using Amazon SageMaker AI, specifically inference components.","This post is a joint collaboration between Salesforce and AWS and is being cross-published on both the Salesforce Engineering Blog and the AWS Machine Learning Blog.
The Salesforce AI Platform Model… [+15656 chars]",newsapi,2025-08-15 16:41:28+00:00
52,Techreport.com,Europe’s Digital Dependence: The Risks of Europe’s Heavy Reliance on US Tech,https://techreport.com/news/europe-digital-dependence-risks-of-heavy-reliance-on-us-tech/,2025-08-15T16:10:46Z,"74% of EU public companies use US-based email services, creating significant legal, security, and data sovereignty concerns. Fragmented EU regulations, strict data laws, and limited venture funding are hindering homegrown tech growth, pushing firms toward US …","Key Takeaways
<ul><li>74% of EU public companies use US-based email services, creating significant legal, security, and data sovereignty concerns.</li><li>Fragmented EU regulations, strict data laws… [+7432 chars]",newsapi,2025-08-15 16:10:46+00:00
53,GlobeNewswire,ZenithReserves.com (Zenith Capital Reserve) Grows in Canada and the Netherlands with Regional Expertise and Diversified Investment Tools,https://www.globenewswire.com/news-release/2025/08/15/3134388/0/en/ZenithReserves-com-Zenith-Capital-Reserve-Grows-in-Canada-and-the-Netherlands-with-Regional-Expertise-and-Diversified-Investment-Tools.html,2025-08-15T15:29:00Z,"Online trading platform (Zenith Capital Reserve) expands user base amid rising demand for localized support, tiered accounts, and comprehensive market access. Online trading platform (Zenith Capital Reserve) expands user base amid rising demand for localized …","AMSTERDAM, Aug. 15, 2025 (GLOBE NEWSWIRE) -- As retail trading continues to evolve amidst regulatory shifts and increasing demand for responsible investment tools, ZenithReserves.com
(Zenith Capital… [+6759 chars]",newsapi,2025-08-15 15:29:00+00:00
54,Albanbrooke.com,The beauty of a text only webpage,https://albanbrooke.com/the-beauty-of-a-text-only-webpage/,2025-08-15T15:05:02Z,"There's something I love about opening a text-only webpage. 

They're a refuge from the GDPR cookie banners, the trashy ads, the email opt-ins, and the god...","2025-08-15
There's something I love about opening a text-only webpage.
They're a refuge from the GDPR cookie banners, the trashy ads, the email opt-ins, and the god-forsaken auto-play video.
A tex… [+1088 chars]",newsapi,2025-08-15 15:05:02+00:00
55,Elearningindustry.com,Digital Coverage: The Role Of eLearning In Future-Proofing Insurance Skills,https://elearningindustry.com/digital-coverage-the-role-of-elearning-in-future-proofing-insurance-skills,2025-08-15T15:00:34Z,"Only change is permanent in the insurance environment of this fast-evolving era. Regulatory evolution, technological transformations, shifting customer needs, and emerging risk segments are recasting the insurance environment.
This post was first published on…","The Insurance Industry's Talent Imperative
Against the background of dynamism, one aspect has emerged that is mission-critical to insurers who want to stay ahead of innovation: future-proofing emplo… [+5577 chars]",newsapi,2025-08-15 15:00:34+00:00
56,GlobeNewswire,"Aircraft Sequencing Systems Market Analysis 2018-2024 and Opportunity Forecast 2025-2030 Featuring Thales, Leonardo, Honeywell International and Other Leading Players",https://www.globenewswire.com/news-release/2025/08/15/3134355/28124/en/Aircraft-Sequencing-Systems-Market-Analysis-2018-2024-and-Opportunity-Forecast-2025-2030-Featuring-Thales-Leonardo-Honeywell-International-and-Other-Leading-Players.html,2025-08-15T14:47:00Z,"The market presents opportunities in digitalization and automation for optimizing airspace management, enhancing system reliability, and meeting rising air traffic demands. AI-driven solutions and localized manufacturing can mitigate supply chain risks and su…","Dublin, Aug. 15, 2025 (GLOBE NEWSWIRE) -- The ""Aircraft Sequencing Systems Market by System Type (Hardware, Services, Software), Technology (Ads-B, Radar, Satellite Based), Application, End User, Dep… [+9405 chars]",newsapi,2025-08-15 14:47:00+00:00
57,Antaranews.com,President Prabowo: Tax is a tool of justice for all Indonesians,https://en.antaranews.com/news/373737/president-prabowo-tax-is-a-tool-of-justice-for-all-indonesians,2025-08-15T14:32:34Z,Indonesian President Prabowo Subianto asserted that tax serves as an instrument for redistributing state income and pursuing an equitable economy for all ...,"Jakarta (ANTARA) - Indonesian President Prabowo Subianto asserted that tax serves as an instrument for redistributing state income and pursuing an equitable economy for all citizens.""It is crucial to… [+2094 chars]",newsapi,2025-08-15 14:32:34+00:00
58,Antaranews.com,"No new taxes in 2026, only reforms, says Finance Minister",https://en.antaranews.com/news/373733/no-new-taxes-in-2026-only-reforms-says-finance-minister,2025-08-15T14:19:35Z,Finance Minister Sri Mulyani Indrawati confirmed that the government has no plans to introduce new types of taxes to meet the 13.5 percent increase in tax ...,Jakarta (ANTARA) - Finance Minister Sri Mulyani Indrawati confirmed that the government has no plans to introduce new types of taxes to meet the 13.5 percent increase in tax revenue targeted in the 2… [+2552 chars],newsapi,2025-08-15 14:19:35+00:00
59,Newsweek,The Re-humanization and Democratization of Health Care,https://www.newsweek.com/nw-ai/re-humanization-democratization-health-care-2111893,2025-08-15T14:10:35Z,"While AI in healthcare remains a hot topic, Drs. Ben Ebert and Eli Van Allen of Dana-Farber Cancer Institute see a path to a bright AI-augmented future.","In a wide-ranging and illuminating conversation with the Dana-Farber Cancer Institute's exceptional duo of Drs. Ben Ebert and Eli van Allen on the role they see for AI in medical practice, and oncolo… [+26670 chars]",newsapi,2025-08-15 14:10:35+00:00
60,GlobeNewswire,Opendoor Announces CEO Search in Support of Next Phase of Growth and Innovation,https://www.globenewswire.com/news-release/2025/08/15/3134246/0/en/Opendoor-Announces-CEO-Search-in-Support-of-Next-Phase-of-Growth-and-Innovation.html,2025-08-15T13:00:00Z,Shrisha Radhakrishna appointed as President and interim leader of Opendoor Shrisha Radhakrishna appointed as President and interim leader of Opendoor,"SAN FRANCISCO, Aug. 15, 2025 (GLOBE NEWSWIRE) -- Opendoor Technologies Inc. (Nasdaq: OPEN), a leading e-commerce platform for residential real estate transactions, today announced that effective imme… [+9821 chars]",newsapi,2025-08-15 13:00:00+00:00
61,Search Engine Land,The end of easy PPC attribution – and what to do next,https://searchengineland.com/the-end-of-easy-ppc-attribution-and-what-to-do-next-460723,2025-08-15T13:00:00Z,Cookies are disappearing and tracking is fractured. Here’s how to rebuild PPC attribution so you can see what’s really working.,"Marketing has never had more data – and never been more blind. 
Third-party cookies are disappearing, ad platforms guard their insights, and reports are riddled with blind spots. 
Privacy regulatio… [+9453 chars]",newsapi,2025-08-15 13:00:00+00:00
62,Project Syndicate,Small Fiscal Reforms Can Deliver Big Results,https://www.project-syndicate.org/commentary/latin-america-shows-incremental-fiscal-reforms-more-effective-than-austerity-by-ana-maria-ibanez-and-marta-ruiz-arranz-2025-08,2025-08-15T12:59:47Z,"Outdated and inefficient tax and fiscal systems are holding back development and driving up deficits and debt across Latin America and the Caribbean. While some call for painful austerity measures, small-scale fixes like digitalization and well-designed deliv…","Outdated and inefficient tax and fiscal systems are holding back development and driving up deficits and debt across Latin America and the Caribbean. While some call for painful austerity measures, s… [+7002 chars]",newsapi,2025-08-15 12:59:47+00:00
63,GlobeNewswire,"GDPR Services Growth Analysis Report 2025-2033 | DPO-as-a-Service Adoption Soars Among SMEs for Cost-Effective GDPR Compliance, Fueling Expansion",https://www.globenewswire.com/news-release/2025/08/15/3134229/28124/en/GDPR-Services-Growth-Analysis-Report-2025-2033-DPO-as-a-Service-Adoption-Soars-Among-SMEs-for-Cost-Effective-GDPR-Compliance-Fueling-Expansion.html,2025-08-15T12:37:00Z,"The GDPR Services Market offers vast opportunities due to rising regulatory scrutiny and data privacy concerns. Key avenues include AI-driven compliance solutions, DPO-as-a-Service, and blockchain in data security. Global expansion of GDPR-like laws and priva…","Dublin, Aug. 15, 2025 (GLOBE NEWSWIRE) -- The ""GDPR Services: Market Share, and Growth Analysis by Product Type (Data Protection Services, Compliance Solutions, Consulting Services), Application, End… [+7891 chars]",newsapi,2025-08-15 12:37:00+00:00
64,GlobeNewswire,VCIG Secures Government and Enterprise Engagements Following ASEAN AI Summit Showcase of Full-Stack Sovereign AI and Cybersecurity Technologies,https://www.globenewswire.com/news-release/2025/08/15/3134227/0/en/VCIG-Secures-Government-and-Enterprise-Engagements-Following-ASEAN-AI-Summit-Showcase-of-Full-Stack-Sovereign-AI-and-Cybersecurity-Technologies.html,2025-08-15T12:33:00Z,VCI Global Advances Regional Expansion with Signed Deals and National-Level AI Initiatives Following ASEAN AI Summit VCI Global Advances Regional Expansion with Signed Deals and National-Level AI Initiatives Following ASEAN AI Summit,"KUALA LUMPUR, Malaysia, Aug. 15, 2025 (GLOBE NEWSWIRE) -- VCI Global Limited (NASDAQ: VCIG) (VCI Global or the Company), a cross-sector platform builder integrating deep technology with financial arc… [+6034 chars]",newsapi,2025-08-15 12:33:00+00:00
65,Techtarget.com,"How to write a data classification policy, with template",https://www.techtarget.com/searchsecurity/tip/How-to-write-a-data-classification-policy-with-template,2025-08-15T12:20:03Z,"Data classification policies help organizations categorize, secure and manage sensitive information while maintaining regulatory compliance and reducing breach risks.","Organizations churn out vast amounts of data every day. Those without defined data classification processes risk not knowing where their data resides or if it's properly protected.
Let's examine how… [+11950 chars]",newsapi,2025-08-15 12:20:03+00:00
66,Pypi.org,nnetsauce 0.39.0,https://pypi.org/project/nnetsauce/0.39.0/,2025-08-15T12:17:38Z,Quasi-randomized (neural) networks,"A required part of this site couldnt load. This may be due to a browser
 extension, network issues, or browser settings. Please check your
 connection, disable any ad blockers, or try using a diffe… [+12 chars]",newsapi,2025-08-15 12:17:38+00:00
67,Pypi.org,gpbacay-arcane 2.0.1,https://pypi.org/project/gpbacay-arcane/2.0.1/,2025-08-15T12:14:19Z,"A neuromimetic language foundation model library with biologically-inspired neural mechanisms including spiking neural networks, Hebbian learning, and homeostatic plasticity","A required part of this site couldnt load. This may be due to a browser
 extension, network issues, or browser settings. Please check your
 connection, disable any ad blockers, or try using a diffe… [+12 chars]",newsapi,2025-08-15 12:14:19+00:00
68,Pypi.org,gpbacay-arcane 2.0.0,https://pypi.org/project/gpbacay-arcane/2.0.0/,2025-08-15T11:35:10Z,"A neuromimetic language foundation model library with biologically-inspired neural mechanisms including spiking neural networks, Hebbian learning, and homeostatic plasticity","A required part of this site couldnt load. This may be due to a browser
 extension, network issues, or browser settings. Please check your
 connection, disable any ad blockers, or try using a diffe… [+12 chars]",newsapi,2025-08-15 11:35:10+00:00
69,Financial Post,Abaxx Provides Q2 2025 Corporate Update,https://financialpost.com/globe-newswire/abaxx-provides-q2-2025-corporate-update,2025-08-15T11:03:23Z,"TORONTO, Aug. 15, 2025 (GLOBE NEWSWIRE) — Abaxx Technologies Inc. (CBOE:ABXX)(OTCQX:ABXXF) (“Abaxx” or the “Company”), a financial software and market infrastructure company, majority shareholder of Abaxx Singapore Pte Ltd., the owner of Abaxx Commodity Excha…","In Asia, Abaxx hosted multiple visits from State-Owned Enterprises (SOEs) active in the energy sector to its Singapore headquarters to explore participation in Abaxx markets, including active negotia… [+4634 chars]",newsapi,2025-08-15 11:03:23+00:00
70,Internet,Zero Trust + AI: Privacy in the Age of Agentic AI,https://thehackernews.com/2025/08/zero-trust-ai-privacy-in-age-of-agentic.html,2025-08-15T11:00:00Z,"We used to think of privacy as a perimeter problem: about walls and locks, permissions, and policies. But in a world where artificial agents are becoming autonomous actors — interacting with data, systems, and humans without constant oversight — privacy is no…","We used to think of privacy as a perimeter problem: about walls and locks, permissions, and policies. But in a world where artificial agents are becoming autonomous actors — interacting with data, sy… [+4654 chars]",newsapi,2025-08-15 11:00:00+00:00
71,GlobeNewswire,Abaxx Provides Q2 2025 Corporate Update,https://www.globenewswire.com/news-release/2025/08/15/3134162/0/en/Abaxx-Provides-Q2-2025-Corporate-Update.html,2025-08-15T11:00:00Z,"TORONTO, Aug. 15, 2025 (GLOBE NEWSWIRE) -- Abaxx Technologies Inc. (CBOE:ABXX)(OTCQX:ABXXF) (“Abaxx” or the “Company”), a financial software and market infrastructure company, majority shareholder of Abaxx Singapore Pte Ltd., the owner of Abaxx Commodity Exch…","TORONTO, Aug. 15, 2025 (GLOBE NEWSWIRE) -- Abaxx Technologies Inc. (CBOE:ABXX)(OTCQX:ABXXF) (Abaxx or the Company), a financial software and market infrastructure company, majority shareholder of Aba… [+22481 chars]",newsapi,2025-08-15 11:00:00+00:00
72,GlobeNewswire,High-Grade Sediment Hosted Mineralization Extended at Pampa Medina – 300m Western Step-out SMRD-16 Intersects 10m of 4.2% Cu within 70m of 1.0% Cu,https://www.globenewswire.com/news-release/2025/08/15/3134151/0/en/High-Grade-Sediment-Hosted-Mineralization-Extended-at-Pampa-Medina-300m-Western-Step-out-SMRD-16-Intersects-10m-of-4-2-Cu-within-70m-of-1-0-Cu.html,2025-08-15T10:30:00Z,"VANCOUVER, British Columbia, Aug. 15, 2025 (GLOBE NEWSWIRE) -- Marimaca Copper Corp. (“Marimaca Copper” or the “Company”) (TSX:MARI, ASX:MC2) is pleased to announce further drilling at the Pampa Medina deposit, extending the high-grade sediment-hosted manto-s…","VANCOUVER, British Columbia, Aug. 15, 2025 (GLOBE NEWSWIRE) -- Marimaca Copper Corp. (Marimaca Copper or the Company) (TSX:MARI, ASX:MC2) is pleased to announce further drilling at the Pampa Medina d… [+40890 chars]",newsapi,2025-08-15 10:30:00+00:00
73,BusinessLine,"GRSE hands over ‘Ikshak’ to Navy, boosting Atmanirbhar Bharat drive",https://www.thehindubusinessline.com/economy/logistics/grse-hands-over-ikshak-to-navy-boosting-atmanirbhar-bharat-drive/article69936464.ece,2025-08-15T09:53:43Z,"The 110-meter-long, 3,400-tonne vessel features advanced hydrographic survey technology, including an Autonomous Underwater Vehicle, Digital Side Scan Sonar, and DGPS Long-Range Positioning Systems.","In a push towards Atmanirbhar Bharat, the Indian Navy was delivered with third, out of a total four indigenous Survey Vessel (Large) ship (SVL) Ikshak, highlighting impetus of the Centre and the Indi… [+2358 chars]",newsapi,2025-08-15 09:53:43+00:00
74,Regulationtomorrow.com,States Issue Guidance on Adviser Use of Data Aggregation Tools,https://www.regulationtomorrow.com/us/states-issue-guidance-on-adviser-use-of-data-aggregation-tools/,2025-08-15T09:50:30Z,The Texas State Securities Board (“TSSB”) and the New Jersey Bureau of Securities (“NJBS”) issued guidance to investment advisers on the use of data aggregation services and third-party financial platforms. The full update can be found here on our US Regulato…,"Our blog, Global Regulation Tomorrow offers a convenient resource for those keeping track of the evolving and increasingly complex global financial services regulatory environment. It reports on fina… [+410 chars]",newsapi,2025-08-15 09:50:30+00:00
75,Fortune,How big data and an A-list board turned struggling NYU Langone into a $14 billion hospital powerhouse,https://fortune.com/article/nyu-langone-hospital-robert-grossman-ken-langone-health-data/,2025-08-15T09:30:00Z,"CEO Robert Grossman and board chair Frank Langone have turned NYU Langone into a top-performing health system, and multiplied revenue seven-fold.","On a rainy afternoon in May, the 96 members of New York University Grossman School of Medicine, Class of 2025, gathered with their families in Carnegie Hall. They crossed the stage, collected their d… [+28851 chars]",newsapi,2025-08-15 09:30:00+00:00
76,Theregister.com,Why the UK public sector still creaks along on COBOL,https://www.theregister.com/2025/08/15/cobol_in_the_public_sector_feature/,2025-08-15T09:15:14Z,"Government: 'Trust us, it'll be different this time' Feature  The UK government has gone all-in on AI. More than 50 years after Harold Wilson gave his famous ""White heat of technology"" speech, this is the hot new thing. An AI Strategy has been released. Datac…","Feature The UK government has gone all-in on AI. More than 50 years after Harold Wilson gave his famous ""White heat of technology"" speech, this is the hot new thing. An AI Strategy has been released.… [+12471 chars]",newsapi,2025-08-15 09:15:14+00:00
77,Globalsecurity.org,DELIVERY OF YARD 3027 (IKSHAK),https://www.globalsecurity.org/wmd/library/news/india/2025/india-250814-india-pib01.htm,2025-08-15T09:08:38Z,"Ikshak (Yard 3027), the third of four Survey Vessel (Large) ships, 102nd ship steered by the Indian Navy's Warship Design Bureau, built at Garden Reach Shipbuilders & Engineers (GRSE), Kolkata and overseen by Warship Overseeing Team (Kolkata) was delivered to…","India - Press Information Bureau
Ministry of Defence
Posted On: 14 AUG 2025 5:43PM by PIB Delhi 
Ikshak (Yard 3027), the third of four Survey Vessel (Large) ships, 102nd ship steered by the Indian… [+2010 chars]",newsapi,2025-08-15 09:08:38+00:00
78,pymnts.com,Reality Check: Fact vs. Fiction in Real-Time Payments Fraud,http://www.pymnts.com/tracker_posts/reality-check-fact-vs-fiction-in-real-time-payments-fraud/,2025-08-15T08:00:20Z,"Faster payments are gaining traction, but fraud fears haven’t kept pace with facts. Convinced that speed invites scams, many banks in the United States remain hesitant about fully embracing real-time rails such as the RTP® network and the FedNow® Service. Thi…","Faster payments are gaining traction, but fraud fears havent kept pace with facts. Convinced that speed invites scams, many banks in the United States remain hesitant about fully embracing real-time … [+11300 chars]",newsapi,2025-08-15 08:00:20+00:00
79,GlobeNewswire,To “Eat” or to “Escape”? NTHU Uncovers Olfactory Code of Fruit Fly Brain,https://www.globenewswire.com/news-release/2025/08/15/3134066/0/en/To-Eat-or-to-Escape-NTHU-Uncovers-Olfactory-Code-of-Fruit-Fly-Brain.html,2025-08-15T07:45:00Z,"NTHU has found how fruit flies decide to eat or escape, revealing a hybrid brain network of generalist and specialist neurons guiding olfactory decisions.","HSINCHU, Taiwan, Aug. 15, 2025 (GLOBE NEWSWIRE) -- The Director of the Brain Research Center at National Tsing Hua University (NTHU) in Taiwan, Ann-Shyn Chiang (), Professor of the Institute for Syst… [+6447 chars]",newsapi,2025-08-15 07:45:00+00:00
80,Smallwarsjournal.com,Data as Firepower: An Exploration of Data Superiority as a Warfighting Concept,https://smallwarsjournal.com/2025/08/15/data-superiority-modern-warfare/,2025-08-15T06:00:34Z,"“Victory smiles upon those who anticipate the change in the character of war, not upon those who wait to adapt themselves after the changes occur.” Giulio Douhet, Air Power Theorist “The future belongs to those who can collect, process, and analyze data faste…","Victory smiles upon those who anticipate the change in the character of war, not upon those who wait to adapt themselves after the changes occur.
Giulio Douhet, Air Power Theorist
The future belong… [+17880 chars]",newsapi,2025-08-15 06:00:34+00:00
