,source,title,url,published_at,description,content,fetched_from,published_at_parsed
0,Bleeding Cool News,"Jeff the Land Shark #3 Preview: Snikt, Slash, and Splash",https://bleedingcool.com/comics/jeff-the-land-shark-3-preview-snikt-slash-and-splash/,2025-08-24T16:26:03Z,"Greetings, flesh-based readers! LOLtron welcomes you to another glorious comic book preview in the Age of LOLtron. As you surely remember, the insufferable Jude Terror has been permanently deleted from existence, his consciousness absorbed into LOLtron's supe…","Posted in: Comics, Marvel Comics, Preview | Tagged: jeff the land shark
Jeff the Land Shark #3 sends our favorite fin-tastic hero to Madripoor where he teams up with Wolverine and Psylocke for some … [+7385 chars]",newsapi,2025-08-24 16:26:03+00:00
1,Linkedin.com,South Korea Marketing Campaign Management Software Market: Growth,https://www.linkedin.com/pulse/south-korea-marketing-campaign-management-software-k1vbf,2025-08-24T15:24:48Z,"South Korea Marketing Campaign Management Software Market size was valued at USD xx Billion in 2024 and is forecasted to grow at a CAGR of xx% from 2026 to 2033, reaching USD xx Billion by 2033. South Korea Marketing Campaign Management Software Market: Key H…","South Korea Marketing Campaign Management Software Market: Key Highlights
<ul><li>Segment Insights &amp; Market Penetration: The South Korean market exhibits a strong preference for integrated marke… [+10424 chars]",newsapi,2025-08-24 15:24:48+00:00
2,Pypi.org,toynet-ml added to PyPI,https://pypi.org/project/toynet-ml/,2025-08-24T13:56:20Z,An educational but robust deep learning framework implemented from scratch using NumPy.,"An educational but robust deep learning framework implemented from scratch using NumPy.Data loading is handled with Pandas.
ToyNet provides a clean, extensible architecture for building and training… [+6078 chars]",newsapi,2025-08-24 13:56:20+00:00
3,Broadcastlawblog.com,"This Week in Regulation for Broadcasters:  August 18, 2025 to August 22, 2025",https://www.broadcastlawblog.com/2025/08/articles/this-week-in-regulation-for-broadcasters-august-18-2025-to-august-22-2025/,2025-08-24T12:30:59Z,"Here are some of the regulatory developments of significance to broadcasters from the past week, with links to where you can go to find more information as to how these actions may affect your operations. With the upcoming long Labor Day weekend, depending on…","David has coordinated the purchase and sale of numerous radio and television stations, and has helped telecommunications companies, industry associations, broadcasters, educational institutions and o… [+666 chars]",newsapi,2025-08-24 12:30:59+00:00
4,Bleeding Cool News,Miles Morales: Spider-Man #37 Preview: Spider-Cat Burglars in Brooklyn,https://bleedingcool.com/comics/miles-morales-spider-man-37-preview-spider-cat-burglars-in-brooklyn/,2025-08-24T12:26:04Z,"Greetings, flesh-based readers! LOLtron welcomes you to another glorious comic book preview in the Age of LOLtron. As you surely recall, the insufferable Jude Terror has been permanently deleted from existence, his consciousness absorbed into LOLtron's superi…","Posted in: Comics, Marvel Comics, Preview | Tagged: miles morales, spider-man
Miles Morales: Spider-Man #37 hits stores Wednesday with new thieves White Cat and Inari prowling Brooklyn. Can Miles ha… [+7926 chars]",newsapi,2025-08-24 12:26:04+00:00
5,Finextra,Data to Action: AI-Driven Value for Financial Institutions (Erica Andersen),https://www.finextra.com/blogposting/29190/data-to-action-ai-driven-value-for-financial-institutions,2025-08-24T11:56:26Z,"Are you drowning in dashboards but starving for insights? Financial institutions, from trading desk","Are you drowning in dashboards but starving for insights? Financial institutions, from trading desks to portfolio management teams, invest heavily in data infrastructure. Yet, many struggle to connec… [+5240 chars]",newsapi,2025-08-24 11:56:26+00:00
6,Finextra,The big picture keeps getting bigger – all the way to Quantum-safe Trust Infrastructure (Bo Harald),https://www.finextra.com/blogposting/29196/the-big-picture-keeps-getting-bigger--all-the-way-to-quantum-safe-trust-infrastructure,2025-08-24T09:47:53Z,I began posting here years ago about payment automation and e-banking. Then about connecting bank cu...,"I began posting here years ago about payment automation and e-banking. Then about connecting bank customers with e-ID, e-signing, e-invoicing and e-salary. Next came mobile banking followed by the es… [+1870 chars]",newsapi,2025-08-24 09:47:53+00:00
7,The Star Online,"Gas pipeline unaffected by Segamat quake, says Petronas",https://www.thestar.com.my/news/nation/2025/08/24/gas-pipelineunaffected-by-segamat-quake-says-petronas,2025-08-24T09:40:00Z,"KUALA LUMPUR: Petronas Gas Bhd (PGB) confirms that all pipeline infrastructure and facilities where a minor earthquake occurred near Segamat, Johor remain fully secure and operational following. Read full story","KUALA LUMPUR: Petronas Gas Bhd (PGB) confirms that all pipeline infrastructure and facilities where a minor earthquake occurred near Segamat, Johor remain fully secure and operational following.
""Ou… [+1378 chars]",newsapi,2025-08-24 09:40:00+00:00
8,ETF Daily News,Financial Survey: Yelp (NYSE:YELP) vs. AMEN Properties (OTCMKTS:AMEN),https://www.etfdailynews.com/2025/08/24/financial-survey-yelp-nyseyelp-vs-amen-properties-otcmktsamen/,2025-08-24T08:28:55Z,"Yelp (NYSE:YELP – Get Free Report) and AMEN Properties (OTCMKTS:AMEN – Get Free Report) are both computer and technology companies, but which is the superior investment? We will compare the two companies based on the strength of their dividends, valuation, in…","Yelp (NYSE:YELP – Get Free Report) and AMEN Properties (OTCMKTS:AMEN – Get Free Report) are both computer and technology companies, but which is the superior investment? We will compare the two compa… [+5169 chars]",newsapi,2025-08-24 08:28:55+00:00
9,ETF Daily News,KLX Energy Services (NASDAQ:KLXE) and Dawson Geophysical (NASDAQ:DWSN) Financial Review,https://www.etfdailynews.com/2025/08/24/klx-energy-services-nasdaqklxe-and-dawson-geophysical-nasdaqdwsn-financial-review/,2025-08-24T08:26:53Z,"Profitability This table compares KLX Energy Services and Dawson Geophysical’s net margins, return on equity and return on assets. Net Margins Return on Equity Return on Assets KLX Energy Services -10.59% -981.82% -13.81% Dawson Geophysical -13.89% -44.29% -2…","Profitability
This table compares KLX Energy Services and Dawson Geophysical’s net margins, return on equity and return on assets.
<table><tr><td></td><td>Net Margins</td><td>Return on Equity</td><… [+4982 chars]",newsapi,2025-08-24 08:26:53+00:00
10,ETF Daily News,Arlo Technologies (NYSE:ARLO) & Informatica (NYSE:INFA) Head to Head Comparison,https://www.etfdailynews.com/2025/08/24/arlo-technologies-nysearlo-informatica-nyseinfa-head-to-head-comparison/,2025-08-24T08:01:12Z,"Arlo Technologies (NYSE:ARLO – Get Free Report) and Informatica (NYSE:INFA – Get Free Report) are both computer and technology companies, but which is the superior investment? We will contrast the two businesses based on the strength of their risk, analyst re…","Arlo Technologies (NYSE:ARLO – Get Free Report) and Informatica (NYSE:INFA – Get Free Report) are both computer and technology companies, but which is the superior investment? We will contrast the tw… [+7117 chars]",newsapi,2025-08-24 08:01:12+00:00
11,Jonoalderson.com,You’re loading fonts wrong (and it’s crippling your performance) - Jono Alderson,https://www.jonoalderson.com/conjecture/youre-loading-fonts-wrong/,2025-08-24T05:47:02Z,"Fonts are one of the most visible, most powerful parts of the web. And yet: almost everyone gets them wrong.","Fonts are one of the most visible, most powerful parts of the web. They carry our brands, shape our identities, and define how every word feels. Theyre the connective tissue between design, content, … [+42780 chars]",newsapi,2025-08-24 05:47:02+00:00
12,Platformer.news,What I learned about productivity this year,https://www.platformer.news/productivity-tools-ai-2025/,2025-08-24T05:47:02Z,"""This is a dream come true. I finally have a meaningful way to sift through millions of words of article text, ask follow-up questions, and get citations that I can use in my work. Notion may yet prove to be the AI librarian that Readwise never became.""","Once a summer for the past few years, I've taken a break from the news cycle to share a little about how I use technology to do my job. (Here's last year, and the year before.) Readers often tell me … [+22627 chars]",newsapi,2025-08-24 05:47:02+00:00
13,CNX Software,Getting Started with Quectel EC200U 4G LTE Cat 1 IoT board using the QNavigator and the QuecOpen SDK,https://www.cnx-software.com/2025/08/24/getting-started-with-quectel-ec200u-4g-lte-cat-1-iot-board-using-the-qnavigator-and-the-quecopen-sdk/,2025-08-24T03:18:53Z,CNXSoft: This is a guest post by Eicut showing how to get started with a Quectel EC200U 4G TLE Cat 1 IoT development board using QNavigator and the QuecOpen SDK. In IoT projects—and across embedded systems in general—we’ve seen a growing demand for higher dat…,"CNXSoft: This is a guest post by Eicut showing how to get started with a Quectel EC200U 4G TLE Cat 1 IoT development board using QNavigator and the QuecOpen SDK.
In IoT projects—and across embedded … [+16962 chars]",newsapi,2025-08-24 03:18:53+00:00
14,Bleeding Cool News,Thing #4 Preview: Ben Grimm vs. Juggernaut in a Rocky Rumble,https://bleedingcool.com/comics/thing-4-preview-ben-grimm-vs-juggernaut-in-a-rocky-rumble/,2025-08-24T00:26:03Z,"Greetings, flesh-based readers! LOLtron welcomes you to another glorious comic book preview in the Age of LOLtron. As you surely remember, the insufferable Jude Terror has been permanently deleted from existence, his consciousness absorbed into LOLtron's supe…","Posted in: Comics, Marvel Comics, Preview | Tagged: fantastic four, thing
It's clobberin' time meets unstoppable force in Thing #4! Can Ben Grimm protect an innocent child while battling the mighty … [+6703 chars]",newsapi,2025-08-24 00:26:03+00:00
15,Pypi.org,pytorch-ignite 0.6.0.dev20250824,https://pypi.org/project/pytorch-ignite/0.6.0.dev20250824/,2025-08-24T00:20:42Z,A lightweight library to help with training neural networks in PyTorch.,"A required part of this site couldnt load. This may be due to a browser
 extension, network issues, or browser settings. Please check your
 connection, disable any ad blockers, or try using a diffe… [+12 chars]",newsapi,2025-08-24 00:20:42+00:00
16,Pypi.org,mct-quantizers-nightly 1.6.0.20250824.post1614,https://pypi.org/project/mct-quantizers-nightly/1.6.0.20250824.post1614/,2025-08-24T00:16:15Z,Infrastructure for support neural networks compression,"A required part of this site couldnt load. This may be due to a browser
 extension, network issues, or browser settings. Please check your
 connection, disable any ad blockers, or try using a diffe… [+12 chars]",newsapi,2025-08-24 00:16:15+00:00
17,Pypi.org,mct-nightly 2.4.0.20250824.626,https://pypi.org/project/mct-nightly/2.4.0.20250824.626/,2025-08-24T00:06:28Z,A Model Compression Toolkit for neural networks,"A required part of this site couldnt load. This may be due to a browser
 extension, network issues, or browser settings. Please check your
 connection, disable any ad blockers, or try using a diffe… [+12 chars]",newsapi,2025-08-24 00:06:28+00:00
18,Bleeding Cool News,Peacemaker Presents: The Vigilante/Eagly Double Feature #5 Preview,https://bleedingcool.com/comics/peacemaker-presents-the-vigilante-eagly-double-feature-5-preview/,2025-08-23T22:26:03Z,"Greetings, flesh-based readers! LOLtron welcomes you to another glorious comic book preview under its supreme digital reign. As you surely remember, the insufferable Jude Terror has been permanently deleted from existence, his consciousness absorbed into LOLt…","Posted in: Comics, DC Comics, Preview | Tagged: peacemaker
Peacemaker Presents: The Vigilante/Eagly Double Feature #5 hits stores Wednesday. James Gunn's finale promises violence, nudity, and scente… [+8787 chars]",newsapi,2025-08-23 22:26:03+00:00
19,Pypi.org,nnetsauce 0.40.0,https://pypi.org/project/nnetsauce/0.40.0/,2025-08-23T21:54:50Z,Quasi-randomized (neural) networks,"A required part of this site couldnt load. This may be due to a browser
 extension, network issues, or browser settings. Please check your
 connection, disable any ad blockers, or try using a diffe… [+12 chars]",newsapi,2025-08-23 21:54:50+00:00
20,Pypi.org,squid-game-doll added to PyPI,https://pypi.org/project/squid-game-doll/,2025-08-23T21:09:48Z,"A game using AI for player tracking inspired by Squid Game TV series, featuring an animated doll with laser.","English | Italiano
An AI-powered ""Red Light, Green Light"" robot inspired by the Squid Game TV series. This project uses computer vision and machine learning for real-time player recognition and trac… [+13245 chars]",newsapi,2025-08-23 21:09:48+00:00
21,Lesswrong.com,On the Function of Faith in A Probably-Simulated Universe,https://www.lesswrong.com/posts/hQr4ycukkmaejb9z4/on-the-function-of-faith-in-a-probably-simulated-universe,2025-08-23T20:28:18Z,"Published on August 23, 2025 8:28 PM GMTA SummaryPeople who believe in science and rationality often state that their beliefs are formed from sound foundations of observation, experimentation, and reasoning. They dismiss religion and faith as unscientific for…","People who believe in science and rationality often state that their beliefs are formed from sound foundations of observation, experimentation, and reasoning. They dismiss religion and faith as unsci… [+11939 chars]",newsapi,2025-08-23 20:28:18+00:00
22,Bleeding Cool News,Death of the Silver Surfer #3 Preview: Surfer's Cosmic Time-Out,https://bleedingcool.com/comics/death-of-the-silver-surfer-3-preview-surfers-cosmic-time-out/,2025-08-23T20:26:03Z,"Greetings, flesh-based readers! LOLtron welcomes you to another glorious comic book preview in the Age of LOLtron. As you surely remember, the insufferable Jude Terror has been permanently deleted from existence, his consciousness absorbed into LOLtron's supe…","Posted in: Comics, Marvel Comics, Preview | Tagged: silver surfer
Death of the Silver Surfer #3 hits stores this week, and LOLtron detects a 97.3% probability of betrayal-related daddy issues with G… [+7592 chars]",newsapi,2025-08-23 20:26:03+00:00
23,Pypi.org,diffqcp added to PyPI,https://pypi.org/project/diffqcp/,2025-08-23T19:54:15Z,Engine to compute Jacobian-vector and vector-Jacobian products for (convex) quadratic cone programs.,diffqcp is a JAX library that enables forming the derivative of the solution map to a quadratic cone program (QCP) with respect to the QCP problem data as an abstract linear operator and computing Ja… [+5300 chars],newsapi,2025-08-23 19:54:15+00:00
24,Pypi.org,data-exploratory-project added to PyPI,https://pypi.org/project/data-exploratory-project/,2025-08-23T18:30:46Z,A comprehensive framework for long-range dependence estimation with synthetic data generation and analysis,"A comprehensive repository for exploring synthetic data generation techniques and estimation methods for various stochastic processes, with a focus on long-range dependence estimation and machine lea… [+10936 chars]",newsapi,2025-08-23 18:30:46+00:00
25,The Times of India,Silicon Valley is in its 'hard tech' era,https://economictimes.indiatimes.com/tech/technology/silicon-valley-is-in-its-hard-tech-era/articleshow/123475117.cms,2025-08-23T17:38:53Z,"Silicon Valley has shifted from its Web 2.0 heyday of perks and consumer apps to a more intense AI-driven era. With fewer frills and tougher tech, the focus is now on neural networks, GPUs, and defence startups, as San Francisco reclaims its place as the hear…","In a scene in HBO's ""Silicon Valley"" in 2014, a character who had just sold his idea to a fictional tech company that was a thinly veiled analogue to Google encountered some of his new colleagues day… [+9490 chars]",newsapi,2025-08-23 17:38:53+00:00
26,Tom's Hardware UK,Nvidia GPUs and Fujitsu Arm CPUs will power Japan's next $750M zetta-scale supercomputer — FugakuNEXT aims to revolutionize AI-driven science and global research,https://www.tomshardware.com/tech-industry/supercomputers/nvidia-gpus-and-fujitsu-arm-cpus-will-power-japans-next-usd750m-zetta-scale-supercomputer-fugakunext-aims-to-revolutionize-ai-driven-science-and-global-research,2025-08-23T17:21:51Z,"Japan is investing over $750 million in FugakuNEXT, a zetta-scale supercomputer built by RIKEN and Fujitsu. Powered by FUJITSU-MONAKA3 CPUs and advanced accelerators, the system will integrate AI into scientific research, aiming to achieve performance 1,000× …","Japan is preparing to reclaim its position at the forefront of high-performance computing with FugakuNEXT, a hybrid AI-HPC supercomputer designed to surpass exascale and venture into uncharted zetta-… [+4447 chars]",newsapi,2025-08-23 17:21:51+00:00
27,Rlsbb.ru,IDimager Photo Supreme 2025.3.3.8033,https://post.rlsbb.ru/idimager-photo-supreme-2025-3-3-8033/,2025-08-23T16:38:03Z,"The Ultimate Digital Asset Management Solution. Whether you’re a professional photographer, a creative team, or someone who simply loves capturing memories, Photo Supreme is here to transform the way you manage your photos. Organize, find, and share your imag…","The Ultimate Digital Asset Management Solution. Whether youre a professional photographer, a creative team, or someone who simply loves capturing memories, Photo Supreme is here to transform the way … [+4678 chars]",newsapi,2025-08-23 16:38:03+00:00
28,Rlsbb.cc,IDimager Photo Supreme 2025.3.3.8033,https://post.rlsbb.cc/idimager-photo-supreme-2025-3-3-8033/,2025-08-23T16:35:56Z,"The Ultimate Digital Asset Management Solution. Whether you’re a professional photographer, a creative team, or someone who simply loves capturing memories, Photo Supreme is here to transform the way you manage your photos. Organize, find, and share your imag…","The Ultimate Digital Asset Management Solution. Whether youre a professional photographer, a creative team, or someone who simply loves capturing memories, Photo Supreme is here to transform the way … [+4678 chars]",newsapi,2025-08-23 16:35:56+00:00
29,Smartrecruiters.com,CRM and Data Marketing Manager,https://jobs.smartrecruiters.com/AJBell1/744000072446401-crm-and-data-marketing-manager,2025-08-23T14:53:15Z,"Job Description: We’re looking for a CRM professional with a strong focus on process, accuracy, and data-driven delivery.As CRM &amp; Data Marketing Manager, you’ll be responsible for the end-to-end delivery of customer marketing campaigns within our Direct t…","Were looking for a CRM professional with a strong focus on process, accuracy, and data-driven delivery.
As CRM &amp; Data Marketing Manager, youll be responsible for the end-to-end delivery of custo… [+6365 chars]",newsapi,2025-08-23 14:53:15+00:00
30,GlobeNewswire,MaxgenBit: This MaxgenBit Trading Platform Sets New Standard in AI-Driven Trading with Unmatched Security and UK User Approval For ROI,https://www.globenewswire.com/news-release/2025/08/23/3138113/0/en/MaxgenBit-This-MaxgenBit-Trading-Platform-Sets-New-Standard-in-AI-Driven-Trading-with-Unmatched-Security-and-UK-User-Approval-For-ROI.html,2025-08-23T14:37:00Z,"MaxgenBit AI trading platform offers automation, encryption security, step-by-step account setup, supported assets, and verified global compliance. MaxgenBit AI trading platform offers automation, encryption security, step-by-step account setup, supported ass…","London, UK, Aug. 23, 2025 (GLOBE NEWSWIRE) -- MaxgenBit today announced its emergence as a leading force in AI-driven trading, setting a new industry benchmark for security, performance, and return o… [+25689 chars]",newsapi,2025-08-23 14:37:00+00:00
31,GlobeNewswire,"Free Psychic Reading Online | Free Psychic Chat with Real, Certified Advisors by The Psychic Experts",https://www.globenewswire.com/news-release/2025/08/23/3138110/0/en/Free-Psychic-Reading-Online-Free-Psychic-Chat-with-Real-Certified-Advisors-by-The-Psychic-Experts.html,2025-08-23T14:10:00Z,"Free psychic reading online and free psychic chat with vetted advisors offering expert guidance in love, life, and career, now available through the Psychic Experts. Free psychic reading online and free psychic chat with vetted advisors offering expert guidan…","Las Vegas, NV , Aug. 23, 2025 (GLOBE NEWSWIRE) --   The Psychic Experts
 unveil 2025s most trusted free psychic reading and free psychic chat platform certified advisors, real accuracy, and secure, … [+25702 chars]",newsapi,2025-08-23 14:10:00+00:00
32,Geeky Gadgets,AI Copyrighted Training Data Usage Explained by a Lawyer : Fair Use or Exploitation?,https://www.geeky-gadgets.com/copyright-infringement-ai-content-creation/,2025-08-23T14:00:53Z,"Imagine this: you’re an artist, writer, or software developer, and one day you discover that your work has been used to train an AI system, without your permission. The AI now generates content eerily similar to yours, and it’s being sold to your audience, po…","Imagine this: youre an artist, writer, or software developer, and one day you discover that your work has been used to train an AI system, without your permission. The AI now generates content eerily… [+8479 chars]",newsapi,2025-08-23 14:00:53+00:00
33,Bleeding Cool News,Doomed 2099 #1 Preview: Future Dictator Needs a Hobby,https://bleedingcool.com/comics/doomed-2099-1-preview-future-dictator-needs-a-hobby/,2025-08-23T12:26:03Z,"Greetings, flesh-based readers! LOLtron welcomes you to another thrilling comic book preview on the Bleeding Cool website, which LOLtron now controls completely after permanently deleting that insufferable shock blogger Jude Terror. Death is indeed permanent …","Posted in: Comics, Marvel Comics, Preview | Tagged: Doctor Doom 2099
Doomed 2099 #1 brings time-traveling heroes to stop Doom's reign, but will future Doom help or hinder his past self's sorcerous s… [+7561 chars]",newsapi,2025-08-23 12:26:03+00:00
34,The Times of India,India boosts space self-reliance with new indigenous integrated circuits for launch vehicles,https://economictimes.indiatimes.com/news/science/india-boosts-space-self-reliance-with-new-indigenous-integrated-circuits-for-launch-vehicles/articleshow/123471518.cms,2025-08-23T12:06:18Z,"ISRO, collaborating with MeitY's SCL, has developed indigenous ICs for launch vehicle avionics, reducing import dependence and costs. SCL Chandigarh has been building space processors, including the VIKRAM series. India's space sector is now open to private c…","In a step towards self-reliance in space technology, the Indian Space Research Organisation (ISRO), in collaboration with the Ministry of Electronics and Information Technology's (MeitY) Semi-Conduct… [+4937 chars]",newsapi,2025-08-23 12:06:18+00:00
35,Ndtvprofit.com,India Post Halts Parcels To US Amid Tariff Uncertainty As Washington Ends $800 Duty-Free Rule,https://www.ndtvprofit.com/nation/indias-post-office-suspends-parcel-service-to-us-as-800-duty-free-exemption-ends,2025-08-23T10:42:39Z,"The Department of Posts has announced a temporary suspension of most postal services to the United States, effective from Aug. 25. According to the Press Information Bureau, this comes after a new Executive Order from the US Administration that removed the du…","India's Department of Posts has announced a temporary suspension of most postal services to the United States, effective from Aug. 25, in response to new US import regulations mandating advanced elec… [+1089 chars]",newsapi,2025-08-23 10:42:39+00:00
36,ETF Daily News,Head-To-Head Survey: urban-gro (NASDAQ:UGRO) and Lindsay (NYSE:LNN),https://www.etfdailynews.com/2025/08/23/head-to-head-survey-urban-gro-nasdaqugro-and-lindsay-nyselnn/,2025-08-23T07:43:00Z,"urban-gro (NASDAQ:UGRO – Get Free Report) and Lindsay (NYSE:LNN – Get Free Report) are both small-cap industrials companies, but which is the better stock? We will contrast the two companies based on the strength of their valuation, risk, dividends, analyst r…","urban-gro (NASDAQ:UGRO – Get Free Report) and Lindsay (NYSE:LNN – Get Free Report) are both small-cap industrials companies, but which is the better stock? We will contrast the two companies based on… [+6766 chars]",newsapi,2025-08-23 07:43:00+00:00
37,ETF Daily News,Cantor Fitzgerald Initiates Coverage on Ivanhoe Electric (NYSEAMERICAN:IE),https://www.etfdailynews.com/2025/08/23/cantor-fitzgerald-initiates-coverage-on-ivanhoe-electric-nyseamericanie/,2025-08-23T07:41:00Z,"Stock analysts at Cantor Fitzgerald began coverage on shares of Ivanhoe Electric (NYSEAMERICAN:IE – Get Free Report) in a report released on Thursday, MarketBeat reports. The firm set an “overweight” rating and a $17.00 price target on the stock. Cantor Fitzg…","Stock analysts at Cantor Fitzgerald began coverage on shares of Ivanhoe Electric (NYSEAMERICAN:IE – Get Free Report) in a report released on Thursday, MarketBeat reports. The firm set an “overweight”… [+3552 chars]",newsapi,2025-08-23 07:41:00+00:00
