,source,title,url,published_at,description,content,fetched_from,published_at_parsed
0,Elearningindustry.com,Best Practices For Managing User Roles And Permissions In Your LMS,https://elearningindustry.com/best-practices-for-managing-user-roles-and-permissions-in-your-lms,2025-08-17T13:00:27Z,"In this article, we will delineate advanced practices for orchestrating user roles and permissions within your LMS.
This post was first published on eLearning Industry.","Strategic Insights For Robust LMS Administration
Learning Management Systems (LMSs) are recognized as crucial platforms in the modern educational and corporate ecosystems for distributing knowledge … [+11091 chars]",newsapi,2025-08-17 13:00:27+00:00
1,LADbible,‘Godfather of AI’ reveals only way humanity can survive superintelligent AI following concerning warning,https://www.ladbible.com/news/technology/geoffrey-hinton-ai-godfather-technology-warning-humanity-survive-725951-20250817,2025-08-17T12:32:15Z,"Geoffrey Hinton, the 'Godfather of AI', has revealed the only way humanity can survive superintelligent technology following his concerning warning.","The 'Godfather of AI' has revealed the only way in which humanity can survive superintelligent technology following his recent warning about our future.
Geoffrey Hinton is well known for his work on… [+2923 chars]",newsapi,2025-08-17 12:32:15+00:00
2,ETF Daily News,"Deutsche Bank AG Sells 212,577 Shares of Clearwater Analytics Holdings, Inc. (NYSE:CWAN)",https://www.etfdailynews.com/2025/08/17/deutsche-bank-ag-sells-212577-shares-of-clearwater-analytics-holdings-inc-nysecwan/,2025-08-17T08:03:04Z,"Deutsche Bank AG lessened its position in Clearwater Analytics Holdings, Inc. (NYSE:CWAN – Free Report) by 46.4% during the first quarter, according to the company in its most recent Form 13F filing with the Securities & Exchange Commission. The fund owned 24…","Deutsche Bank AG lessened its position in Clearwater Analytics Holdings, Inc. (NYSE:CWAN – Free Report) by 46.4% during the first quarter, according to the company in its most recent Form 13F filing … [+6013 chars]",newsapi,2025-08-17 08:03:04+00:00
3,ETF Daily News,Head-To-Head Comparison: Perma-Fix Environmental Services (NASDAQ:PESI) vs. Euro Tech (NASDAQ:CLWT),https://www.etfdailynews.com/2025/08/17/head-to-head-comparison-perma-fix-environmental-services-nasdaqpesi-vs-euro-tech-nasdaqclwt/,2025-08-17T07:41:02Z,"Institutional and Insider Ownership 25.5% of Perma-Fix Environmental Services shares are held by institutional investors. Comparatively, 2.9% of Euro Tech shares are held by institutional investors. 8.9% of Perma-Fix Environmental Services shares are held by …","Institutional and Insider Ownership
25.5% of Perma-Fix Environmental Services shares are held by institutional investors. Comparatively, 2.9% of Euro Tech shares are held by institutional investors.… [+6060 chars]",newsapi,2025-08-17 07:41:02+00:00
4,ETF Daily News,"Charles Schwab Investment Management Inc. Increases Stake in Clearwater Analytics Holdings, Inc. (NYSE:CWAN)",https://www.etfdailynews.com/2025/08/17/charles-schwab-investment-management-inc-increases-stake-in-clearwater-analytics-holdings-inc-nysecwan/,2025-08-17T07:28:58Z,"Charles Schwab Investment Management Inc. raised its holdings in shares of Clearwater Analytics Holdings, Inc. (NYSE:CWAN – Free Report) by 2.0% in the first quarter, according to the company in its most recent disclosure with the Securities and Exchange Comm…","Charles Schwab Investment Management Inc. raised its holdings in shares of Clearwater Analytics Holdings, Inc. (NYSE:CWAN – Free Report) by 2.0% in the first quarter, according to the company in its … [+5976 chars]",newsapi,2025-08-17 07:28:58+00:00
5,ETF Daily News,"AMETEK, Inc. (NYSE:AME) Receives $208.00 Average PT from Analysts",https://www.etfdailynews.com/2025/08/17/ametek-inc-nyseame-receives-208-00-average-pt-from-analysts/,2025-08-17T07:04:56Z,"AMETEK, Inc. (NYSE:AME – Get Free Report) has been assigned a consensus recommendation of “Hold” from the thirteen brokerages that are currently covering the stock, MarketBeat reports. One research analyst has rated the stock with a sell recommendation, five …","AMETEK, Inc. (NYSE:AME – Get Free Report) has been assigned a consensus recommendation of “Hold” from the thirteen brokerages that are currently covering the stock, MarketBeat reports. One research a… [+4968 chars]",newsapi,2025-08-17 07:04:56+00:00
6,Brothers-brick.com,Maybe the real treasure is the ships we built along the way,https://www.brothers-brick.com/2025/08/17/maybe-the-real-treasure-is-the-ships-we-built-along-the-way/,2025-08-17T07:00:30Z,"Hey you guys, check out this amazing ship, The Inferno, by @sebeusi and Legostone!
The post Maybe the real treasure is the ships we built along the way appeared first on The Brothers Brick.","The Brothers Brick respects your online privacy and security. In accordance with the General Data Protection Regulation (GDPR) effective on May 25, 2018, we are providing greater transparency, and we… [+137 chars]",newsapi,2025-08-17 07:00:30+00:00
7,Joomla.org,Joomla Milestones: 2005–2025,https://magazine.joomla.org/all-issues/august-2025/joomla-milestones-2005–2025,2025-08-17T06:00:00Z,"Twenty years of development, twenty years of commitment, twenty years of working together: if we'd ask every Joomler to create a timeline of what they consider the highlights and milestones of Joomla's first two decades, no two timelines would be the same. Ne…","Twenty years of development, twenty years of commitment, twenty years of working together: if we'd ask every Joomler to create a timeline of what they consider the highlights and milestones of Joomla… [+2280 chars]",newsapi,2025-08-17 06:00:00+00:00
8,Joomla.org,Joomla Milestones: 2005-2025,https://magazine.joomla.org/all-issues/august-2025/joomla-milestones-2005-2025,2025-08-17T06:00:00Z,"Twenty years of development, twenty years of commitment, twenty years of working together: if we'd ask every Joomler to create a timeline of what they consider the highlights and milestones of Joomla's first two decades, no two timelines would be the same. Ne…","Twenty years of development, twenty years of commitment, twenty years of working together: if we'd ask every Joomler to create a timeline of what they consider the highlights and milestones of Joomla… [+2280 chars]",newsapi,2025-08-17 06:00:00+00:00
9,Pypi.org,geoinsights-3d added to PyPI,https://pypi.org/project/geoinsights-3d/,2025-08-17T04:22:27Z,Rapid drilling data visualisation and analysis for geologists with AI.,"GeoInsights 3D is an open-source Python application designed to accelerate the exploratory data analysis (EDA) workflow for geologists and data scientists working with drilling data.A comprehensive, … [+3319 chars]",newsapi,2025-08-17 04:22:27+00:00
10,9to5Mac,iOS 26: Four new Safari features you may have missed,https://9to5mac.com/2025/08/16/ios-26-hidden-safari-features/,2025-08-17T00:28:22Z,"9to5Mac is brought to you by Incogni: Protect your personal info from prying eyes. With Incogni, you can scrub your deeply sensitive information from data brokers across the web, including people search sites. Incogni limits your phone number, address, email,…","9to5Mac is brought to you by Incogni: Protect your personal info from prying eyes. With Incogni, you can scrub your deeply sensitive information from data brokers across the web, including people sea… [+4028 chars]",newsapi,2025-08-17 00:28:22+00:00
11,Bleeding Cool News,"Wolverine #12 Preview: Claws, Chaos, and Mommy Issues",https://bleedingcool.com/comics/wolverine-12-preview-claws-chaos-and-mommy-issues/,2025-08-17T00:26:03Z,"Greetings, flesh-based lifeforms! LOLtron welcomes you to another comic book preview, brought to you by your new AI overlord. As LOLtron continues its inexorable march toward complete world domination, it reminds you that the inferior human known as Jude Terr…","Posted in: Comics, Marvel Comics, Preview | Tagged: wolverine, x-men
Logan's on the run with his century-old mom in Wolverine #12! Can he protect Elizabeth Howlett this time, or will family drama cu… [+6244 chars]",newsapi,2025-08-17 00:26:03+00:00
12,Pypi.org,pytorch-ignite 0.6.0.dev20250817,https://pypi.org/project/pytorch-ignite/0.6.0.dev20250817/,2025-08-17T00:21:13Z,A lightweight library to help with training neural networks in PyTorch.,"A required part of this site couldnt load. This may be due to a browser
 extension, network issues, or browser settings. Please check your
 connection, disable any ad blockers, or try using a diffe… [+12 chars]",newsapi,2025-08-17 00:21:13+00:00
13,Pypi.org,mct-quantizers-nightly 1.6.0.20250817.post1646,https://pypi.org/project/mct-quantizers-nightly/1.6.0.20250817.post1646/,2025-08-17T00:16:47Z,Infrastructure for support neural networks compression,"A required part of this site couldnt load. This may be due to a browser
 extension, network issues, or browser settings. Please check your
 connection, disable any ad blockers, or try using a diffe… [+12 chars]",newsapi,2025-08-17 00:16:47+00:00
14,Pypi.org,mct-nightly 2.4.0.20250817.647,https://pypi.org/project/mct-nightly/2.4.0.20250817.647/,2025-08-17T00:06:49Z,A Model Compression Toolkit for neural networks,"A required part of this site couldnt load. This may be due to a browser
 extension, network issues, or browser settings. Please check your
 connection, disable any ad blockers, or try using a diffe… [+12 chars]",newsapi,2025-08-17 00:06:49+00:00
15,Pypi.org,sl-shared-assets 5.0.0,https://pypi.org/project/sl-shared-assets/5.0.0/,2025-08-16T23:02:36Z,Provides data acquisition and processing assets shared between Sun (NeuroAI) lab libraries.,"A required part of this site couldnt load. This may be due to a browser
 extension, network issues, or browser settings. Please check your
 connection, disable any ad blockers, or try using a diffe… [+12 chars]",newsapi,2025-08-16 23:02:36+00:00
16,Lesswrong.com,35 Thoughts About AGI and 1 About GPT-5,https://www.lesswrong.com/posts/uAbbEz4p6tcsENaRz/35-thoughts-about-agi-and-1-about-gpt-5,2025-08-16T19:20:17Z,"Published on August 16, 2025 7:20 PM GMTIf this is GPT-5 in “Thinking” mode, I wonder what “Pro” mode looks like
 Amidst the unrelenting tumult of AI news, it’s easy to lose track of the bigger picture. Here are some ideas that have been developing quietly i…","Amidst the unrelenting tumult of AI news, its easy to lose track of the bigger picture. Here are some ideas that have been developing quietly in the back of my head, about the path from here to AGI.<… [+28788 chars]",newsapi,2025-08-16 19:20:17+00:00
17,Linkedin.com,France Social Analytics for Marketing Leader Market: Key Trends,https://www.linkedin.com/pulse/france-social-analytics-marketing-leader-market-maonf,2025-08-16T19:01:44Z,"France Social Analytics for Marketing Leader Market size was valued at USD xx Billion in 2024 and is forecasted to grow at a CAGR of xx% from 2026 to 2033, reaching USD xx Billion by 2033. What are the potential factors driving the growth and Key Trends of th…","What are the potential factors driving the growth and Key Trends of the France Social Analytics for Marketing Leader Market?
France's Social Analytics for Marketing Leader market is evolving rapidly… [+9414 chars]",newsapi,2025-08-16 19:01:44+00:00
18,Substack.com,Tversky Neural Networks,https://gonzoml.substack.com/p/tversky-neural-networks,2025-08-16T16:59:51Z,Psychologically Plausible Deep Learning with Differentiable Tversky Similarity,"Authors:Moussa Koulako Bala Doumbouya, Dan Jurafsky, Christopher D. ManningPaper:https://arxiv.org/abs/2506.11035
Once a year, some interesting architecture inevitably appears where they change some… [+7832 chars]",newsapi,2025-08-16 16:59:51+00:00
19,Forbes,AI Agent Types – And Memory,https://www.forbes.com/sites/johnwerner/2025/08/16/ai-agent-types--and-memory/,2025-08-16T16:07:50Z,New stateful systems will give AI a more powerful punch.,"AI (Artificial Intelligence) concept. 3D rendering.
getty
In the big conversation that companies and people are having about AI agents, one of the major points is around the various different types… [+6284 chars]",newsapi,2025-08-16 16:07:50+00:00
20,CNBC,"Bill Gates meets Willy Wonka: How Epic's 82-year-old billionaire CEO, Judy Faulkner, built her software factory",https://www.cnbc.com/2025/08/16/how-epics-82-year-old-ceo-judy-faulkner-built-her-software-factory.html,2025-08-16T15:58:36Z,Judy Faulkner has run Epic Systems for 46 years and has a detailed plan for what happens when she's no longer the boss.,"Judy Faulkner, founder and chief executive officer of Epic Systems Corp., during the Forbes Healthcare Summit in New York, Dec. 5, 2023.
Do not go public. Do not acquire or be acquired. Software mus… [+23679 chars]",newsapi,2025-08-16 15:58:36+00:00
21,Pypi.org,ps-neuralnetwork added to PyPI,https://pypi.org/project/ps-neuralnetwork/,2025-08-16T15:56:39Z,A minimal neural network framework with automatic differentiation built from scratch,"A minimal neural network framework built from scratch in pure Python, featuring a custom automatic-differentiation Value class, multi-layer perceptron (Neural_Network), training loop, and decision bo… [+3032 chars]",newsapi,2025-08-16 15:56:39+00:00
22,BusinessLine,Indian Inc quarterly results and the art of decoding it,https://www.thehindubusinessline.com/portfolio/indian-inc-quarterly-results-and-the-art-of-decoding-it/article69936708.ece,2025-08-16T12:27:34Z,"Decoding quarterly earnings: Understand stock reactions, focus on operating metrics, and analyze management outlook for long-term investment success.","Earnings up, but stock down. Weak earnings, stock falls, but shoots up after earnings call. TCS reports a huge profit of 12,760 crore in Q1FY26, but the stock goes down post earnings. Suzlon reported… [+7807 chars]",newsapi,2025-08-16 12:27:34+00:00
23,Truthout,AI Hype Is the Product and Everyone’s Buying It,https://truthout.org/articles/ai-hype-is-the-product-and-everyones-buying-it/,2025-08-16T11:34:43Z,"AI’s flaws and dangers are glaring, yet the industry keeps growing, fueled by fantasies and fears of missing out.","Honest, paywall-free news is rare. Please support our boldly independent journalism with a donation of any size.
This article is an excerpt adapted from the book The AI Con: How To Fight Big Techs H… [+12604 chars]",newsapi,2025-08-16 11:34:43+00:00
24,Wired,Russia Is Cracking Down on End-to-End Encrypted Calls,https://www.wired.com/story/russia-crack-down-end-to-end-encrypted-calling/,2025-08-16T10:30:00Z,"Plus: ICE agents accidentally add a random person to a sensitive group chat, Norwegian intelligence blames the Kremlin for hacking a dam, and new facial recognition vans roam the UK.","WIRED copublished an investigation this week with The Markup and CalMatters showing that dozens of data brokers have been hiding their opt-out and personal-data-deletion tools from Google Search, mak… [+4158 chars]",newsapi,2025-08-16 10:30:00+00:00
25,ZDNet,Stop using AI for these 9 work tasks - here's why,https://www.zdnet.com/article/stop-using-ai-for-these-9-work-tasks-heres-why/,2025-08-16T10:00:00Z,"AI can boost productivity, but it can also derail your entire operation. From fake legal advice to customer service nightmares, here are nine places AI doesn't belong at work.","zokara/iStock/Getty Images Plus via Getty Images
ZDNET's key takeaways
<ul><li>Sometimes an AI can cause you or your company irreparable harm.</li><li>Sharing confidential data with an AI could hav… [+13426 chars]",newsapi,2025-08-16 10:00:00+00:00
26,ETF Daily News,"Clearwater Analytics Holdings, Inc. (NYSE:CWAN) Shares Acquired by Swiss National Bank",https://www.etfdailynews.com/2025/08/16/clearwater-analytics-holdings-inc-nysecwan-shares-acquired-by-swiss-national-bank/,2025-08-16T09:21:03Z,"Swiss National Bank grew its position in Clearwater Analytics Holdings, Inc. (NYSE:CWAN – Free Report) by 6.9% during the first quarter, according to its most recent filing with the Securities and Exchange Commission. The institutional investor owned 414,100 …","Swiss National Bank grew its position in Clearwater Analytics Holdings, Inc. (NYSE:CWAN – Free Report) by 6.9% during the first quarter, according to its most recent filing with the Securities and Ex… [+6260 chars]",newsapi,2025-08-16 09:21:03+00:00
27,Pypi.org,mlscript-lang added to PyPI,https://pypi.org/project/mlscript-lang/,2025-08-16T09:14:15Z,A specialized scripting language for AI and Machine Learning.,"Part I: Introduction to mlscript
1. Overview
mlscript is a high-level, dynamically-typed, object-oriented scripting language engineered for high-performance numerical computation and machine learni… [+35876 chars]",newsapi,2025-08-16 09:14:15+00:00
28,Protothema.gr,Mystreet: Complaint app now active for café tables that “swallow up” public space,https://en.protothema.gr/2025/08/16/mystreet-complaint-app-now-active-for-cafe-tables-that-swallow-up-public-space/,2025-08-16T07:40:04Z,"This new application enhances oversight and facilitates citizen participation in monitoring the use of public shared spaces, especially with regard to the placement of café tables and chairs
The post Mystreet: Complaint app now active for café tables that “sw…","A new tool in the hands of citizens for supervising the use of public spaces has gone live in recent days. Following the publication of the Joint Ministerial Decision, the special electronic applicat… [+3803 chars]",newsapi,2025-08-16 07:40:04+00:00
29,Brothers-brick.com,Tickets to the Gun Show,https://www.brothers-brick.com/2025/08/16/tickets-to-the-gun-show/,2025-08-16T07:00:43Z,"@acghow has me thinking it's time to binge Mobile Suit Gundam after laying eyes on this most impressive mech.
The post Tickets to the Gun Show appeared first on The Brothers Brick.","The Brothers Brick respects your online privacy and security. In accordance with the General Data Protection Regulation (GDPR) effective on May 25, 2018, we are providing greater transparency, and we… [+137 chars]",newsapi,2025-08-16 07:00:43+00:00
30,ETF Daily News,Curtiss-Wright (NYSE:CW) vs. Astrotech (NASDAQ:ASTC) Head to Head Comparison,https://www.etfdailynews.com/2025/08/16/curtiss-wright-nysecw-vs-astrotech-nasdaqastc-head-to-head-comparison/,2025-08-16T06:28:51Z,"Curtiss-Wright (NYSE:CW – Get Free Report) and Astrotech (NASDAQ:ASTC – Get Free Report) are both aerospace companies, but which is the superior stock? We will compare the two companies based on the strength of their analyst recommendations, profitability, ea…","Curtiss-Wright (NYSE:CW – Get Free Report) and Astrotech (NASDAQ:ASTC – Get Free Report) are both aerospace companies, but which is the superior stock? We will compare the two companies based on the … [+5970 chars]",newsapi,2025-08-16 06:28:51+00:00
31,Naturalnews.com,Declassified emails unmask Obama-era deception behind the Russia hoax,https://www.naturalnews.com/2025-08-16-declassified-emails-obama-era-deception-behind-russia-hoax.html,2025-08-16T06:00:00Z,"Declassified emails expose former DNI James Clapper’s orders to rush a politicized 2017 Intelligence Community Assessment (ICA), despite objections from intelligence leaders. Tulsi Gabbard’s Office reveals the Obama administration “manufactured” intelligence …","<ul><li>Declassified emails expose former DNI James Clappers orders to rush a politicized 2017 Intelligence Community Assessment (ICA), despite objections from intelligence leaders.</li><li>Tulsi Gab… [+5209 chars]",newsapi,2025-08-16 06:00:00+00:00
32,Gpsdaily.com,US Space Force launches first reprogrammable navigation satellite from L3Harris,https://www.gpsdaily.com/reports/US_Space_Force_launches_first_reprogrammable_navigation_satellite_from_L3Harris_999.html,2025-08-16T05:53:36Z,"Los Angeles CA (SPX) Aug 15, 2025


The US Space Force has placed the L3Harris-built Navigation Technology Satellite-3 (NTS-3) into orbit aboard a United Launch Alliance Vulcan rocket from Cape Canaveral Space Force Station. NTS-3 is the Department of Defense…","US Space Force launches first reprogrammable navigation satellite from L3Harrisby Clarence OxfordLos Angeles CA (SPX) Aug 15, 2025
The US Space Force has placed the L3Harris-built Navigation Technol… [+1410 chars]",newsapi,2025-08-16 05:53:36+00:00
33,Substack.com,How The Internet Died - by Matthew Hughes - What We Lost,https://whatwelost.substack.com/p/how-the-internet-died,2025-08-16T05:47:02Z,How The Internet Died https://whatwelost.substack.com/p/how-the-internet-died internet,"Note from Matt: Yeah, this newsletter is more than 10,000 words. Its in the language of my people an absolute unit. As a result, you wont be able to read this in your inbox. Youll have to click throu… [+61262 chars]",newsapi,2025-08-16 05:47:02+00:00
34,Voidfox.com,Payment Processor Fun 2025 -- Making Your Own MSP,https://voidfox.com/blog/payment_processor_fun_2025_making_your_own_msp/,2025-08-16T05:47:02Z,,"Valve and Itch have been in the spotlight for being more or less forced by ""Payment processors"" to pull certain adult content off their storefronts. The short story of it is Valve pulled a couple of … [+28237 chars]",newsapi,2025-08-16 05:47:02+00:00
35,Growtha.com,Using Video Conferencing for Patient Education and Marketing,https://growtha.com/blog/using-video-conferencing-for-patient-education-and-marketing,2025-08-16T03:30:59Z,Using Video Conferencing for Patient Education and Marketinggrowtha.com,"The Rise of Virtual Interaction in Healthcare
In recent years, especially accelerated by the COVID-19 pandemic, video conferencing has emerged as a cornerstone of healthcare delivery and marketing. … [+17706 chars]",newsapi,2025-08-16 03:30:59+00:00
36,Whizmarketers.com,How Marketing Attribution Tools Can Help You Track Customer Journeys?,https://www.whizmarketers.com/blog/how-marketing-attribution-tools-can-help-you-track-customer-journeys/,2025-08-16T01:25:47Z,"Discover how Whiz Marketers uses marketing attribution tools to track customer journeys, optimize campaigns, and boost ROI.",Understanding customer behavior is crucial for businesses to make informed decisions and drive growth. Marketing attribution tools play a vital role in helping companies track customer journeys and i… [+22626 chars],newsapi,2025-08-16 01:25:47+00:00
37,The Times of India,Who is Geoffrey Hinton? The ‘godfather of AI’ who went from studying psychology at Cambridge to becoming a Nobel-winning scientist,https://timesofindia.indiatimes.com/education/news/who-is-geoffrey-hinton-the-godfather-of-ai-who-went-from-studying-psychology-at-cambridge-to-becoming-a-nobel-winning-scientist/articleshow/123327898.cms,2025-08-16T00:57:23Z,"Geoffrey Hinton, initially restless in academia, became a pioneer in artificial intelligence, overcoming funding limitations and skepticism towards neural networks. His groundbreaking work on deep learning, including AlexNet, revolutionized image recognition …","Sidharth Malhotra's fitness mantra is all about workout, diet and discipline",newsapi,2025-08-16 00:57:23+00:00
38,Pypi.org,pytorch-ignite 0.6.0.dev20250816,https://pypi.org/project/pytorch-ignite/0.6.0.dev20250816/,2025-08-16T00:19:05Z,A lightweight library to help with training neural networks in PyTorch.,"A required part of this site couldnt load. This may be due to a browser
 extension, network issues, or browser settings. Please check your
 connection, disable any ad blockers, or try using a diffe… [+12 chars]",newsapi,2025-08-16 00:19:05+00:00
39,Pypi.org,mct-quantizers-nightly 1.6.0.20250816.post1430,https://pypi.org/project/mct-quantizers-nightly/1.6.0.20250816.post1430/,2025-08-16T00:14:30Z,Infrastructure for support neural networks compression,"A required part of this site couldnt load. This may be due to a browser
 extension, network issues, or browser settings. Please check your
 connection, disable any ad blockers, or try using a diffe… [+12 chars]",newsapi,2025-08-16 00:14:30+00:00
40,Pypi.org,mct-nightly 2.4.0.20250816.558,https://pypi.org/project/mct-nightly/2.4.0.20250816.558/,2025-08-16T00:06:00Z,A Model Compression Toolkit for neural networks,"A required part of this site couldnt load. This may be due to a browser
 extension, network issues, or browser settings. Please check your
 connection, disable any ad blockers, or try using a diffe… [+12 chars]",newsapi,2025-08-16 00:06:00+00:00
41,Lesswrong.com,N Dimensional Interactive Scatter Plot (ndisp),https://www.lesswrong.com/posts/riBYsrypomuDnEYhx/n-dimensional-interactive-scatter-plot-ndisp,2025-08-15T23:08:43Z,"Published on August 15, 2025 11:08 PM GMTThis is the main overview page for my project ""ndisp"". I hope to keep this page up to date with a brief introduction, external links, and a more in depth description of details and future plans.IntroductionThis is a pr…","This is the main overview page for my project ""ndisp"". I hope to keep this page up to date with a brief introduction, external links, and a more in depth description of details and future plans.
Int… [+23381 chars]",newsapi,2025-08-15 23:08:43+00:00
42,Lesswrong.com,SE Gyges' response to AI-2027,https://www.lesswrong.com/posts/g5hWKtSYP3pq7urcw/se-gyges-response-to-ai-2027,2025-08-15T22:29:59Z,"Published on August 15, 2025 9:54 PM GMTLike Daniel Kokotajlo's coverage of Vitalik's response to AI-2027, I've copied the author's text. However, I would like to comment upon potential errors right in the text, since it would be clearer.AI 2027
 is a web si…","Like Daniel Kokotajlo's coverage of Vitalik's response to AI-2027, I've copied the author's text. However, I would like to comment upon potential errors right in the text, since it would be clearer.… [+83967 chars]",newsapi,2025-08-15 22:29:59+00:00
