source,title,url,published_at,description,content,fetched_from,published_at_parsed
Freerepublic.com,UNLEASHING AMERICAN DRONE DOMINANCE,https://freerepublic.com/focus/f-news/4321976/posts,2025-06-09T19:49:19Z,"By the authority vested in me as President by the Constitution and the laws of the United States of America, it is hereby ordered:Section 1. Purpose. Unmanned aircraft systems (UAS), otherwise known as drones, enhance United States productivity, create high-s…","Skip to comments.
UNLEASHING AMERICAN DRONE DOMINANCEWhitehouse.gov ^
 | June 6, 2025
 | The Whitehouse
Posted on 06/09/2025 12:49:19 PM PDT by SoConPubbie
By the authority vested in me as Presi… [+15719 chars]",newsapi,2025-06-09 19:49:19+00:00
Mediaite,Bannon Admits He Would Destroy Any Democrat For Creating a Database of Americans Like Trump’s,https://www.mediaite.com/politics/trump/bannon-admits-he-would-destroy-any-democrat-for-creating-a-database-of-americans-like-trumps/,2025-06-09T19:30:32Z,"Bannon made the comments in an interview with Chuck Todd, where he was pressed on the use of Palantir software across federal agencies to compile data on American citizens.
The post Bannon Admits He Would Destroy Any Democrat For Creating a Database of Americ…",Former White House strategist Steve Bannon acknowledged Sunday that if a Democratic administration were pursuing a data aggregation project like President Donald Trump’s administration has undertaken… [+2011 chars],newsapi,2025-06-09 19:30:32+00:00
Storagereview.com,HPE Expands Nonstop Compute Portfolio with NS5 X5 and NS9 X5 for Mission-Critical Enterprise Workloads,https://www.storagereview.com/news/hpe-expands-nonstop-compute-portfolio-with-ns5-x5-and-ns9-x5-for-mission-critical-enterprise-workloads,2025-06-09T19:20:05Z,"HPE brings new systems, NS5 X5 and NS9 X5, to the fault-tolerant HPE Nonstop Compute solution.
HPE has introduced additional systems to its established line of fault-tolerant HPE Nonstop Compute solutions, further strengthening its position as a leader in hig…","HPE brings new systems, NS5 X5 and NS9 X5, to the fault-tolerant HPE Nonstop Compute solution.
HPE has introduced additional systems to its established line of fault-tolerant HPE Nonstop Compute sol… [+9225 chars]",newsapi,2025-06-09 19:20:05+00:00
Securityaffairs.com,DOJ moves to seize $7.74M in crypto linked to North Korean IT worker scam,https://securityaffairs.com/178810/cyber-crime/doj-seize-7-74m-linked-to-north-korean-it-worker-scam.html,2025-06-09T18:43:32Z,"US seeks to seize $7.74M in crypto linked to North Korean fake IT worker schemes, per a new DOJ forfeiture complaint. The DOJ filed a civil forfeiture complaint for $7.74M in crypto tied to North Korean fake IT worker schemes linked to the indictment of North…","DOJ moves to seize $7.74M in crypto linked to North Korean IT worker scam
 | OpenAI bans ChatGPT accounts linked to Russian, Chinese cyber ops
 | New Mirai botnet targets TBK DVRs by exploiting CVE… [+171084 chars]",newsapi,2025-06-09 18:43:32+00:00
Pypi.org,nnetsauce 0.35.5,https://pypi.org/project/nnetsauce/0.35.5/,2025-06-09T18:37:02Z,Quasi-randomized (neural) networks,"A required part of this site couldnt load. This may be due to a browser
 extension, network issues, or browser settings. Please check your
 connection, disable any ad blockers, or try using a diffe… [+12 chars]",newsapi,2025-06-09 18:37:02+00:00
TechSpot,"OpenAI warns ChatGPT logs will be retained ""indefinitely,"" blames court order",https://www.techspot.com/news/108237-lawsuit-forces-openai-archive-all-chatgpt-chats.html,2025-06-09T18:27:00Z,"ChatGPT is now one of the world's most visited websites. Millions of people use the service daily, and OpenAI will now store nearly every user interaction in order to comply with a legal order issued by a US judge.Read Entire Article",WTF?! OpenAI has confirmed it is now required to retain all user data indefinitely. Anyone interacting with the company's large language models through the ChatGPT service will have their chat logs a… [+2344 chars],newsapi,2025-06-09 18:27:00+00:00
Sputnikglobe.com,Ruble's Performance Highlights Russia's Triumph in the Face of Western Sanctions,https://sputnikglobe.com/20250609/rubles-performance-highlights-russias-triumph-in-the-face-of-western-sanctions-1122221536.html,2025-06-09T18:18:58Z,"The Bank of America’s stunning admission that the Russian ruble is this year’s best performing currency may be the result of someone in that organization being “fed up with years of self-deluding, misrepresentative, and simply incorrect reporting about Russia…","Enjoy in-depth, acute analysis of the most pressing local, regional and global trends at Sputnik!
https://sputnikglobe.com/20250609/rubles-performance-highlights-russias-triumph-in-the-face-of-weste… [+3205 chars]",newsapi,2025-06-09 18:18:58+00:00
Pypi.org,nnetsauce 0.35.4,https://pypi.org/project/nnetsauce/0.35.4/,2025-06-09T17:37:49Z,Quasi-randomized (neural) networks,"A required part of this site couldnt load. This may be due to a browser
 extension, network issues, or browser settings. Please check your
 connection, disable any ad blockers, or try using a diffe… [+12 chars]",newsapi,2025-06-09 17:37:49+00:00
UN News,"In Discussion on Increasing Ocean-Related Scientific Cooperation, Speakers Underline Importance of Reliable Data",https://press.un.org/en/2025/sea2219.doc.htm,2025-06-09T17:33:56Z,"NICE, FRANCE, 9 June — Reliable data is essential not only for informed decision-making but also for improving the prediction and response to ocean hazards driven by the triple planetary crisis — climate change, pollution and biodiversity loss — speakers emph…","NICE, FRANCE, 9 June Reliable data is essential not only for informed decision-making but also for improving the prediction and response to ocean hazards driven by the triple planetary crisis climate… [+6800 chars]",newsapi,2025-06-09 17:33:56+00:00
The Times of India,What is Palantir? Meet the AI tech titan powering Trump-era surveillance and data operations,https://economictimes.indiatimes.com/news/international/us/what-is-palantir-meet-the-ai-tech-titan-powering-trump-era-surveillance-and-data-operations/articleshow/121733364.cms,2025-06-09T17:22:32Z,"Donald Trump initiated a data exchange program among federal agencies. Palantir Technologies, co-founded by Peter Thiel, supports this. Palantir secured a substantial government contract. The firm gathers data for agencies like Homeland Security. This initiat…","US president Donald Trump signed an executive order earlier this year to let the federal government exchange data between agencies, and this initiative would be backed by a technology company, Palant… [+2354 chars]",newsapi,2025-06-09 17:22:32+00:00
The BMJ,Development of a large Danish single-centre retro- and prospective transgender cohort using a web-based platform: a study protocol of a transgender cohort study,https://bmjopen.bmj.com/content/15/6/e091366,2025-06-09T17:16:31Z,"Introduction

Referrals for gender-affirming healthcare services have surged in recent decades, presumably driven by increased visibility, acceptance and reduced barriers to care. Despite these advances, transgender and gender-diverse individuals continue to…",The Transgender Cohort called TraCK (Transkohorte ved Center for Kønsidentitet) is based at the CGI and is developed in a multidisciplinary collaboration with the Department of Obstetrics and Gynaeco… [+310 chars],newsapi,2025-06-09 17:16:31+00:00
Live Science,"AI reasoning models aren’t as smart as they were cracked up to be, Apple study claims",https://www.livescience.com/technology/artificial-intelligence/ai-reasoning-models-arent-as-smart-as-they-were-cracked-up-to-be-apple-study-claims,2025-06-09T16:31:35Z,A new study by Apple has ignited controversy in the AI field by showing how reasoning models undergo 'complete accuracy collapse' when overloaded with complex problems.,"Artificial intelligence (AI) reasoning models aren't as smart as they've been made out to be. In fact, they don't actually reason at all, researchers at Apple say.
Reasoning models, such as Meta's C… [+6963 chars]",newsapi,2025-06-09 16:31:35+00:00
GlobeNewswire,Bellarium Network Launches to Redefine the Future of Decentralized Finance,https://www.globenewswire.com/news-release/2025/06/09/3096062/0/en/Bellarium-Network-Launches-to-Redefine-the-Future-of-Decentralized-Finance.html,2025-06-09T16:00:00Z,"Zurich, Switzerland, June 09, 2025 (GLOBE NEWSWIRE) -- A new era in decentralized finance (DeFi) begins with the official launch of Bellarium Network, a blockchain-powered ecosystem focused on providing accessible, secure, and scalable DeFi solutions. With th…","Zurich, Switzerland, June 09, 2025 (GLOBE NEWSWIRE) -- A new era in decentralized finance (DeFi) begins with the official launch of Bellarium Network, a blockchain-powered ecosystem focused on provid… [+5504 chars]",newsapi,2025-06-09 16:00:00+00:00
Pypi.org,odoo-addon-privacy-consent 17.0.1.0.1.2,https://pypi.org/project/odoo-addon-privacy-consent/17.0.1.0.1.2/,2025-06-09T15:44:58Z,"Allow people to explicitly accept or reject inclusion in some activity, GDPR compliant","A required part of this site couldnt load. This may be due to a browser
 extension, network issues, or browser settings. Please check your
 connection, disable any ad blockers, or try using a diffe… [+12 chars]",newsapi,2025-06-09 15:44:58+00:00
Techtarget.com,What is IoT integration?,https://www.techtarget.com/iotagenda/definition/IoT-integration,2025-06-09T15:29:00Z,"IoT integration is the process of linking smart devices, applications, databases and systems to facilitate data exchange and enable automated workflows.","IoT integration is the process of linking smart devices, applications, databases and systems to facilitate data exchange and enable automated workflows.
In manufacturing, integrating the internet of… [+14784 chars]",newsapi,2025-06-09 15:29:00+00:00
Pypi.org,nabla-ml 25.6091659,https://pypi.org/project/nabla-ml/25.6091659/,2025-06-09T14:59:20Z,Dynamic neural networks and function transformations in Python + Mojo,"A required part of this site couldnt load. This may be due to a browser
 extension, network issues, or browser settings. Please check your
 connection, disable any ad blockers, or try using a diffe… [+12 chars]",newsapi,2025-06-09 14:59:20+00:00
TelecomTV,"What’s up with… Qualcomm & Alphawave, CityFibre, TalkTalk",https://www.telecomtv.com/content/digital-platforms-services/what-s-up-with-qualcomm-alphawave-cityfibre-talktalk-53180/,2025-06-09T14:46:16Z,Qualcomm finally pulls the trigger on $2.4bn Alphawave M&A dealCityFibre denies sale talks speculation TalkTalk gets a warning from BT’s Openreach,In today’s industry news roundup: Qualcomm has finally struck a deal to acquire Alphawave IP Group that will bolster its datacentre product portfolio; report suggests UK altnet has held M&amp;A talks… [+11144 chars],newsapi,2025-06-09 14:46:16+00:00
Plos.org,TempODEGraphNet: predicting user churn using dynamic social graphs and neural ODEs,https://journals.plos.org/plosone/article?id=10.1371/journal.pone.0321560,2025-06-09T14:00:00Z,"Research on user churn prediction has been conducted across various domains for a long time. Among these, the gaming domain is characterized by its potential for diverse types of interactions between users. Due to this characteristic, many studies on churn pr…","Abstract
Research on user churn prediction has been conducted across various domains for a long time. Among these, the gaming domain is characterized by its potential for diverse types of interactio… [+54072 chars]",newsapi,2025-06-09 14:00:00+00:00
Plos.org,Aggregating soft labels from crowd annotations improves uncertainty estimation under distribution shift,https://journals.plos.org/plosone/article?id=10.1371/journal.pone.0323064,2025-06-09T14:00:00Z,"Selecting an effective training signal for machine learning tasks is difficult: expert annotations are expensive, and crowd-sourced annotations may not be reliable. Recent work has demonstrated that learning from a distribution over labels acquired from crowd…","Abstract
Selecting an effective training signal for machine learning tasks is difficult: expert annotations are expensive, and crowd-sourced annotations may not be reliable. Recent work has demonstr… [+62530 chars]",newsapi,2025-06-09 14:00:00+00:00
Plos.org,Validation of simulated training sets using a convolutional neural network for isotope identification in urban environments,https://journals.plos.org/plosone/article?id=10.1371/journal.pone.0323053,2025-06-09T14:00:00Z,"Real-time isotope identification in urban environments can aid law enforcement by providing additional information about the nature of a potential threat. Neural networks have shown promise in isotope identification but the large range of potential isotopes, …","Abstract
Real-time isotope identification in urban environments can aid law enforcement by providing additional information about the nature of a potential threat. Neural networks have shown promise… [+24386 chars]",newsapi,2025-06-09 14:00:00+00:00
Plos.org,SCARS-LOGISTIC: A novel variable selection approach for binary classification model to identify the significant determinants of sexually transmitted infections,https://journals.plos.org/plosone/article?id=10.1371/journal.pone.0324395,2025-06-09T14:00:00Z,"Variable selection methods are very popular, especially in the field of big data with large predictors. These procedures improve the accuracy and performance of the model by eliminating irrelevant and redundant variables. The main contribution of this study i…","Abstract
Variable selection methods are very popular, especially in the field of big data with large predictors. These procedures improve the accuracy and performance of the model by eliminating irr… [+27067 chars]",newsapi,2025-06-09 14:00:00+00:00
Plos.org,BanglaNewsClassifier: A machine learning approach for news classification in Bangla Newspapers using hybrid stacking classifiers,https://journals.plos.org/plosone/article?id=10.1371/journal.pone.0321291,2025-06-09T14:00:00Z,"Bangla news floods the web, and the need for smarter and more efficient classification techniques is greater than ever. Previous studies mostly focused on traditional models, overlooking the potential of hybrid techniques to handle the ever-growing complex da…","Abstract
Bangla news floods the web, and the need for smarter and more efficient classification techniques is greater than ever. Previous studies mostly focused on traditional models, overlooking th… [+74575 chars]",newsapi,2025-06-09 14:00:00+00:00
Plos.org,Enhanced pedestrian trajectory prediction via overlapping field-of-view domains and integrated Kolmogorov-Arnold networks,https://journals.plos.org/plosone/article?id=10.1371/journal.pone.0322722,2025-06-09T14:00:00Z,"Accurate pedestrian trajectory prediction is crucial for applications such as autonomous driving and crowd surveillance. This paper proposes the OV-SKTGCNN model, an enhancement to the Social-STGCNN model, aimed at addressing its low prediction accuracy and l…","This section first formally presents the problem. Next, we review the OV-SKTGCNN models general structure. Then, a TCN structure fused with KAN convolution and a data processing model based on graph … [+14636 chars]",newsapi,2025-06-09 14:00:00+00:00
Plos.org,Evaluation of data driven low-rank matrix factorization for accelerated solutions of the Vlasov equation,https://journals.plos.org/plosone/article?id=10.1371/journal.pone.0325304,2025-06-09T14:00:00Z,"Low-rank methods have shown success in accelerating simulations of a collisionless plasma described by the Vlasov equation, but still rely on computationally costly linear algebra every time step. We propose a data-driven factorization method using artificial…","Citation: Jonnalagadda B, Becker S (2025) Evaluation of data driven low-rank matrix factorization for accelerated solutions of the Vlasov equation. PLoS One 20(6):
 e0325304.
https://doi.org/10.137… [+39129 chars]",newsapi,2025-06-09 14:00:00+00:00
Plos.org,"Designed for simplicity, used for complexity: The systemic pressures shaping walk-in clinic practices and outcomes",https://journals.plos.org/plosone/article?id=10.1371/journal.pone.0325793,2025-06-09T14:00:00Z,"Walk-in clinics (WICs), appreciated for their accessibility and convenience, have become an increasingly popular healthcare option in Ontario for patients with and without primary care enrolment. Despite their utility, WICs face criticism for delivering lower…","Citation: Terpou BA, Lapointe-Shaw L, Wang R, Martin D, Tadrous M, Bhatia S, et al. (2025) Designed for simplicity, used for complexity: The systemic pressures shaping walk-in clinic practices and ou… [+36320 chars]",newsapi,2025-06-09 14:00:00+00:00
Plos.org,Prediction of air temperature and humidity in greenhouses via artificial neural network,https://journals.plos.org/plosone/article?id=10.1371/journal.pone.0325650,2025-06-09T14:00:00Z,"Accurate prediction of greenhouse temperature and relative humidity is critical for developing environmental control systems. Effective regulation strategies can help improve crop yields while reducing energy consumption. In this study, Multilayer Perceptron …","Citation: Yan C, Na T, Zhen Q, Sun Y, Liu K (2025) Prediction of air temperature and humidity in greenhouses via artificial neural network. PLoS One 20(6):
 e0325650.
https://doi.org/10.1371/journa… [+36029 chars]",newsapi,2025-06-09 14:00:00+00:00
Plos.org,Impact of mtG3PDH inhibitors on proliferation and metabolism of androgen receptor-negative prostate cancer cells: Role of extracellular pyruvate,https://journals.plos.org/plosone/article?id=10.1371/journal.pone.0325509,2025-06-09T14:00:00Z,"Mitochondrial glycerol 3-P dehydrogenase (mtG3PDH) plays a significant role in cellular bioenergetics by serving as a rate-limiting element in the glycerophosphate shuttle, which connects cytosolic glycolysis to mitochondrial oxidative metabolism. mtG3PDH was…","Citation: Di Paola FJ, Cardoso LH, Nikitopoulou E, Kulik B, Rühl S, Eva A, et al. (2025) Impact of mtG3PDH inhibitors on proliferation and metabolism of androgen receptor-negative prostate cancer cel… [+71698 chars]",newsapi,2025-06-09 14:00:00+00:00
Plos.org,"Measuring Child Labor: The Who’s, the Where’s, the When’s, and the Why’s",https://journals.plos.org/plosone/article?id=10.1371/journal.pone.0322987,2025-06-09T14:00:00Z,"Measuring child labor accurately is a major challenge: parents’ and children’s reports tend to differ dramatically, and there is typically no way to verify whose reports are truthful (if any). To overcome this challenge, this paper uses novel data from a coco…","Abstract
Measuring child labor accurately is a major challenge: parents and childrens reports tend to differ dramatically, and there is typically no way to verify whose reports are truthful (if any)… [+57682 chars]",newsapi,2025-06-09 14:00:00+00:00
TechSpot,Linux Foundation steps in with neutral solution to WordPress crisis,https://www.techspot.com/news/108233-linux-foundation-steps-neutral-solution-wordpress-crisis.html,2025-06-09T13:16:00Z,"While Matt Mullenweg and WP Engine are fighting for the heart (and money) of WordPress, the Linux Foundation (LF) is trying to bring some semblance of order to this chaos. The non-profit organization born to support Linux and open-source movements recently in…",Editor's take: The fight between WordPress and WP Engine could bring the entire WP community to an unprecedented breakup. It's why the Linux Foundation is trying to avoid the worst-case scenario with… [+2967 chars],newsapi,2025-06-09 13:16:00+00:00
9to5Mac,"Approaching WWDC, Apple researchers dispute claims that AI is capable of reasoning",https://9to5mac.com/2025/06/09/approaching-wwdc-apple-researchers-dispute-claims-that-ai-is-capable-of-reasoning/,2025-06-09T12:54:44Z,"While Apple has fallen behind the curve in terms of the AI features the company has actually launched, its researchers continue to work at the cutting edge of what’s out there.



In a new paper, they take issue with claims being made about some of the latest…","While Apple has fallen behind the curve in terms of the AI features the company has actually launched, its researchers continue to work at the cutting edge of what’s out there.
In a new paper, they … [+3437 chars]",newsapi,2025-06-09 12:54:44+00:00
114.162.43,How AI is Quietly Transforming Private Equity's Front Office - VMblog QA,https://74.114.162.43:443/archive/2025/06/09/how-ai-is-quietly-transforming-private-equity-s-front-office-vmblog-qa.aspx,2025-06-09T12:45:00Z,"VMblog sat down with Chris Cummings, Chief Strategy Officer at InvestorFlow, to discuss why GPs themselves represent the next frontier for AI in private equity","While most private equity firms are busy deploying artificial intelligence across their portfolio companies, they're overlooking a massive opportunity sitting right under their noses: their own opera… [+6520 chars]",newsapi,2025-06-09 12:45:00+00:00
Vmblog.com,How AI is Quietly Transforming Private Equity's Front Office - VMblog QA,https://vmblog.com:443/archive/2025/06/09/how-ai-is-quietly-transforming-private-equity-s-front-office-vmblog-qa.aspx,2025-06-09T12:45:00Z,"VMblog sat down with Chris Cummings, Chief Strategy Officer at InvestorFlow, to discuss why GPs themselves represent the next frontier for AI in private equity","While most private equity firms are busy deploying artificial intelligence across their portfolio companies, they're overlooking a massive opportunity sitting right under their noses: their own opera… [+6520 chars]",newsapi,2025-06-09 12:45:00+00:00
Search Engine Journal,"How AI Detects Customer Hesitation (And Converts It Into Sales) via @sejournal, @purnavirji",https://www.searchenginejournal.com/how-ai-detects-customer-hesitation-and-converts-into-sales/548317/,2025-06-09T12:30:57Z,"Traffic means nothing if hesitation kills conversions. Learn how AI-powered brands are closing the gap.
The post How AI Detects Customer Hesitation (And Converts It Into Sales) appeared first on Search Engine Journal.","Yesterday, I had hiking boots in my cart. Size selected, reviews read, I was even picturing myself on the trail. Then I hesitated. “Will these pinch my wide feet?” Three clicks later, I bounced.
The… [+9032 chars]",newsapi,2025-06-09 12:30:57+00:00
Cointelegraph,Ethereum privacy roadmap proposes EU GDPR-safe blockchain design,https://cointelegraph.com/news/ethereum-modular-architecture-gdpr-privacy-proposal,2025-06-09T12:25:33Z,A new proposal advocates splitting blockchain roles and adopting privacy-enhancing tools to help Ethereum comply with EU data rules without compromising decentralization.,"As the broader Ethereum ecosystem and its core principles evolve to address data privacy concerns, a new proposal recommends a modular compliance strategy as a path to reconcile public blockchains wi… [+2662 chars]",newsapi,2025-06-09 12:25:33+00:00
Creativeapplications.net,"Predictive Capital – Roads to terminal alienation, soil to server farm, reason to vibe",https://www.creativeapplications.net/theory/predictive-capital/,2025-06-09T12:20:37Z,"Get full content RSS Feed

So-called ‘AI’ —more accurately: Predictive Capital— is the latest instrument in Capital’s apparatus of alienation. It steals our work, simulates our labour, reanimates our expression, autocompletes our thought, then pronounces us d…","Prologue
For my family &amp; in loving memory of my father,Paul Andre Tindall.
We proceed from an actual economic fact. 
The worker becomes all the poorer the more wealth he produces, the more his… [+421212 chars]",newsapi,2025-06-09 12:20:37+00:00
GlobeNewswire,RTI to Host Expert Panel on Edge-to-Cloud Connectivity for AI and Autonomy,https://www.globenewswire.com/news-release/2025/06/09/3095775/0/en/RTI-to-Host-Expert-Panel-on-Edge-to-Cloud-Connectivity-for-AI-and-Autonomy.html,2025-06-09T12:00:00Z,RTI to Host Expert Panel on Edge-to-Cloud Connectivity for AI and Autonomy......,"SUNNYVALE, Calif., June 09, 2025 (GLOBE NEWSWIRE) -- Real-Time Innovations (RTI)
, the software framework company for physical AI systems, will host a live webinar
 on June 24, 2025, titled Real-Ti… [+1813 chars]",newsapi,2025-06-09 12:00:00+00:00
Pypi.org,nabla-ml 25.6091347,https://pypi.org/project/nabla-ml/25.6091347/,2025-06-09T11:47:31Z,Dynamic neural networks and function transformations in Python + Mojo,"A required part of this site couldnt load. This may be due to a browser
 extension, network issues, or browser settings. Please check your
 connection, disable any ad blockers, or try using a diffe… [+12 chars]",newsapi,2025-06-09 11:47:31+00:00
Securityaffairs.com,"OpenAI bans ChatGPT accounts linked to Russian, Chinese cyber ops",https://securityaffairs.com/178797/intelligence/openai-bans-chatgpt-accounts-linked-to-russian-chinese-cyber-ops.html,2025-06-09T11:15:09Z,"OpenAI banned ChatGPT accounts tied to Russian and Chinese hackers using the tool for malware, social media abuse, and U.S. satellite tech research. OpenAI banned ChatGPT accounts that were used by Russian-speaking threat actors and two Chinese nation-state a…","OpenAI bans ChatGPT accounts linked to Russian, Chinese cyber ops
 | New Mirai botnet targets TBK DVRs by exploiting CVE-2024-3721
 | BadBox 2.0 botnet infects millions of IoT devices worldwide, FB… [+171006 chars]",newsapi,2025-06-09 11:15:09+00:00
