,source,title,url,published_at,description,content,fetched_from,published_at_parsed
81,GlobeNewswire,"Adtelligent Scoops “Best Overall OTT Solution Provider"" at 2025 MarTech Breakthrough Awards",https://www.globenewswire.com/news-release/2025/08/14/3133788/0/en/Adtelligent-Scoops-Best-Overall-OTT-Solution-Provider-at-2025-MarTech-Breakthrough-Awards.html,2025-08-14T19:11:00Z,"Adtelligent wins ""Best Overall OTT Solution Provider"" at 2025 MarTech Breakthrough Awards, highlighting innovation in scalable OTT advertising ecosystem.","NEW YORK, Aug. 14, 2025 (GLOBE NEWSWIRE) -- Adtelligent Inc., a global advertising technology company, has been recognized as the Best Overall OTT Solution Provider in the prestigious MarTech Breakth… [+2667 chars]",newsapi,2025-08-14 19:11:00+00:00
82,Forbes,Trying To Simplify The Housing Crisis To Find Its Kryptonite,https://www.forbes.com/sites/jennifercastenson/2025/08/14/trying-to-simplify-the-housing-crisis-to-find-its-kryptonite/,2025-08-14T17:37:17Z,"Experts across all sectors of housing are taking individual approaches to solve the housing crisis, but it's going to take group, collaborative effort.","Solving the housing crisis takes all types of housing with work from all stakeholders
Getty Images
Housing has become a national conversation that affects most people and one they are following clo… [+12911 chars]",newsapi,2025-08-14 17:37:17+00:00
83,The Star Online,BiH to tighten drone regulations,https://www.thestar.com.my/news/world/2025/08/15/bih-to-tighten-drone-regulations,2025-08-14T17:27:00Z,"SARAJEVO, Aug. 14 (Xinhua) -- Bosnia and Herzegovina (BiH) will tighten drone regulations through amendments to the BiH Air Navigation Services Agency (BHANSA) Law, aiming to boost airspace safety and modernize air traffic control, BHANSA announced Thursday. …","SARAJEVO, Aug. 14 (Xinhua) -- Bosnia and Herzegovina (BiH) will tighten drone regulations through amendments to the BiH Air Navigation Services Agency (BHANSA) Law, aiming to boost airspace safety an… [+1125 chars]",newsapi,2025-08-14 17:27:00+00:00
84,Hacker News,Axle (YC S22) Is Hiring Product Engineers,https://www.ycombinator.com/companies/axle/jobs/8wAy0QH-product-engineer,2025-08-14T17:00:30Z,"We are looking for talented engineers to join our team as early members.
As a Product Engineer, you’ll help build the platform that makes this possible. From structuring and cleaning complex data to using LLMs for automated data extraction, you’ll have the ch…","We are looking for talented engineers to join our team as early members.
As a Product Engineer, youll help build the platform that makes this possible. From structuring and cleaning complex data to … [+3175 chars]",newsapi,2025-08-14 17:00:30+00:00
85,The Drum,Balancing legacy with innovation is broadcasters’ key challenge,https://www.thedrum.com/news/2025/08/14/balancing-legacy-with-innovation-broadcasters-key-challenge,2025-08-14T15:45:00Z,How can broadcasters thrive in a digital-first world while still keeping sight of what made them great in the first place? C4’s Mihir Haria-Shah sat down with PubMatic’s Nicole Scaglione to analyze the media brand’s transformation roadmap.Broadcasters around …,How can broadcasters thrive in a digital-first world while still keeping sight of what made them great in the first place? C4s Mihir Haria-Shah sat down with PubMatics Nicole Scaglione to analyze the… [+7800 chars],newsapi,2025-08-14 15:45:00+00:00
86,Hospitality Net,Why winning guest loyalty is top priority,https://www.hospitalitynet.org/opinion/4128542.html,2025-08-14T15:37:00Z,"Some industry experts claim that hotel guests are inherently disloyal, are interested only in the best deal, and, inevitably, end up booking with the OTAs — where they find the lowest rates.","Some industry experts claim that hotel guests are inherently disloyal, are interested only in the best deal, and, inevitably, end up booking with the OTAs where they find the lowest rates.
I believe… [+12072 chars]",newsapi,2025-08-14 15:37:00+00:00
87,Linkedin.com,Global AI Email Marketing Tool Market: Impact of AI and Automation,https://www.linkedin.com/pulse/global-ai-email-marketing-tool-market-impact-lrwsf,2025-08-14T15:23:57Z,"AI Email Marketing Tool Market size reached USD 1.62 billion in 2024, growing at a CAGR of 17.","AI Email Marketing Tool Market size reached USD 1.62 billion in 2024, growing at a CAGR of 17.4% driven by adoption across e-commerce, SaaS, and digital services sectors.
AI Email Marketing Tool Mar… [+8748 chars]",newsapi,2025-08-14 15:23:57+00:00
88,Cisco.com,Making SD-WAN Smarter with MCP: A Developer’s Guide,https://blogs.cisco.com/learning/making-sd-wan-smarter-with-mcp-a-developers-guide,2025-08-14T14:26:50Z,"As SD-WAN developers, we often juggle various vendor portals, command-line interfaces, and API calls. What we need is a way to unify and streamline these communications and thus simplify integration. Here’s where Model Context Protocol (MCP) comes in, offerin…","As SD-WAN developers, we often juggle various vendor portals, command-line interfaces, and API calls. What we need is a way to unify and streamline these communications and thus simplify integration.… [+7563 chars]",newsapi,2025-08-14 14:26:50+00:00
89,PCMag.com,Incogni vs. Optery: Which Data Removal Service Comes Out on Top?,https://me.pcmag.com/en/security/31699/incogni-vs-optery-which-data-removal-service-comes-out-on-top,2025-08-14T14:13:25Z,"If your info appears on a people-search site, you can request its removal—but chances are, that's just the tip of the iceberg. For broader data removal, services like Incogni or Optery can help. I compare both to determine which is best.
Pricing OptionsA Stan…","Pricing Options
A Standard subscription to Incognis services costs $99.48, while the top-tier Unlimited subscription goes for $179.88. The Standard subscription gets you everything Incogni offers ex… [+10493 chars]",newsapi,2025-08-14 14:13:25+00:00
90,PCMag.com,Incogni vs. Optery: Which Data Removal Service Comes Out on Top?,https://uk.pcmag.com/security/159574/incogni-vs-optery-which-data-removal-service-comes-out-on-top,2025-08-14T14:13:25Z,"If your info appears on a people-search site, you can request its removal—but chances are, that's just the tip of the iceberg. For broader data removal, services like Incogni or Optery can help. I compare both to determine which is best.
Pricing OptionsA Stan…","Pricing Options
A Standard subscription to Incognis services costs $99.48, while the top-tier Unlimited subscription goes for $179.88. The Standard subscription gets you everything Incogni offers ex… [+10493 chars]",newsapi,2025-08-14 14:13:25+00:00
91,Plos.org,Venomics of the Arabian saw-scaled viper (Echis coloratus) through transcriptome-guided proteomics and in vitro functional profiling,https://journals.plos.org/plosntds/article?id=10.1371/journal.pntd.0013439,2025-08-14T14:00:00Z,"Author summary The Arabian saw-scaled viper (Echis coloratus) is a venomous snake of high medical relevance found in the Middle East and North Africa. However, the compositional and functional properties of its venom remain poorly understood. In this study, w…","Abstract
The Arabian saw-scaled viper (Echis coloratus) is among the snakes of highest medical relevance in the Middle East and North Africa. However, to date, its venom has been investigated in a v… [+62751 chars]",newsapi,2025-08-14 14:00:00+00:00
92,Plos.org,Wear state identification of reciprocating sliding friction Pairs with frictional vibration,https://journals.plos.org/plosone/article?id=10.1371/journal.pone.0329782,2025-08-14T14:00:00Z,"Real-time monitoring of the wear state of reciprocating sliding friction pairs has long been a challenging issue. To address this problem, this paper innovatively proposes a new method of constructing feature vectors based on the fractal parameters of frictio…","Abstract
Real-time monitoring of the wear state of reciprocating sliding friction pairs has long been a challenging issue. To address this problem, this paper innovatively proposes a new method of c… [+33011 chars]",newsapi,2025-08-14 14:00:00+00:00
93,Plos.org,SpaVGN: A hybrid deep learning framework for high-resolution spatial transcriptomics data reconstruction and spatial domain identification,https://journals.plos.org/plosone/article?id=10.1371/journal.pone.0329122,2025-08-14T14:00:00Z,"Spatial transcriptomics has revolutionized the analysis of gene expression while preserving tissue spatial information, which provides novel insights into the cellular composition and function of complex biological tissues. However, current technologies are c…","Abstract
Spatial transcriptomics has revolutionized the analysis of gene expression while preserving tissue spatial information, which provides novel insights into the cellular composition and funct… [+41076 chars]",newsapi,2025-08-14 14:00:00+00:00
94,Plos.org,"A software ecosystem for brain tractometry processing, analysis, and insight",https://journals.plos.org/ploscompbiol/article?id=10.1371/journal.pcbi.1013323,2025-08-14T14:00:00Z,Author summary The human brain is a highly inter-connected system. Information about the environment and about internal states is effectively distributed and integrated through neural pathways that rapidly transmit signals between distant brain regions throug…,"Citation: Kruper J, Richie-Halford A, Qiao J, Gilmore A, Chang K, Grotheer M, et al. (2025) A software ecosystem for brain tractometry processing, analysis, and insight. PLoS Comput Biol 21(8):
 e10… [+78182 chars]",newsapi,2025-08-14 14:00:00+00:00
95,Plos.org,"Knowledge and attitude of populations on blackflies and onchocerciasis and participation in mass drug administration in first-line communities near Erin-Ijesha and Arinta waterfalls, Southwest Nigeria",https://journals.plos.org/plosntds/article?id=10.1371/journal.pntd.0013411,2025-08-14T14:00:00Z,"Author summary Preliminary assessments have identified blackfly biting activity at Erin-Ijesha and Arinta waterfalls in Southwest Nigeria, predisposing first-line communities to a high risk of onchocerciasis. These blackflies make use of fast flowing rivers f…","Citation: Dauda OG, Rufai AM, Surakat OA, Oyeniran OA, Adeshina OQ, Oboro AO, et al. (2025) Knowledge and attitude of populations on blackflies and onchocerciasis and participation in mass drug admin… [+23368 chars]",newsapi,2025-08-14 14:00:00+00:00
96,Vmblog.com,NTT DATA Partners with Google Cloud to Accelerate Agentic AI Adoption and Cloud Modernization for Enterprises Globally,https://vmblog.com:443/archive/2025/08/14/ntt-data-partners-with-google-cloud-to-accelerate-agentic-ai-adoption-and-cloud-modernization-for-enterprises-globally.aspx,2025-08-14T13:49:00Z,NTT DATA announced a global partnership with Google Cloud to accelerate AI-powered cloud innovations and unlock new possibilities with AI for enterprise organizations across industries.,"NTT DATA announced a global partnership with Google Cloud to accelerate AI-powered cloud innovations and unlock new possibilities with AI for enterprise organizations across industries.
This collabo… [+6201 chars]",newsapi,2025-08-14 13:49:00+00:00
97,9to5Mac,Data brokers just gave us another reason to hate them,https://9to5mac.com/2025/08/14/data-brokers-just-gave-us-another-reason-to-hate-them/,2025-08-14T12:37:44Z,"If you were holding a competition for the scummiest business model, then data brokers would be very high up the list. These companies make money by buying personal data from app and website owners and selling it to companies who want to spam us.



A US Senat…","If you were holding a competition for the scummiest business model, then data brokers would be very high up the list. These companies make money by buying personal data from app and website owners an… [+2537 chars]",newsapi,2025-08-14 12:37:44+00:00
98,Techdirt,"Nvidia, AMD Pay A 15% Bribe To The US Treasury To Keep Selling Chips To China",https://www.techdirt.com/2025/08/14/nvidia-amd-pay-a-15-bribe-to-the-us-treasury-to-keep-selling-chips-to-china/,2025-08-14T12:30:00Z,"If you actually pay attention you might notice the right wing’s pearl-clutching over China is neither effective nor consistent. The GOP, for years, made a giant stink about China’s Huawei network gear being a massive national security threat, and pushed throu…","from the national-security-violations-are-fine-as-long-as-they're-profitable dept
If you actually pay attention you might notice the right wing’s pearl-clutching over China is neither effective nor … [+5406 chars]",newsapi,2025-08-14 12:30:00+00:00
99,Researchbuzz.me,"International Investment Agreements, Alabama History, Elchin Afandiyev, More: Thursday ResearchBuzz, August 14, 2025",https://researchbuzz.me/2025/08/14/international-investment-agreements-alabama-history-elchin-afandiyev-more-thursdsay-researchbuzz-august-14-2025/,2025-08-14T12:01:40Z,"NEW RESOURCES UN Trade & Development: UNCTAD launches new database on investment facilitation. “The database maps more than 400 international investment agreements (IIAs) since 2010, including the Investment Facilitation for Development Agreement […]","NEW RESOURCES 
UN Trade &amp; Development: UNCTAD launches new database on investment facilitation. “The database maps more than 400 international investment agreements (IIAs) since 2010, including … [+4784 chars]",newsapi,2025-08-14 12:01:40+00:00
100,Www.gov.uk,HM Courts and Tribunals Service Data Access Panel,https://www.gov.uk/guidance/hm-courts-and-tribunals-service-data-access-panel,2025-08-14T12:00:08Z,The HM Courts and Tribunals Service Data Access Panel (DAP) determines the outcome of data access requests for third party access to HMCTS data for research in the public interest.,"Role of the Panel
The HMCTS Data Access Panel (DAP) is a decision-making body whose remit is third-party data access at HMCTS. Its objective is to determine access requests for Accessible data creat… [+5437 chars]",newsapi,2025-08-14 12:00:08+00:00
101,ComputerWeekly.com,Actions to future-proof Your channel business with AI,https://www.computerweekly.com/microscope/opinion/Actions-to-future-proof-Your-channel-business-with-AI,2025-08-14T10:08:00Z,"Richard Eglon, CMO Nebula Global Services, shares six tips that should make a difference","The age of Artificial Intelligence isnt coming, its already here. And for the technology channel, this is a moment of reckoning. The rules have changed. The old playbook of shifting boxes, stacking m… [+4194 chars]",newsapi,2025-08-14 10:08:00+00:00
102,Slashdot.org,Data Brokers Are Hiding Their Opt-Out Pages From Google Search,https://yro.slashdot.org/story/25/08/14/0235234/data-brokers-are-hiding-their-opt-out-pages-from-google-search,2025-08-14T10:00:00Z,"Data brokers are required by California law to provide ways for consumers to request their data be deleted. But good luck finding them. From a report: More than 30 of the companies, which collect and sell consumers' personal information, hid their deletion in…","More than 30 of the companies, which collect and sell consumers' personal information, hid their deletion instructions from Google, according to a review by The Markup and CalMatters of hundreds of b… [+720 chars]",newsapi,2025-08-14 10:00:00+00:00
103,Trendhunter.com,Facial Research Engines - IntroThem Uses Facial Recognition To Deliver In-Depth Prospect Research (TrendHunter.com),https://www.trendhunter.com/trends/introthem,2025-08-14T09:48:05Z,"(TrendHunter.com) IntroThem is a specialized search platform that combines facial recognition technology with advanced data aggregation to conduct detailed research on individuals, prospects, and brands. By...","IntroThem is a specialized search platform that combines facial recognition technology with advanced data aggregation to conduct detailed research on individuals, prospects, and brands. By analyzing … [+849 chars]",newsapi,2025-08-14 09:48:05+00:00
104,The Conversation Africa,Investing that protects people and the planet is growing: new study maps the progress in South Africa,https://theconversation.com/investing-that-protects-people-and-the-planet-is-growing-new-study-maps-the-progress-in-south-africa-248022,2025-08-14T07:55:04Z,Investment decisions that take into account social and environmental factors have been slow to take off in South Africa.,"Institutional investors who invest on behalf of others are increasingly considering environmental conservation and safe working conditions as investment criteria. 

Sustainable investment has gained … [+6282 chars]",newsapi,2025-08-14 07:55:04+00:00
105,ETF Daily News,"Clearwater Analytics Holdings, Inc. (NYSE:CWAN) Shares Sold by Headlands Technologies LLC",https://www.etfdailynews.com/2025/08/14/clearwater-analytics-holdings-inc-nysecwan-shares-sold-by-headlands-technologies-llc/,2025-08-14T07:45:22Z,"Headlands Technologies LLC lowered its position in shares of Clearwater Analytics Holdings, Inc. (NYSE:CWAN – Free Report) by 81.2% in the first quarter, according to its most recent Form 13F filing with the Securities and Exchange Commission (SEC). The fund …","Headlands Technologies LLC lowered its position in shares of Clearwater Analytics Holdings, Inc. (NYSE:CWAN – Free Report) by 81.2% in the first quarter, according to its most recent Form 13F filing … [+6117 chars]",newsapi,2025-08-14 07:45:22+00:00
106,ETF Daily News,Clearwater Analytics (NYSE:CWAN) Price Target Cut to $34.00 by Analysts at DA Davidson,https://www.etfdailynews.com/2025/08/14/clearwater-analytics-nysecwan-price-target-cut-to-34-00-by-analysts-at-da-davidson/,2025-08-14T05:52:57Z,"Clearwater Analytics (NYSE:CWAN – Get Free Report) had its target price lowered by investment analysts at DA Davidson from $36.00 to $34.00 in a report issued on Tuesday,Benzinga reports. The brokerage presently has a “buy” rating on the stock. DA Davidson’s …","Clearwater Analytics (NYSE:CWAN – Get Free Report) had its target price lowered by investment analysts at DA Davidson from $36.00 to $34.00 in a report issued on Tuesday,Benzinga reports. The brokera… [+5605 chars]",newsapi,2025-08-14 05:52:57+00:00
107,Rubyflow.com,Streamlining Healthcare Through Mobile Innovation,https://rubyflow.com/p/w157d9-streamlining-healthcare-through-mobile-innovation,2025-08-14T05:34:16Z,"Mobile-based healthcare applications are transforming patient care and institutional workflows by enabling smart appointment booking, secure data handling, and real-time access to medical information. These applications are designed for seamless integration w…","Mobile-based healthcare applications are transforming patient care and institutional workflows by enabling smart appointment booking, secure data handling, and real-time access to medical information… [+603 chars]",newsapi,2025-08-14 05:34:16+00:00
108,The-independent.com,Why you might want to think twice before using a period tracking app,https://www.the-independent.com/life-style/period-tracker-apps-privacy-data-b2805419.html,2025-08-14T05:00:00Z,"Millions of women are using digital platforms to make sense of their menstrual cycles, without necessarily thinking about the implications for their personal data. Katie Rosseinsky speaks to the experts about the risks, and hears from women who’ve quit the ap…","Your support helps us to tell the story
From reproductive rights to climate change to Big Tech, The Independent is on the ground when the story is developing. Whether it's investigating the financia… [+13878 chars]",newsapi,2025-08-14 05:00:00+00:00
109,Cointelegraph,AI agents will become Ethereum's ‘biggest power user’ — Coinbase devs,https://cointelegraph.com/news/ai-agents-ethereums-biggest-power-user,2025-08-14T04:50:01Z,"Ethereum’s future will be dominated by AI agents leveraging a dormant web standard, HTTP 402, and EIP 3009, to make real-world payments in crypto without human input, two Coinbase devs said.",Autonomous agents AI-powered programs that can think and transact without human input could unlock a new world of e-commerce on Ethereum due to a largely forgotten HTTP web standard that has only rec… [+2543 chars],newsapi,2025-08-14 04:50:01+00:00
110,Biztoc.com,Media Briefing: Amazon’s off-site ad push is becoming publishers’ post-cookie playbook,https://biztoc.com/x/d3fcb0f0fc216fca,2025-08-14T04:06:52Z,"Amazon is looking to an unexpected partner in its push for more ad dollars: publishers.
Once focused on its own sites and Prime Video, the company is now using shopper data, clean rooms and publisher partnerships to open up streaming and open-web inventory.
F…","Amazon is looking to an unexpected partner in its push for more ad dollars: publishers.Once focused on its own sites and Prime Video, the company is now using shopper data, clean rooms and publisher … [+143 chars]",newsapi,2025-08-14 04:06:52+00:00
111,Digiday,Media Briefing: Amazon’s off-site ad push is becoming publishers’ post-cookie playbook,http://digiday.com/media/media-briefing-amazons-off-site-ad-push-is-becoming-publishers-post-cookie-playbook/,2025-08-14T04:01:00Z,Amazon is fast becoming a partner du jour for publishers: a kind of post-cookie data wingman that’s helping them monetize the approximate 70 percent of the open web that’s now unaddressable.,"Amazon is looking to an unexpected partner in its push for more ad dollars: publishers.Once focused on its own sites and Prime Video, the company is now using shopper data, clean rooms and publisher … [+11922 chars]",newsapi,2025-08-14 04:01:00+00:00
112,Foreign Policy,The Past U.S. Presidents Who Met Putin,http://foreignpolicy.com/2025/08/13/trump-putin-summit-russia-ukraine-negotiations-us-presidents/,2025-08-13T21:40:59Z,And what their experiences can tell us about how the Alaska summit might unfold.,"When U.S. President Donald Trump meets with Russian President Vladimir Putin in Alaska on Friday for high-stakes talks, Trump will be coming face-to-face with a shrewd leader who has dealt with his f… [+6174 chars]",newsapi,2025-08-13 21:40:59+00:00
113,Decrypt,Ethereum ETF Flows in August Blow Past Post-Merge Token Issuance,https://decrypt.co/334996/ethereum-etf-flows-august-blow-past-post-merge-token-issuance,2025-08-13T19:35:54Z,"So far this month, Ethereum ETFs have pulled in as much ETH as the network has issued since the so-called merge in September 2022.","In brief
<ul><li>Spot Ethereum ETFs have attracted $2.3 billion in the U.S. this month, equating to roughly 500,000 ETH.</li><li>The network has issued 450,000 ETH since the ""merge"" took place in 20… [+3796 chars]",newsapi,2025-08-13 19:35:54+00:00
114,GlobeNewswire,LYNO AI Reports Strong Momentum in Early Bird Presale Ahead of Price Increase to $0.055,https://www.globenewswire.com/news-release/2025/08/13/3132909/0/en/LYNO-AI-Reports-Strong-Momentum-in-Early-Bird-Presale-Ahead-of-Price-Increase-to-0-055.html,2025-08-13T19:00:00Z,"ROAD TOWN, British Virgin Islands, Aug. 13, 2025 (GLOBE NEWSWIRE) -- LYNO AI is progressing at a rapid pace during its Early Bird presale period, attracting attention from traders and investors. The project’s autonomous AI-powered cross-chain arbitrage engine…","ROAD TOWN, British Virgin Islands, Aug. 13, 2025 (GLOBE NEWSWIRE) -- LYNO AI is progressing at a rapid pace during its Early Bird presale period, attracting attention from traders and investors. The … [+5138 chars]",newsapi,2025-08-13 19:00:00+00:00
115,EFF, Spotify Face Scans Are Just the Beginning | EFFector 37.10,https://www.eff.org/deeplinks/2025/08/spotify-face-scans-are-just-beginning-effector-3710,2025-08-13T18:43:31Z,"Catching up on your backlog of digital rights news has never been easier! EFF has a one-stop-shop to keep you up to date on the latest in the fight against censorship and surveillance—our EFFector newsletter.

This time we're covering an act of government in…",Catching up on your backlog of digital rights news has never been easier! EFF has a one-stop-shop to keep you up to date on the latest in the fight against censorship and surveillanceour EFFector new… [+1462 chars],newsapi,2025-08-13 18:43:31+00:00
116,The Conversation Africa,Censoring video games with sexual content suppresses the diversity of human desire,https://theconversation.com/censoring-video-games-with-sexual-content-suppresses-the-diversity-of-human-desire-262436,2025-08-13T18:18:01Z,Targeting adult NSFW video games could have knock-on effects on queer creators and sexual education content.,"The battle over adult content is provoking concern about censorship and threatening game makers’ livelihoods. (Pexels/John Petalcurin)
Following a campaign by Australian anti-porn organization Colle… [+7962 chars]",newsapi,2025-08-13 18:18:01+00:00
117,Wired,Data Brokers Face New Pressure for Hiding Opt-Out Pages From Google,https://www.wired.com/story/hassan-data-broker-opt-out-letter/,2025-08-13T18:00:00Z,"After reporters found dozens of firms hiding privacy tools from search results, US senator Maggie Hassan insists the companies explain their practices—and pledge to improve access to privacy controls.",United States senator Maggie Hassan is pressing major data brokers after an investigation by The Markup/CalMatters and co-published by WIRED found at least 35 firms hid opt-out information from searc… [+4180 chars],newsapi,2025-08-13 18:00:00+00:00
