source,title,url,published_at,description,content,fetched_from,published_at_parsed
Fox News,How to tell if a login alert is real or a scam,https://www.foxnews.com/tech/how-tell-login-alert-real-scam,2025-06-08T14:00:54Z,"Protect yourself from login alert scams with five security steps, including avoiding suspicious links, checking account activity and enabling two-factor authentication","Online scams thrive on the urgency and fear of their victims. If you've ever been a victim of a scam, youd know that bad actors often try to rush you into taking action by creating a sense of fear. A… [+9195 chars]",newsapi,2025-06-08 14:00:54+00:00
Securityaffairs.com,Over 950K weekly downloads at risk in ongoing supply chain attack on Gluestack packages,https://securityaffairs.com/178772/malware/over-950k-weekly-downloads-at-risk-in-ongoing-supply-chain-attack-on-gluestack-packages.html,2025-06-08T13:35:00Z,"A supply chain attack hit NPM, threat actors compromised 16 popular Gluestack packages, affecting 950K+ weekly downloads. Researchers from Aikido Security discovered a new supply chain attack targeted NPM, compromising 16 popular Gluestack ‘react-native-aria’…","Over 950K weekly downloads at risk in ongoing supply chain attack on Gluestack packages
 | SECURITY AFFAIRS MALWARE NEWSLETTER ROUND 48
 | Security Affairs newsletter Round 527 by Pierluigi Paganin… [+170795 chars]",newsapi,2025-06-08 13:35:00+00:00
Upenn.edu,LLMs that quack like a duck,https://languagelog.ldc.upenn.edu/nll/?p=69432,2025-06-08T11:51:39Z,"A letter to the editor on the essential nature LLMs from the Times Literary Supplement (5/30/25):  Large language models As someone who has spent the past few years working out what AI means to academic journals, I found Melanie Mitchell’s excellent review of…","A letter to the editor on the essential nature LLMs from the Times Literary Supplement (5/30/25):As someone who has spent the past few years working out what AI means to academic journals, I found Me… [+2289 chars]",newsapi,2025-06-08 11:51:39+00:00
Securityaffairs.com,SECURITY AFFAIRS MALWARE NEWSLETTER ROUND 48,https://securityaffairs.com/178766/malware/security-affairs-malware-newsletter-round-48.html,2025-06-08T11:35:30Z,Security Affairs Malware newsletter includes a collection of the best articles and research on malware in the international landscape Pure Crypter Malware Analysis: 99 Problems but Detection Ain’t One Attacker exploits misconfigured AI tool to run AI-generate…,"SECURITY AFFAIRS MALWARE NEWSLETTER ROUND 48
 | Security Affairs newsletter Round 527 by Pierluigi Paganini INTERNATIONAL EDITION
 | Experts found 4 billion user records online, the largest known l… [+170703 chars]",newsapi,2025-06-08 11:35:30+00:00
Securityaffairs.com,Security Affairs newsletter Round 527 by Pierluigi Paganini – INTERNATIONAL EDITION,https://securityaffairs.com/178759/uncategorized/security-affairs-newsletter-round-527-by-pierluigi-paganini-international-edition.html,2025-06-08T11:20:49Z,"A new round of the weekly Security Affairs newsletter has arrived! Every week, the best security articles from Security Affairs are free in your email box. Enjoy a new round of the weekly SecurityAffairs newsletter, including the international press. Experts …","Security Affairs newsletter Round 527 by Pierluigi Paganini INTERNATIONAL EDITION
 | Experts found 4 billion user records online, the largest known leak of Chinese personal data from a single source… [+170654 chars]",newsapi,2025-06-08 11:20:49+00:00
Pypi.org,nabla-ml 25.6081309,https://pypi.org/project/nabla-ml/25.6081309/,2025-06-08T11:10:03Z,Dynamic neural networks and function transformations in Python + Mojo,"A required part of this site couldnt load. This may be due to a browser
 extension, network issues, or browser settings. Please check your
 connection, disable any ad blockers, or try using a diffe… [+12 chars]",newsapi,2025-06-08 11:10:03+00:00
Fox News,6 high-tech Father’s Day gifts that show you really care,https://www.foxnews.com/tech/6-high-tech-fathers-day-gifts-show-you-really-care,2025-06-08T10:00:21Z,"Skip the usual Father's Day gifts with personalized ideas for tech enthusiasts, home brewers, pool owners, seniors, outdoor lovers and privacy-conscious dads.","Shopping for Father's Day can feel like a bit of a puzzle, right? 
Every dad is different. Maybe yours is always glued to his laptop, loves keeping the pool spotless or enjoys pouring a fresh pint a… [+6420 chars]",newsapi,2025-06-08 10:00:21+00:00
Audioz.download,"The AI Music Revolution: Creativity, Controversy, and Collaboration",https://audioz.download/tutorials/books/278553-download_the-ai-music-revolution-creativity-controversy-and-collaboration.html,2025-06-08T09:45:14Z,"<!--TBegin:https://audioz.download/uploads/posts/2025-06/1749375753_4087887584.webp|--><!--TEnd-->English | February 22, 2025 | ASIN: B0DY666TZJ | 309 pages | EPUB | 1 MBThe relationship between artificial intelligence and music is no longer a futuristic fant…","English | February 22, 2025 | ASIN: B0DY666TZJ | 309 pages | EPUB | 1 MB
The relationship between artificial intelligence and music is no longer a futuristic fantasyit is a transformative reality. ""… [+867 chars]",newsapi,2025-06-08 09:45:14+00:00
ETF Daily News,"AMETEK, Inc. (NYSE:AME) Shares Purchased by Merit Financial Group LLC",https://www.etfdailynews.com/2025/06/08/ametek-inc-nyseame-shares-purchased-by-merit-financial-group-llc/,2025-06-08T08:50:53Z,"Merit Financial Group LLC grew its stake in shares of AMETEK, Inc. (NYSE:AME – Free Report) by 310.1% during the 1st quarter, according to the company in its most recent Form 13F filing with the Securities & Exchange Commission. The institutional investor own…","Merit Financial Group LLC grew its stake in shares of AMETEK, Inc. (NYSE:AME – Free Report) by 310.1% during the 1st quarter, according to the company in its most recent Form 13F filing with the Secu… [+6643 chars]",newsapi,2025-06-08 08:50:53+00:00
ETF Daily News,"Clearwater Analytics Holdings, Inc. (NYSE:CWAN) Receives $32.40 Consensus Price Target from Brokerages",https://www.etfdailynews.com/2025/06/08/clearwater-analytics-holdings-inc-nysecwan-receives-32-40-consensus-price-target-from-brokerages/,2025-06-08T06:38:53Z,"Clearwater Analytics Holdings, Inc. (NYSE:CWAN – Get Free Report) has been assigned a consensus rating of “Moderate Buy” from the ten research firms that are covering the stock, MarketBeat.com reports. One research analyst has rated the stock with a hold reco…","Clearwater Analytics Holdings, Inc. (NYSE:CWAN – Get Free Report) has been assigned a consensus rating of “Moderate Buy” from the ten research firms that are covering the stock, MarketBeat.com report… [+5754 chars]",newsapi,2025-06-08 06:38:53+00:00
Pypi.org,camagick added to PyPI,https://pypi.org/project/camagick/,2025-06-07T20:38:25Z,Command-line client tools for EPICS-CA data processing,"About CAmagick / CAspy
[TOC]
CAspy is the Swiss Army-Knife in your SCADA toolbox; your silver bullet
intended for Monday-morning Integration,
i.e. rapid, ad-hoc, last-minute
installation of feat… [+29245 chars]",newsapi,2025-06-07 20:38:25+00:00
Pypi.org,aimmspy 1.0.1.post53,https://pypi.org/project/aimmspy/1.0.1.post53/,2025-06-07T19:17:38Z,"Python bindings for the AIMMS optimization platform, built with pybind11 for seamless C++ integration. Enables efficient data exchange and interaction with AIMMS projects using pandas, polars, and pyarrow. Ideal for advanced optimization workflows requiring h…","A required part of this site couldnt load. This may be due to a browser
 extension, network issues, or browser settings. Please check your
 connection, disable any ad blockers, or try using a diffe… [+12 chars]",newsapi,2025-06-07 19:17:38+00:00
Securityaffairs.com,"Experts found 4 billion user records online, the largest known leak of Chinese personal data from a single source",https://securityaffairs.com/178744/data-breach/experts-found-4-billion-user-records-online-the-largest-known-leak-of-chinese-personal-data-from-a-single-source.html,2025-06-07T17:22:19Z,"Over 4 billion user records were found exposed online in a massive breach, possibly linked to the surveillance of Chinese citizens. Cybersecurity researcher Bob Dyachenko and the Cybernews team discovered a massive data leak in China that exposed billions of …","Experts found 4 billion user records online, the largest known leak of Chinese personal data from a single source
 | Attackers exploit Fortinet flaws to deploy Qilin ransomware
 | Russia-linked thr… [+170568 chars]",newsapi,2025-06-07 17:22:19+00:00
Engineroomtech.com,Can Digital Marketing Solution Integrators Fix Your Tech Stack?,https://blog.engineroomtech.com/can-digital-marketing-solution-integrators-fix-your-tech-stack,2025-06-07T14:50:43Z,Struggling with tech stack management in your digital marketing efforts? Explore how solution integrators can provide the ultimate fix for your martech issues.,"Marketing teams depend on various tools to manage customer journeysCRMs, email systems, and analytics platforms are just a few. However, when these tools dont communicate effectively, valuable data s… [+4041 chars]",newsapi,2025-06-07 14:50:43+00:00
Fox News,Massive DMV phishing scam tricks drivers with fake texts,https://www.foxnews.com/tech/massive-dmv-phishing-scam-tricks-drivers-fake-texts,2025-06-07T14:00:06Z,DMV text scam alert: Fraudsters impersonating motor vehicle departments nationwide are sending threatening messages about unpaid tickets and tolls to steal your information.,"If you've received a text message claiming to be from your state's Department of Motor Vehicles (DMV) and threatening you with fines or penalties unless you pay up, you're not alone. A new wave of sc… [+8299 chars]",newsapi,2025-06-07 14:00:06+00:00
MarketWatch,"A professor testing ChatGPT’s, DeepSeek’s and Grok’s stock-picking skills suggests stockbrokers should worry",https://www.marketwatch.com/story/a-professor-testing-chatgpts-deepseeks-and-groks-stock-picking-skills-suggests-stockbrokers-should-worry-f54d583a,2025-06-07T12:30:00Z,Alejandro Lopez-Lira has been impressed with how current AI models can trade markets.,"Because this was an academic simulation, no actual stocks were traded. But the software did compare the simulated performance against historical outcomes. The stock picks were made daily, with a medi… [+24393 chars]",newsapi,2025-06-07 12:30:00+00:00
Tom's Hardware UK,Tesla details how it finds punishing defective cores on its million-core Dojo supercomputers — a single error can ruin a weeks-long AI training run,https://www.tomshardware.com/pc-components/cpus/tesla-details-how-it-finds-punishing-defective-cores-on-its-million-core-dojo-supercomputers-a-single-error-can-ruin-a-weeks-long-ai-training-run,2025-06-07T12:26:35Z,"Tesla's Stress tool detects and disables faulty cores in Dojo wafer-scale processors, which power Dojo clusters with millions of cores, without interrupting AI training.","Detecting malfunctioning cores and disabling them on a massive processor is challenging, but Tesla has developed its Stress tool, which can detect cores prone to silent data corruption across not onl… [+6936 chars]",newsapi,2025-06-07 12:26:35+00:00
Neowin,Brave 1.79.119,https://www.neowin.net/software/brave-179119/,2025-06-07T07:04:10Z,"Privacy-focused web browser that prioritizes speed and security. With built-in HTTPS Everywhere and rewards for viewing ads, Brave is the perfect choice for those who value their privacy online. Read more...","Brave Browser is a lightning-fast, secure web browser that stands out from the competition with its focus on privacy, security, and speed. With features like HTTPS Everywhere and built-in tracker blo… [+1166 chars]",newsapi,2025-06-07 07:04:10+00:00
Digital Journal,"“Held hostage by your data?” How NE2NE is liberating payroll, HR, and manufacturing teams with one seamless integration platform",https://www.digitaljournal.com/business/held-hostage-by-your-data-how-ne2ne-is-liberating-payroll-hr-and-manufacturing-teams-with-one-seamless-integration-platform/article,2025-06-06T22:42:49Z,"Enter NE2NE, a rising B2B technology player built in the heart of Cleveland, Ohio, with a national vision and a powerful mission: free businesses from their data. The company's integration engine—The Platform—and its lightning-fast document automation tool— P…","Photo courtesy of Stephen Dawson on Unsplash
Opinions expressed by Digital Journal contributors are their own.
For thousands of growing businesses, digital transformation is a promise left unfulfil… [+8427 chars]",newsapi,2025-06-06 22:42:49+00:00
Securityaffairs.com,Attackers exploit Fortinet flaws to deploy Qilin ransomware,https://securityaffairs.com/178736/hacking/attackers-exploit-fortinet-flaws-to-deploy-qilin-ransomware.html,2025-06-06T22:09:16Z,Qilin ransomware now exploits Fortinet vulnerabilities to achieve remote code execution on impacted devices. Threat intelligence firm PRODAFT warned that Qilin ransomware (aka Phantom Mantis) group targeted multiple organizations between May and June 2025 by …,"Attackers exploit Fortinet flaws to deploy Qilin ransomware
 | Russia-linked threat actors targets Ukraine with PathWiper wiper
 | U.S. Offers $10M bounty for info on RedLine malware creator and st… [+170450 chars]",newsapi,2025-06-06 22:09:16+00:00
Securityaffairs.com,Russia-linked threat actors targets Ukraine with PathWiper wiper,https://securityaffairs.com/178726/apt/russia-linked-threat-actors-targets-ukraine-with-pathwiper-wiper.html,2025-06-06T18:30:42Z,A Russia-linked threat actor targeted a critical infrastructure organization in Ukraine with a new destructive malware dubbed PathWiper. Russia-linked threat actor targeted Ukraine’s critical infrastructure with a new wiper named PathWiper. Cisco Talos resear…,"Russia-linked threat actors targets Ukraine with PathWiper wiper
 | U.S. Offers $10M bounty for info on RedLine malware creator and state hackers
 | Play ransomware group hit 900 organizations sinc… [+170386 chars]",newsapi,2025-06-06 18:30:42+00:00
Sportico.com,Sportico Transactions: Moves and Mergers Roundup for June 6,https://www.sportico.com/personalities/people/2025/sportico-transactions-moves-mergers-roundup-june-6-2025-1234855349/,2025-06-06T18:00:00Z,"Welcome to Sportico’s transactions wire, a weekly rundown of personnel, partnerships, products and purchases across the sports business industry. PERSONNEL USMNT Legend Clint Dempsey Joins Men in Blazers Media Network Men in Blazers Media Network has signed C…","Welcome to Sportico’s transactions wire, a weekly rundown of personnel, partnerships, products and purchases across the sports business industry.
USMNT Legend Clint Dempsey Joins Men in Blazers Medi… [+14131 chars]",newsapi,2025-06-06 18:00:00+00:00
Pypi.org,aimmspy 1.0.1.post52,https://pypi.org/project/aimmspy/1.0.1.post52/,2025-06-06T14:52:44Z,"Python bindings for the AIMMS optimization platform, built with pybind11 for seamless C++ integration. Enables efficient data exchange and interaction with AIMMS projects using pandas, polars, and pyarrow. Ideal for advanced optimization workflows requiring h…","A required part of this site couldnt load. This may be due to a browser
 extension, network issues, or browser settings. Please check your
 connection, disable any ad blockers, or try using a diffe… [+12 chars]",newsapi,2025-06-06 14:52:44+00:00
Plos.org,Instability of estimation results based on caliper matching with propensity scores,https://journals.plos.org/plosone/article?id=10.1371/journal.pone.0325317,2025-06-06T14:00:00Z,Caliper matching is often used to adjust for confounding biases in observational studies. This method with random order matching allows for the cherry-picking of the analysis results to suit the analyst’s convenience. Random order matching can also result in …,"Abstract
Caliper matching is often used to adjust for confounding biases in observational studies. This method with random order matching allows for the cherry-picking of the analysis results to sui… [+36968 chars]",newsapi,2025-06-06 14:00:00+00:00
Plos.org,Nonequilibrium brain dynamics elicited as the origin of perturbative complexity,https://journals.plos.org/ploscompbiol/article?id=10.1371/journal.pcbi.1013150,2025-06-06T14:00:00Z,"Author summary The Perturbational Complexity Index (PCI) is a measure that was created to distinguish different states of consciousness. By introducing a perturbation in the brain, the brain’s response can be compared to its resting state dynamics. It has bee…","Citation: Stikvoort W, Pérez-Ordoyo E, Mindlin I, Escrichs A, Sitt JD, Kringelbach ML, et al. (2025) Nonequilibrium brain dynamics elicited as the origin of perturbative complexity. PLoS Comput Biol … [+53172 chars]",newsapi,2025-06-06 14:00:00+00:00
Plos.org,The TMA team and TTP pathway improved outcomes in a cohort with Thrombotic thrombocytopenic purpura,https://journals.plos.org/plosone/article?id=10.1371/journal.pone.0325417,2025-06-06T14:00:00Z,"Background Providing optimal care for patients with thrombotic thrombocytopenic purpura (TTP) is challenging because of multiple involved specialties, knowledge gaps, and a high rate of disease relapse. A thrombotic microangiopathy (TMA) Team and TTP Pathway …","Abstract
Background
Providing optimal care for patients with thrombotic thrombocytopenic purpura (TTP) is challenging because of multiple involved specialties, knowledge gaps, and a high rate of di… [+42334 chars]",newsapi,2025-06-06 14:00:00+00:00
Plos.org,The effects of visual stimulation on the cortical activity of brainstem stroke dysphagia patients: A functional near-infrared spectroscopy study,https://journals.plos.org/plosone/article?id=10.1371/journal.pone.0325510,2025-06-06T14:00:00Z,"Objective To investigate the difference in cortical activity under food visual stimulation between patients with brainstem stroke dysphagia and healthy adults by using functional near-infrared spectroscopy (fNIRS). Additionally, we seek to identify any potent…","Citation: Zhao D, Li Y, Ning K, Zou B, Wang B, Li L, et al. (2025) The effects of visual stimulation on the cortical activity of brainstem stroke dysphagia patients: A functional near-infrared spectr… [+26432 chars]",newsapi,2025-06-06 14:00:00+00:00
Plos.org,Blockchain-based zero trust networks with federated transfer learning for IoT security in industry 5.0,https://journals.plos.org/plosone/article?id=10.1371/journal.pone.0323241,2025-06-06T14:00:00Z,"The rise of Industry 5.0 focuses on merging advanced intelligence, automation, and human-centered teamwork in industrial settings. However, keeping interconnected IoT networks secure is still a challenging problem. This paper proposes a new security framework…","Abstract
The rise of Industry 5.0 focuses on merging advanced intelligence, automation, and human-centered teamwork in industrial settings. However, keeping interconnected IoT networks secure is sti… [+45126 chars]",newsapi,2025-06-06 14:00:00+00:00
GlobeNewswire,Live Laser-based Training and Simulation Platforms Research Report 2025-2030: Growing Emphasis on Realism and Combat Readiness Spurs Use of Precision Laser Engagement Systems in Field Training,https://www.globenewswire.com/news-release/2025/06/06/3095042/28124/en/Live-Laser-based-Training-and-Simulation-Platforms-Research-Report-2025-2030-Growing-Emphasis-on-Realism-and-Combat-Readiness-Spurs-Use-of-Precision-Laser-Engagement-Systems-in-Fie.html,2025-06-06T11:54:00Z,"The global Live Laser-based Training and Simulation Platforms market, valued at $680.1M in 2024, is projected to reach $902.0M by 2030, growing at a 4.8% CAGR. This growth reflects rising demand for advanced simulation in defense and public safety. The market…","Dublin, June 06, 2025 (GLOBE NEWSWIRE) -- The ""Live Laser-based Training and Simulation Platforms - Global Strategic Business Report"" has been added to ResearchAndMarkets.com's offering.
The global … [+10214 chars]",newsapi,2025-06-06 11:54:00+00:00
Securityaffairs.com,U.S. Offers $10M bounty for info on RedLine malware creator and state hackers,https://securityaffairs.com/178712/cyber-crime/u-s-offers-10m-bounty-for-info-on-redline-malware-creator-and-state-hackers.html,2025-06-06T11:12:23Z,"The U.S. offers up to $10M for info on state hackers linked to RedLine malware and its creator, Maxim Rudometov, tied to attacks on U.S. infrastructure. The U.S. Department of State offers a reward of up to $10 million for information nation-state actors link…","U.S. Offers $10M bounty for info on RedLine malware creator and state hackers
 | Play ransomware group hit 900 organizations since 2022
 | U.S. CISA adds Google Chromium V8 flaw to its Known Exploi… [+170317 chars]",newsapi,2025-06-06 11:12:23+00:00
Securityaffairs.com,Play ransomware group hit 900 organizations since 2022,https://securityaffairs.com/178702/cyber-crime/play-ransomware-group-hit-900-organizations-since-2022.html,2025-06-06T07:22:22Z,"A joint advisory from the US and Australian authorities states that Play ransomware has hit approximately 900 organizations over the past three years. A joint advisory from the Federal Bureau of Investigation (FBI), Cybersecurity and Infrastructure Security A…","Play ransomware group hit 900 organizations since 2022
 | U.S. CISA adds Google Chromium V8 flaw to its Known Exploited Vulnerabilities catalog
 | New versions of Chaos RAT target Windows and Linux… [+170235 chars]",newsapi,2025-06-06 07:22:22+00:00
9to5Mac,Here are three fantastic iCloud+ features you might not be taking advantage of,https://9to5mac.com/2025/06/05/the-best-three-icloud-plus-features/,2025-06-06T00:27:41Z,"In more recent years, Apple has introduced a number of interesting and privacy-preserving features for iCloud subscribers. It even rebranded its subscription to iCloud+ around the launch of these new features, highlighting the fact that iCloud is more than ju…","In more recent years, Apple has introduced a number of interesting and privacy-preserving features for iCloud subscribers. It even rebranded its subscription to iCloud+ around the launch of these new… [+3106 chars]",newsapi,2025-06-06 00:27:41+00:00
EFF,Keeping the Web Up Under the Weight of AI Crawlers,https://www.eff.org/deeplinks/2025/06/keeping-web-under-weight-ai-crawlers,2025-06-05T23:13:47Z,"If you run a site on the open web, chances are you've noticed a big increase in traffic over the past few months, whether or not your site has been getting more viewers, and you're not alone. Operators everywhere have observed a drastic increase in automated …","If you run a site on the open web, chances are you've noticed a big increase in traffic over the past few months, whether or not your site has been getting more viewers, and you're not alone. Operato… [+4871 chars]",newsapi,2025-06-05 23:13:47+00:00
Securityaffairs.com,U.S. CISA adds Google Chromium V8 flaw to its Known Exploited Vulnerabilities catalog,https://securityaffairs.com/178678/security/u-s-cisa-google-chromium-v8-flaw-known-exploited-vulnerabilities-catalog.html,2025-06-05T21:03:56Z,U.S. Cybersecurity and Infrastructure Security Agency (CISA) adds a Google Chromium V8 vulnerability to its Known Exploited Vulnerabilities catalog. The U.S. Cybersecurity and Infrastructure Security Agency (CISA) added Google Chromium V8 Out-of-Bounds Read a…,"U.S. CISA adds Google Chromium V8 flaw to its Known Exploited Vulnerabilities catalog
 | New versions of Chaos RAT target Windows and Linux systems
 | Critical flaw in Cisco ISE impacts cloud deplo… [+170176 chars]",newsapi,2025-06-05 21:03:56+00:00
Pypi.org,kaxanuk.data-curator 0.40.2,https://pypi.org/project/kaxanuk.data-curator/,2025-06-05T20:59:32Z,Tool for retrieving and combining financial and related data for informing security investments,"KaxaNuk Data Curator
Tool for building a structured database for market, fundamental and alternative data obtained
from different financial data provider web services.
Allows for easy creation of … [+3453 chars]",newsapi,2025-06-05 20:59:32+00:00
Securityaffairs.com,New versions of Chaos RAT target Windows and Linux systems,https://securityaffairs.com/178670/malware/new-versions-of-chaos-rat-target-windows-and-linux-systems.html,2025-06-05T20:29:16Z,"Acronis researchers reported that new Chaos RAT variants were employed in 2025 attacks against Linux and Windows systems. Acronis TRU researchers discovered new Chaos RAT variants targeting Linux and Windows in recent attacks. Originally seen in 2022, Chaos R…","New versions of Chaos RAT target Windows and Linux systems
 | Critical flaw in Cisco ISE impacts cloud deployments on AWS, Microsoft Azure, and Oracle Cloud Infrastructure
 | Ukraines military inte… [+170086 chars]",newsapi,2025-06-05 20:29:16+00:00
