,source,title,url,published_at,description,content,fetched_from,published_at_parsed
76,Plos.org,Progressive decomposition of infrared and visible image fusion network with joint transformer and Resnet,https://journals.plos.org/plosone/article?id=10.1371/journal.pone.0330328,2025-08-22T14:00:00Z,"Abstract The objective of image fusion is to synthesize information from multiple source images into a single, high-quality composite that is information-rich, thereby enhancing both human visual interpretation and machine perception capabilities. This proces…","Citation: Zhu F, Liu W (2025) Progressive decomposition of infrared and visible image fusion network with joint transformer and Resnet. PLoS One 20(8):
 e0330328.
https://doi.org/10.1371/journal.po… [+68763 chars]",newsapi,2025-08-22 14:00:00+00:00
77,Ndtvprofit.com,Centre Sanctions 23 Projects To Boost Semiconductor Design Potential,https://www.ndtvprofit.com/economy-finance/centre-sanctions-23-projects-to-boost-semiconductor-design-potential,2025-08-22T13:13:07Z,"The Union government has sanctioned 23 chip-design projects under the Design Linked Incentive Scheme as part of its effort to boost the country's semiconductor design capabilities, as per a release on Friday. These projects, led by domestic startups and MSMEs…","The Union government has sanctioned 23 chip-design projects under the Design Linked Incentive Scheme as part of its effort to boost the country's semiconductor design capabilities, as per a release o… [+1974 chars]",newsapi,2025-08-22 13:13:07+00:00
78,The Times of India,ET Soonicorns Summit 2025: How AI is personalising shopping in India,https://economictimes.indiatimes.com/tech/startups/et-soonicorns-summit-2025-how-ai-is-personalising-shopping-in-india/articleshow/123455222.cms,2025-08-22T12:56:18Z,"From predicting Sunday grocery runs to stocking extra small sizes in specific states, India's retail giants are betting big hyper-personalisation.","The future of retail isn't just about selling products, but about anticipating what customers need before they know it themselves. While most retailers are still stuck in the ""recognise and recommend… [+7962 chars]",newsapi,2025-08-22 12:56:18+00:00
79,The Times of India,"ET Soonicorns Summit 2025: Data privacy an afterthought while building products, says Razorpay COO",https://economictimes.indiatimes.com/tech/technology/et-soonicorns-summit-2025-data-privacy-an-afterthought-while-building-products-says-razorpay-coo/articleshow/123455356.cms,2025-08-22T12:50:32Z,"Speaking at a panel discussion on AI-driven personalisation and omnichannel commerce at the ET Soonicorns Summit 2025, Kothari said that companies taking consent of customers without revealing the purpose for which the data is to be used creates a challenge t…","The way most products are built, data privacy is an afterthought, said Razorpay chief operating officer (COO) Rahul Kothari, adding that these are the real implementation challenges of personalisatio… [+1802 chars]",newsapi,2025-08-22 12:50:32+00:00
80,Yahoo Entertainment,Ex-pastor at Pete Hegseth’s church calls for public executions and says Bible backs Ice raids,https://www.yahoo.com/news/articles/ex-pastor-pete-hegseth-church-110030335.html,2025-08-22T11:00:30Z,Podcast host Joshua Haymes voices range of extreme views and says liberalism a greater threat to US than neo-Nazism,"The US defense secretary, Pete Hegseth, has repeatedly endorsed the Reformation Red Pill podcast, and has appeared on four episodes. But the former pastor who hosts the show, and who attends Hegseths… [+16262 chars]",newsapi,2025-08-22 11:00:30+00:00
81,Healthsystemcio.com,"Oracle Health Loses Ground Post-Acquisition, But Some Promising Spots Emerge, KLAS Finds",https://healthsystemcio.com/2025/08/22/oracle-health-loses-ground-post-acquisition-but-some-promising-spots-emerge-klas-finds/,2025-08-22T11:00:00Z,"Three years after Oracle closed its acquisition of Cerner, many customers say promised benefits have yet to materialize, and defections have mounted among large health systems, according to a new report from KLAS. Oracle Health’s acute-care footprint has “sub…","Three years after Oracle closed its acquisition of Cerner, many customers say promised benefits have yet to materialize, and defections have mounted among large health systems, according to a new rep… [+3315 chars]",newsapi,2025-08-22 11:00:00+00:00
82,GlobeNewswire,"Homecare Clinical Nutrition Market Report 2025 | Nestle, Abbott, and Danone are Leading the Way in Offering Disease-specific Products for Renal Health, Oncology, Diabetes, and Malabsorption Syndromes",https://www.globenewswire.com/news-release/2025/08/22/3137740/28124/en/Homecare-Clinical-Nutrition-Market-Report-2025-Nestle-Abbott-and-Danone-are-Leading-the-Way-in-Offering-Disease-specific-Products-for-Renal-Health-Oncology-Diabetes-and-Malabsorpti.html,2025-08-22T10:36:00Z,"Growth in the Homecare Clinical Nutrition Market is driven by aging populations, rising chronic diseases, and government initiatives for cost-effective healthcare. HCN products help manage malnutrition, enhance recovery, and reduce hospital readmissions. The …","Dublin, Aug. 22, 2025 (GLOBE NEWSWIRE) -- The ""Homecare Clinical Nutrition Market - Focused Insights 2025-2030"" report has been added to ResearchAndMarkets.com's offering.
The Homecare Clinical Nutr… [+9868 chars]",newsapi,2025-08-22 10:36:00+00:00
83,GlobeNewswire,Vietnam Data Center Colocation Market Supply & Demand Analysis 2025-2030 - Vietnam's Data Center Facilities to Achieve Over 90% Occupancy by 2030,https://www.globenewswire.com/news-release/2025/08/22/3137739/28124/en/Vietnam-Data-Center-Colocation-Market-Supply-Demand-Analysis-2025-2030-Vietnam-s-Data-Center-Facilities-to-Achieve-Over-90-Occupancy-by-2030.html,2025-08-22T10:33:00Z,"The rising demand for scalable, high-performance data infrastructure boosts wholesale colocation adoption across key industries such as cloud services, telecommunications, and financial services. Supported by governmental digitalization efforts, the market pr…","Dublin, Aug. 22, 2025 (GLOBE NEWSWIRE) -- The ""Vietnam Data Center Colocation Market - Supply &amp; Demand Analysis 2025-2030"" has been added to ResearchAndMarkets.com's offering.
The Vietnam Data C… [+5702 chars]",newsapi,2025-08-22 10:33:00+00:00
84,Torrentfreak.com,Lithuanian Regulator Clashes With Data Firm Over “Misleading” Piracy Stats,https://torrentfreak.com/lithuanian-regulator-clashes-with-data-firm-over-misleading-piracy-stats/,2025-08-22T10:32:02Z,"Lithuania's broadcasting regulator (LRTK) challenges the accuracy of data reported by piracy tracking firm MUSO, which is the main input for key EUIPO reports. Citing flaws such as the inclusion of legal sites and an inability to track VPN or IPTV use, LRTK a…","Late last year, the European Union Intellectual Property Office released its latest copyright infringement monitor report. 
The research is part of a recurring series that has tracked European pirac… [+6594 chars]",newsapi,2025-08-22 10:32:02+00:00
85,Pypi.org,phileas added to PyPI,https://pypi.org/project/phileas/,2025-08-22T09:34:46Z,A Python package for the reproducibility of hardware security experiments.,"Project description
Phileas is a Python library that eases the acquisition of hardware security
datasets. Its goal is to facilitate the setup of fault injection and
side-channel analysis experimen… [+58415 chars]",newsapi,2025-08-22 09:34:46+00:00
86,ETF Daily News,"Clearwater Analytics Holdings, Inc. (NYSE:CWAN) Receives $32.67 Consensus Price Target from Brokerages",https://www.etfdailynews.com/2025/08/22/clearwater-analytics-holdings-inc-nysecwan-receives-32-67-consensus-price-target-from-brokerages/,2025-08-22T06:31:01Z,"Shares of Clearwater Analytics Holdings, Inc. (NYSE:CWAN – Get Free Report) have been assigned a consensus recommendation of “Buy” from the nine ratings firms that are currently covering the stock, Marketbeat Ratings reports. Nine analysts have rated the stoc…","Shares of Clearwater Analytics Holdings, Inc. (NYSE:CWAN – Get Free Report) have been assigned a consensus recommendation of “Buy” from the nine ratings firms that are currently covering the stock, M… [+5530 chars]",newsapi,2025-08-22 06:31:01+00:00
87,The Next Web,European space tech has data to sell — but where are the buyers?,https://thenextweb.com/news/europe-space-tech-data-buyers,2025-08-22T06:15:55Z,"The European space industry is booming. Yet despite the boom, the industry is struggling to find commercial buyers for arguably its most valuable output: data.  At the Living Planet Symposium 2025 in Vienna, the European Space Agency (ESA) and private sector …","The European space industry is booming. Yet despite the boom, the industry is struggling to find commercial buyers for arguably its most valuable output: data. 
At the Living Planet Symposium 2025 i… [+7682 chars]",newsapi,2025-08-22 06:15:55+00:00
88,Rebeccawilliams.info,Burner Phone 101,https://rebeccawilliams.info/burner-phone-101/,2025-08-22T05:47:01Z,"Hosted by the Brooklyn Public Library, this Burner Phone 101 workshop introduced participants to phone-related risk modeling, privacy-protective smartphone practices, the full spectrum of burner phone options, and when to leave phones behind entirely.","Hosted by the Brooklyn Public Library, this Burner Phone 101 workshop introduced participants to phone-related risk modeling, privacy-protective smartphone practices, the full spectrum of burner phon… [+7829 chars]",newsapi,2025-08-22 05:47:01+00:00
89,ETF Daily News,Head to Head Analysis: Subsea 7 (OTCMKTS:SUBCY) vs. Dawson Geophysical (NASDAQ:DWSN),https://www.etfdailynews.com/2025/08/22/head-to-head-analysis-subsea-7-otcmktssubcy-vs-dawson-geophysical-nasdaqdwsn/,2025-08-22T05:42:54Z,"Subsea 7 (OTCMKTS:SUBCY – Get Free Report) and Dawson Geophysical (NASDAQ:DWSN – Get Free Report) are both energy companies, but which is the superior investment? We will compare the two companies based on the strength of their dividends, valuation, earnings,…","Subsea 7 (OTCMKTS:SUBCY – Get Free Report) and Dawson Geophysical (NASDAQ:DWSN – Get Free Report) are both energy companies, but which is the superior investment? We will compare the two companies ba… [+5001 chars]",newsapi,2025-08-22 05:42:54+00:00
90,Forbes,Grasshopper Bank’s MCP: The Next Generation Of Small Business Banking,https://www.forbes.com/sites/ronshevlin/2025/08/21/grasshopper-banks-mcp-the-next-generation-of-small-business-banking/,2025-08-21T20:57:48Z,"MCPs represent the next frontier in digital banking. Grasshopper Bank's MCP elevates digital banking to proactive, context-aware intelligence for small businesses.","MCP Model Context Protocol
getty
Grasshopper Bank launched a first-of-its-kind Model Context Protocol (MCP) server that will allow its business banking clients access personalized financial analysi… [+7199 chars]",newsapi,2025-08-21 20:57:48+00:00
91,iTnews,Chemist Warehouse runs AI on HR shared inbox,https://www.itnews.com.au/news/chemist-warehouse-runs-ai-on-hr-shared-inbox-619769,2025-08-21T20:11:00Z,Drafts responses that HR team can tweak and send.,"Chemist Warehouse is running AI on a shared email inbox for human resources queries from its 30,000 employees and store owners, using it to detect certain questions and draft responses that the HR te… [+2330 chars]",newsapi,2025-08-21 20:11:00+00:00
92,Changefly.com,Show HN: Changefly ID + Anonymized Identity and Age Verification,https://www.changefly.com/blog/2025/08/anonymized-identity-and-age-verification-a-new-era-of-privacy-for-changefly-id,2025-08-21T19:22:53Z,"Hey HN! I’m Lukas Dickie the founder of Changefly and I’m truly excited to share with you our latest release of Changefly ID with Anonymized Identity & Age Verification.By putting privacy first and using a novel approach to account protection, Changefly ID of…","By Lukas Dickie, Changefly’s Founder
Today I’m excited to share something we’ve been working intensely on: Changefly ID + Anonymized Identity &amp; Age Verification. The keyword here is anonymized. … [+5585 chars]",newsapi,2025-08-21 19:22:53+00:00
93,Nvidia.com,NVIDIA Hardware Innovations and Open Source Contributions Are Shaping AI,https://developer.nvidia.com/blog/nvidia-hardware-innovations-and-open-source-contributions-are-shaping-ai/,2025-08-21T18:59:19Z,"Open source AI models such as Cosmos, DeepSeek, Gemma, GPT-OSS, Llama, Nemotron, Phi, Qwen, and many more are the foundation of AI innovation. These models are...","Open source AI models such as Cosmos, DeepSeek, Gemma, GPT-OSS, Llama, Nemotron, Phi, Qwen, and many more are the foundation of AI innovation. These models are democratizing AI by making model weight… [+10109 chars]",newsapi,2025-08-21 18:59:19+00:00
94,GlobeNewswire,"INVESTOR ALERT: Pomerantz Law Firm Investigates Claims On Behalf of Investors of Duolingo, Inc. - DUOL",https://www.globenewswire.com/news-release/2025/08/21/3137453/1087/en/INVESTOR-ALERT-Pomerantz-Law-Firm-Investigates-Claims-On-Behalf-of-Investors-of-Duolingo-Inc-DUOL.html,2025-08-21T18:38:00Z,"NEW YORK, Aug. 21, 2025 (GLOBE NEWSWIRE) -- Pomerantz LLP is investigating claims on behalf of investors of  Duolingo, Inc. (“Duolingo” or the “Company”) (NASDAQ: DUOL).  Such investors are advised to contact Danielle Peyton at newaction@pomlaw.com
 or 646-5…","NEW YORK, Aug. 21, 2025 (GLOBE NEWSWIRE) -- Pomerantz LLP is investigating claims on behalf of investors of  Duolingo, Inc. (Duolingo or the Company) (NASDAQ: DUOL).  Such investors are advised to co… [+1635 chars]",newsapi,2025-08-21 18:38:00+00:00
95,GlobeNewswire,Vereigen Media Tackles Dirty Data Crisis with 100% Human-Verified Lead Validation,https://www.globenewswire.com/news-release/2025/08/21/3137371/0/en/Vereigen-Media-Tackles-Dirty-Data-Crisis-with-100-Human-Verified-Lead-Validation.html,2025-08-21T16:30:00Z,"Dirty Data Costs Millions, Vereigen Media Solves It with 100% Human-Verified Validation......","AUSTIN, Texas, Aug. 21, 2025 (GLOBE NEWSWIRE) -- B2B marketers are under constant pressure to accomplish more with fewer resources. Many turn to third-party data aggregators, which can result in bloa… [+4899 chars]",newsapi,2025-08-21 16:30:00+00:00
96,Microsoft.com,Think before you Click(Fix): Analyzing the ClickFix social engineering technique | Microsoft Security Blog,https://www.microsoft.com/en-us/security/blog/2025/08/21/think-before-you-clickfix-analyzing-the-clickfix-social-engineering-technique/,2025-08-21T16:10:07Z,"The ClickFix social engineering technique has been growing in popularity, with campaigns targeting thousands of enterprise and end-user devices daily. This technique exploits users’ tendency to resolve technical issues by tricking them into running malicious …","Over the past year, Microsoft Threat Intelligence and Microsoft Defender Experts have observed the ClickFix social engineering technique growing in popularity, with campaigns targeting thousands of e… [+43489 chars]",newsapi,2025-08-21 16:10:07+00:00
97,Fox News,Remove your data to protect your retirement from scammers,https://www.foxnews.com/tech/remove-your-data-protect-your-retirement-from-scammers,2025-08-21T16:10:04Z,Data brokers sell personal details that scammers use to target retirement funds through fake financial advisor calls and convincing phishing attempts,"You've spent decades building your retirement fund. Now is the time to enjoy it, not lie awake worrying about scammers and identity thieves. Criminals are more aggressive than ever, and they know you… [+6019 chars]",newsapi,2025-08-21 16:10:04+00:00
98,Techtarget.com,"What is digital resilience? Definition, strategy and use cases",https://www.techtarget.com/searchdatabackup/definition/What-is-digital-resilience,2025-08-21T14:13:00Z,"Digital resilience is an organization's ability to manage risks and disruptions to its infrastructure, services and applications, regaining full functionality as quickly as possible while also learning from the experience.","Digital resilience is an organization's ability to manage risks and disruptions to its infrastructure, services and applications, regaining full functionality as quickly as possible while also learni… [+19337 chars]",newsapi,2025-08-21 14:13:00+00:00
99,GlobeNewswire,Kadant Named to Newsweek’s List of America’s Greatest Companies 2025,https://www.globenewswire.com/news-release/2025/08/21/3137267/0/en/Kadant-Named-to-Newsweek-s-List-of-America-s-Greatest-Companies-2025.html,2025-08-21T14:07:00Z,"WESTFORD, Mass., Aug. 21, 2025 (GLOBE NEWSWIRE) -- Kadant Inc. (NYSE: KAI) announced today it was recently named one of ""America's Greatest Companies 2025"" by Newsweek magazine. The award recognizes 650 U.S. companies evaluated on stock and financial performa…","WESTFORD, Mass., Aug. 21, 2025 (GLOBE NEWSWIRE) -- Kadant Inc. (NYSE: KAI) announced today it was recently named one of ""America's Greatest Companies 2025"" by Newsweek magazine. The award recognizes … [+2250 chars]",newsapi,2025-08-21 14:07:00+00:00
100,Plos.org,"Predicting knee osteoarthritis progression using neural network with longitudinal MRI radiomics, and biochemical biomarkers: A modeling study",https://journals.plos.org/plosmedicine/article?id=10.1371/journal.pmed.1004665,2025-08-21T14:00:00Z,"Ting Wang and Hao Liu develop and test a predictive model integrating longitudinal MRI radiomic features, biochemical biomarkers, and clinical variables to help forecast the progression of knee osteoarthritis.","Citation: Wang T, Liu H, Zhao W, Cao P, Li J, Chen T, et al. (2025) Predicting knee osteoarthritis progression using neural network with longitudinal MRI radiomics, and biochemical biomarkers: A mode… [+67576 chars]",newsapi,2025-08-21 14:00:00+00:00
101,Plos.org,The range and reach of qualitative research in neurosurgery: A scoping review,https://journals.plos.org/plosone/article?id=10.1371/journal.pone.0330770,2025-08-21T14:00:00Z,"Following calls for more qualitative research in neurosurgery, this scoping review aimed to describe the range and reach of qualitative studies relevant to the field of neurosurgery and the patients and families affected by neurosurgical conditions. A systema…","Citation: Whiffin CJ, O. Khu KJ, Smith BG, Kuhn I, Selveindran SM, Hobbs L, et al. (2025) The range and reach of qualitative research in neurosurgery: A scoping review. PLoS One 20(8):
 e0330770.
h… [+31076 chars]",newsapi,2025-08-21 14:00:00+00:00
102,Plos.org,Global burden and trends of age-related and other hearing loss: A 32-year analysis and future projections based on the GBD 2021,https://journals.plos.org/plosone/article?id=10.1371/journal.pone.0330690,2025-08-21T14:00:00Z,"Background To evaluate the global, regional, and national burdens of and trends in age-related and other hearing loss (ARoHL) from 1990–2021 based on the Global Burden of Disease 2021 database.   Methods This study examined trends and disparities in the preva…","Citation: Zhu J, Yang M, Zhou C, Kang H, Wang D (2025) Global burden and trends of age-related and other hearing loss: A 32-year analysis and future projections based on the GBD 2021. PLoS One 20(8):… [+43631 chars]",newsapi,2025-08-21 14:00:00+00:00
103,Plos.org,Burden of laryngeal cancer attributable to occupational asbestos exposure in China: A comprehensive analysis from 1990 to 2021,https://journals.plos.org/plosone/article?id=10.1371/journal.pone.0330878,2025-08-21T14:00:00Z,"Background Laryngeal cancer attributable to occupational asbestos exposure remains a significant public health concern, particularly in industrialized regions. This study analyzes the burden, trends, and contributing factors of laryngeal cancer due to asbesto…","Citation: Chen B, Zhan Z, Yu S, Huang J, Chen C, Wang J, et al. (2025) Burden of laryngeal cancer attributable to occupational asbestos exposure in China: A comprehensive analysis from 1990 to 2021. … [+37341 chars]",newsapi,2025-08-21 14:00:00+00:00
104,GlobeNewswire,Australia Data Center Colocation Market Analysis and Competition Outlook to 2030 | 37 New Data Center Facilities Set to Transform Australia's Digital Landscape,https://www.globenewswire.com/news-release/2025/08/21/3137221/28124/en/Australia-Data-Center-Colocation-Market-Analysis-and-Competition-Outlook-to-2030-37-New-Data-Center-Facilities-Set-to-Transform-Australia-s-Digital-Landscape.html,2025-08-21T13:19:00Z,"Around 500 industrial parks, including prominent ones like Sydney and Bundaberg, offer strategic operational benefits, attracting leading colocation operators like Equinix, NEXTDC, and newcomers like Vantage Data Centers. Around 500 industrial parks, includin…","Dublin, Aug. 21, 2025 (GLOBE NEWSWIRE) -- The ""Australia Data Center Colocation Market - Supply &amp; Demand Analysis 2025-2030"" report has been added to ResearchAndMarkets.com's offering.
The Austr… [+5667 chars]",newsapi,2025-08-21 13:19:00+00:00
105,Apple Newsroom,"Tax and Price Updates for Apps, In-App Purchases, and Subscriptions",https://developer.apple.com/news/?id=yo2104n5,2025-08-21T13:00:46Z,"The App Store is designed to make it easy to sell your digital goods and services globally, with support for 44 currencies across 175 storefronts.From time to time, we need to adjust prices or your proceeds due to changes in tax regulations or foreign exchang…","The App Store is designed to make it easy to sell your digital goods and services globally, with support for 44 currencies across 175 storefronts.
From time to time, we need to adjust prices or your… [+3323 chars]",newsapi,2025-08-21 13:00:46+00:00
106,GlobeNewswire,Magnite and Acxiom Forge Direct Integration to Enhance Addressable-Based Buying and Maximize Working Media in Streaming,https://www.globenewswire.com/news-release/2025/08/21/3137057/0/en/Magnite-and-Acxiom-Forge-Direct-Integration-to-Enhance-Addressable-Based-Buying-and-Maximize-Working-Media-in-Streaming.html,2025-08-21T12:00:00Z,Industry-first integration enables audience decisioning on the sell-side using Acxiom’s full suite of data services Industry-first integration enables audience decisioning on the sell-side using Acxiom’s full suite of data services,"NEW YORK, Aug. 21, 2025 (GLOBE NEWSWIRE) -- Magnite (NASDAQ: MGNI), the largest independent sell-side advertising company, today announced an integration with Acxiom®, the connected data and technolo… [+3979 chars]",newsapi,2025-08-21 12:00:00+00:00
107,GlobeNewswire,Thailand Data Center Colocation Market 2025-2030: An Assessment of Existing & New Operators and Emerging Investment Opportunities,https://www.globenewswire.com/news-release/2025/08/21/3137038/28124/en/Thailand-Data-Center-Colocation-Market-2025-2030-An-Assessment-of-Existing-New-Operators-and-Emerging-Investment-Opportunities.html,2025-08-21T11:30:00Z,"Dublin, Aug. 21, 2025 (GLOBE NEWSWIRE) -- The ""Thailand Data Center Colocation Market - Supply & Demand Analysis 2025-2030"" report has been added to ResearchAndMarkets.com's offering.The Thailand Data Center Colocation Market was valued at USD 175 million in …","Dublin, Aug. 21, 2025 (GLOBE NEWSWIRE) -- The ""Thailand Data Center Colocation Market - Supply &amp; Demand Analysis 2025-2030"" report has been added to ResearchAndMarkets.com's offering.
The Thaila… [+4422 chars]",newsapi,2025-08-21 11:30:00+00:00
108,Medical Device Network,EPO grants patent for Autonomix Medical’s catheter technology,https://www.medicaldevice-network.com/news/autonomix-catheter-technology/,2025-08-21T10:18:34Z,"The patent covers a broad spectrum of applications, including arterial and renal mapping.","The European Patent Office (EPO) has granted patent no. 3,697,298 to Autonomix Medicals catheter-based technology that facilitates the gathering and analysis of sensory data, essential for real-time … [+2393 chars]",newsapi,2025-08-21 10:18:34+00:00
109,GlobeNewswire,Singapore Data Center Colocation Market Analysis 2025-2030 - Retrofit Opportunities Surge Amidst Singapore Data Center Expansion Moratorium,https://www.globenewswire.com/news-release/2025/08/21/3136947/28124/en/Singapore-Data-Center-Colocation-Market-Analysis-2025-2030-Retrofit-Opportunities-Surge-Amidst-Singapore-Data-Center-Expansion-Moratorium.html,2025-08-21T09:06:00Z,"Dublin, Aug. 21, 2025 (GLOBE NEWSWIRE) -- The ""Singapore Data Center Colocation Market - Supply & Demand Analysis 2025-2030"" report has been added to ResearchAndMarkets.com's offering.The Singapore Data Center Colocation Market was valued at USD 2.19 billion …","Dublin, Aug. 21, 2025 (GLOBE NEWSWIRE) -- The ""Singapore Data Center Colocation Market - Supply &amp; Demand Analysis 2025-2030"" report has been added to ResearchAndMarkets.com's offering.
The Singa… [+6320 chars]",newsapi,2025-08-21 09:06:00+00:00
110,Kaspersky.com,Modern vehicle cybersecurity trends,https://ics-cert.kaspersky.com/publications/reports/2025/08/21/modern-vehicle-cybersecurity-trends/,2025-08-21T09:00:00Z,"Why cyberattacks on vehicles have not yet become a widespread phenomenon, what are the consequences of turning a car into a gadget and which ones are at risk","Modern vehicles are actively evolving into full-fledged gadgets on wheels. They offer users a wide range of options: some represent traditional functionality, now available in new formats, such as su… [+23010 chars]",newsapi,2025-08-21 09:00:00+00:00
