source,title,url,published_at,description,content,fetched_from,published_at_parsed
InfoQ.com,Article: Using Traffic Mirroring to Debug and Test Microservices in Production-Like Environments,https://www.infoq.com/articles/microservices-traffic-mirroring-istio-vpc/,2025-06-09T11:00:00Z,"Traffic mirroring has evolved from a network security tool to a robust method for debugging and testing microservices using real-world data. By safely duplicating production traffic to a shadow environment, teams can replicate elusive bugs, profile performanc…",<ul><li>Mirroring live production traffic to a shadow environment lets teams test and debug microservices under real-world conditions without impacting users.</li><li>Tools built into service meshes … [+19665 chars],newsapi,2025-06-09 11:00:00+00:00
ExchangeWire,AdSpin Games Joins MarkApp’s Mobile Marketplace to Power Contextual Performance Advertising,https://www.exchangewire.com/blog/2025/06/09/adspin-games-joins-markapps-mobile-marketplace-to-power-contextual-performance-advertising/,2025-06-09T10:32:42Z,"MarkApp, the global contextual DSP and mobile app marketplace, has announced a new partnership with AdSpin Games, a division of SpinX and developer of high-performing casual and hyper-casual mobile games. The integration brings AdSpin's premium owned-and-oper…","MarkApp, the global contextual DSP and mobile app marketplace, has announced a new partnership with AdSpin Games, a division of SpinX and developer of high-performing casual and hyper-casual mobile g… [+3067 chars]",newsapi,2025-06-09 10:32:42+00:00
Livemint,Siddharth Pai: Can AI beat quantum computing at its own game?,https://www.livemint.com/opinion/online-views/quantum-computing-artificial-intelligence-deep-learning-machine-learning-neural-networks-deepmind-ai-mathematics-google-11749411935622.html,2025-06-09T10:30:08Z,Artificial intelligence (AI) has shown it can imperfectly but acceptably achieve much that was envisioned for quantum computers. And AI is moving fast. So quantum computing risks becoming a beautiful idea outpaced by a merely competence but deployable alterna…,"For decades, quantum computing has been described as the 21st centurys technological lodestarwith its unfathomable computational power poised to solve problems beyond the ken of classical machines. Q… [+5485 chars]",newsapi,2025-06-09 10:30:08+00:00
The Times of India,"Indian banks must urgently embrace AI, privacy technologies to comply with DPDP Act: Report",https://economictimes.indiatimes.com/tech/technology/indian-banks-must-urgently-embrace-ai-privacy-technologies-to-comply-with-dpdp-act-report/articleshow/121726544.cms,2025-06-09T10:29:15Z,"Indian banks must urgently adopt artificial intelligence (AI), privacy-enhancing technologies (PETs), and privacy-by-design strategies to effectively comply with the Digital Personal Data Protection Act (DPDPA), according to a report released by Protiviti.","Indian banks must urgently adopt artificial intelligence (AI), privacy-enhancing technologies (PETs), and privacy-by-design strategies to effectively comply with the Digital Personal Data Protection … [+2680 chars]",newsapi,2025-06-09 10:29:15+00:00
Financial Post,Netcracker and Its Customers Discuss the Importance of AI and Automation in Driving Exceptional Experiences at DTW Ignite,https://financialpost.com/pmn/business-wire-news-releases-pmn/netcracker-and-its-customers-discuss-the-importance-of-ai-and-automation-in-driving-exceptional-experiences-at-dtw-ignite,2025-06-09T10:08:07Z,"Netcracker’s Strong Partnerships Take the Spotlight During Stage Talks With Odido, Telenet, TELUS and Virgin Media O2 on Modernizing IT Systems to Gain Agility and Efficiency WALTHAM, Mass. — Netcracker Technology announced today that it will showcase its unr…","Netcrackers Strong Partnerships Take the Spotlight During Stage Talks With Odido, Telenet, TELUS and 
THIS CONTENT IS RESERVED FOR SUBSCRIBERS ONLY
Subscribe now to read the latest news in your cit… [+5072 chars]",newsapi,2025-06-09 10:08:07+00:00
ComputerWeekly.com,Are we normalising surveillance in schools?,https://www.computerweekly.com/feature/Are-we-normalising-surveillance-in-schools,2025-06-09T09:45:00Z,"Children and teenagers are subjected to a vast array of surveillance technologies in schools. These are intended to keep them safe, but are we normalising surveillance for young people?","A vast array of student information is collected under protective measures in secondary schools and colleges, yet the pupils are not always aware of what is being collected and how it is being stored… [+8424 chars]",newsapi,2025-06-09 09:45:00+00:00
GlobeNewswire,"AI-Enabled Drug Discovery and Clinical Trials Research Report 2025-2035 Featuring AiCure, Aitia, Atomwise, BenevolentAI, Insilico Medicine, PathAI, Recursion, Saama, Schroedinger, Tempus, Unlearn.ai",https://www.globenewswire.com/news-release/2025/06/09/3095666/28124/en/AI-Enabled-Drug-Discovery-and-Clinical-Trials-Research-Report-2025-2035-Featuring-AiCure-Aitia-Atomwise-BenevolentAI-Insilico-Medicine-PathAI-Recursion-Saama-Schroedinger-Tempus-Un.html,2025-06-09T09:13:00Z,"Discover the thriving AI-Enabled Drug Discovery and Clinical Trials Market set to exceed USD 3 billion by 2025, with projections extending to 2035. Key growth drivers include accelerated drug development timelines and cost efficiency through AI innovations su…","Dublin, June 09, 2025 (GLOBE NEWSWIRE) -- The ""AI-Enabled Drug Discovery and Clinical Trials Market Report 2025-2035"" report has been added to ResearchAndMarkets.com's offering.
Overall world revenu… [+9589 chars]",newsapi,2025-06-09 09:13:00+00:00
Securityaffairs.com,New Mirai botnet targets TBK DVRs by exploiting CVE-2024-3721,https://securityaffairs.com/178779/malware/new-mirai-botnet-targets-tbk-dvrs-by-exploiting-cve-2024-3721.html,2025-06-09T08:54:53Z,"A new variant of the Mirai botnet exploits CVE-2024-3721 to target DVR systems, using a new infection method. Researchers from Russian cybersecurity firm Kaspersky discovered a new variant of the Mirai botnet that exploits a command injection vulnerability (C…","New Mirai botnet targets TBK DVRs by exploiting CVE-2024-3721
 | BadBox 2.0 botnet infects millions of IoT devices worldwide, FBI warns
 | Over 950K weekly downloads at risk in ongoing supply chain… [+170936 chars]",newsapi,2025-06-09 08:54:53+00:00
ETF Daily News,"Procyon Advisors LLC Boosts Holdings in AMETEK, Inc. (NYSE:AME)",https://www.etfdailynews.com/2025/06/09/procyon-advisors-llc-boosts-holdings-in-ametek-inc-nyseame/,2025-06-09T08:52:53Z,"Procyon Advisors LLC boosted its stake in shares of AMETEK, Inc. (NYSE:AME – Free Report) by 6.4% during the 1st quarter, according to its most recent filing with the SEC. The firm owned 2,283 shares of the technology company’s stock after purchasing an addit…","Procyon Advisors LLC boosted its stake in shares of AMETEK, Inc. (NYSE:AME – Free Report) by 6.4% during the 1st quarter, according to its most recent filing with the SEC. The firm owned 2,283 shares… [+6497 chars]",newsapi,2025-06-09 08:52:53+00:00
ExchangeWire,Experian & Peer39 Enhance Contextual Advertising with Expanded UK Audience Data,https://www.exchangewire.com/blog/2025/06/09/experian-peer39-enhance-contextual-advertising-with-expanded-uk-audience-data/,2025-06-09T08:00:00Z,"Experian UK & I and Peer39 have announced an expansion to their existing partnership to help advertisers more effectively reach their customers using richer data and insights. Experian’s additional UK Demographics and Purchase Affinity audiences, as well as i…",Experian UK &amp; I and Peer39 have announced an expansion to their existing partnership to help advertisers more effectively reach their customers using richer data and insights. Experians additiona… [+2596 chars],newsapi,2025-06-09 08:00:00+00:00
Pythonbytes.fm,Python Bytes: #435 Stop with .folders in my ~/,https://pythonbytes.fm/episodes/show/435/stop-with-.folders-in-my,2025-06-09T08:00:00Z,"News and announcements from the Python community for the week of Jun 9th, 2025","Join us on YouTube at pythonbytes.fm/live to be part of the audience. Usually Monday at 10am PT. Older video versions available there too.Finally, if you want an artisanal, hand-crafted digest of eve… [+26865 chars]",newsapi,2025-06-09 08:00:00+00:00
ETF Daily News,Ivanhoe Electric Inc. (NYSEAMERICAN:IE) Shares Bought by UBS AM a distinct business unit of UBS ASSET MANAGEMENT AMERICAS LLC,https://www.etfdailynews.com/2025/06/09/ivanhoe-electric-inc-nyseamericanie-shares-bought-by-ubs-am-a-distinct-business-unit-of-ubs-asset-management-americas-llc/,2025-06-09T07:40:56Z,"UBS AM a distinct business unit of UBS ASSET MANAGEMENT AMERICAS LLC grew its stake in shares of Ivanhoe Electric Inc. (NYSEAMERICAN:IE – Free Report) by 34.9% in the fourth quarter, according to the company in its most recent 13F filing with the Securities a…","UBS AM a distinct business unit of UBS ASSET MANAGEMENT AMERICAS LLC grew its stake in shares of Ivanhoe Electric Inc. (NYSEAMERICAN:IE – Free Report) by 34.9% in the fourth quarter, according to the… [+3975 chars]",newsapi,2025-06-09 07:40:56+00:00
Securityaffairs.com,"BadBox 2.0 botnet infects millions of IoT devices worldwide, FBI warns",https://securityaffairs.com/178789/malware/badbox-2-0-botnet-infects-millions-of-iot-devices-worldwide-fbi-warns.html,2025-06-09T07:34:24Z,"BadBox 2.0 malware has infected millions of IoT devices globally, creating a botnet used for cyber criminal activities, the FBI warns. The FBI published a Public Service Announcement (PSA) to warn that cybercriminals are using the BADBOX 2.0 botnet to exploit…","BadBox 2.0 botnet infects millions of IoT devices worldwide, FBI warns
 | Over 950K weekly downloads at risk in ongoing supply chain attack on Gluestack packages
 | SECURITY AFFAIRS MALWARE NEWSLET… [+170870 chars]",newsapi,2025-06-09 07:34:24+00:00
Brothers-brick.com,LEGO floating service station keeps the locals in the air,https://www.brothers-brick.com/2025/06/09/lego-floating-service-station-keeps-the-locals-in-the-air/,2025-06-09T07:00:03Z,"This fun floating pit stop by Brickleas (@brickleas) looks like the perfect place to stretch your legs on your next airborne roadtrip (or is that airtrip?)
The post LEGO floating service station keeps the locals in the air appeared first on The Brothers Brick.","The Brothers Brick respects your online privacy and security. In accordance with the General Data Protection Regulation (GDPR) effective on May 25, 2018, we are providing greater transparency, and we… [+137 chars]",newsapi,2025-06-09 07:00:03+00:00
ETF Daily News,Head to Head Review: Spectris (OTCMKTS:SEPJY) & Münchener Rückversicherungs-Gesellschaft Aktiengesellschaft in München (OTCMKTS:MURGY),https://www.etfdailynews.com/2025/06/09/head-to-head-review-spectris-otcmktssepjy-munchener-ruckversicherungs-gesellschaft-aktiengesellschaft-in-munchen-otcmktsmurgy/,2025-06-09T06:22:56Z,"Spectris (OTCMKTS:SEPJY – Get Free Report) and Münchener Rückversicherungs-Gesellschaft Aktiengesellschaft in München (OTCMKTS:MURGY – Get Free Report) are both computer and technology companies, but which is the superior stock? We will compare the two busine…","Spectris (OTCMKTS:SEPJY – Get Free Report) and Münchener Rückversicherungs-Gesellschaft Aktiengesellschaft in München (OTCMKTS:MURGY – Get Free Report) are both computer and technology companies, but… [+6491 chars]",newsapi,2025-06-09 06:22:56+00:00
Techtarget.com,What are the top 8 healthcare data and coding standards?,https://www.techtarget.com/searchhealthit/feature/What-are-the-top-8-healthcare-data-and-coding-standards,2025-06-09T06:00:00Z,Data standards are the secret sauce that allow information to flow from one provider to another and enable providers to bill for specific procedures.,"As the healthcare industry continues to share more health information, developing and upholding data standards are essential to improving interoperability and ensuring regulatory compliance.
""Health… [+6593 chars]",newsapi,2025-06-09 06:00:00+00:00
ComputerWeekly.com,US lawmakers say UK has ‘gone too far’ by attacking Apple’s encryption,https://www.computerweekly.com/news/366625614/US-lawmakers-say-UK-has-gone-too-far-by-attacking-Apples-encryption,2025-06-09T05:00:00Z,US politicians are calling for Congress to rewrite the US Cloud Act to prevent the UK issuing orders to require US tech companies to introduce ‘backdoors’ in end-to-end encrypted messaging and storage,"US lawmakers are calling on the Trump administration to revisit its data-sharing agreement with the UK, following growing disquiet that a secret legal order issued by the UK against Apple will damage… [+11268 chars]",newsapi,2025-06-09 05:00:00+00:00
Lewrockwell.com,Palantir – Birth of the American Police State,https://www.lewrockwell.com/2025/06/no_author/palantir-birth-of-the-american-police-state/,2025-06-09T04:01:00Z,"I have been having the most interesting conversations with ChatGPT. While I have previously dismissed AI as never having true intelligence, after using ChatGPT 4.1 for a while, I have found that I was partly wrong. While AI still can’t tell truth from error v…","I have been having the most interesting conversations with ChatGPT. While I have previously dismissed AI as never having true intelligence, after using ChatGPT 4.1 for a while, I have found that I wa… [+8481 chars]",newsapi,2025-06-09 04:01:00+00:00
Carnegie Mellon University,Out of Distribution Detection: Knowing When AI Doesn’t Know,https://insights.sei.cmu.edu/blog/out-of-distribution-detection-knowing-when-ai-doesnt-know/,2025-06-09T04:00:00Z,How do we know when an AI system is operating outside its intended knowledge boundaries?,"Imagine a military surveillance system trained to identify specific vehicles in desert environments. One day, this system is deployed in a snowy mountain region and begins misidentifying civilian veh… [+10649 chars]",newsapi,2025-06-09 04:00:00+00:00
SoyaCincau.com,An Open Letter to MCMC: What Does Privacy Mean to You?,https://soyacincau.com/2025/06/09/mobile-phone-data-open-letter-to-mcmc/,2025-06-09T01:55:16Z,"Over the past week, Malaysians learned not through a public announcement, but through leaked information that the Malaysian Communications and Multimedia Commission (MCMC) had requested detailed mobile phone data from all major telcos in the country, includin…","Over the past week, Malaysians learned not through a public announcement, but through leaked information that the Malaysian Communications and Multimedia Commission (MCMC) had requested detailed mobi… [+6302 chars]",newsapi,2025-06-09 01:55:16+00:00
Pypi.org,keras-geometric 0.0.2,https://pypi.org/project/keras-geometric/0.0.2/,2025-06-09T01:11:49Z,A Python package for building and training graph neural networks using Keras.,"A required part of this site couldnt load. This may be due to a browser
 extension, network issues, or browser settings. Please check your
 connection, disable any ad blockers, or try using a diffe… [+12 chars]",newsapi,2025-06-09 01:11:49+00:00
Darknet.org.uk,"Monkey365 – PowerShell Security Scanner for Microsoft 365, Azure, and Entra ID",https://www.darknet.org.uk/2025/06/monkey365-powershell-security-scanner-for-microsoft-365-azure-and-entra-id/,2025-06-09T01:00:00Z,"Monkey365 is an open-source PowerShell scanner that automates security and compliance reviews across Microsoft 365, Azure subscriptions, and Entra ID. No dashboards or cloud APIs required.","Monkey365 is a PowerShell module designed for security consultants and DevSecOps teams to automate configuration audits across Microsoft365, Azure, and EntraID. It runs over 160 CIS benchmark checks … [+2530 chars]",newsapi,2025-06-09 01:00:00+00:00
Pypi.org,mct-nightly 2.4.0.20250609.615,https://pypi.org/project/mct-nightly/2.4.0.20250609.615/,2025-06-09T00:06:16Z,A Model Compression Toolkit for neural networks,"A required part of this site couldnt load. This may be due to a browser
 extension, network issues, or browser settings. Please check your
 connection, disable any ad blockers, or try using a diffe… [+12 chars]",newsapi,2025-06-09 00:06:16+00:00
Elifesciences.org,"Heterozygosity for neurodevelopmental disorder-associated TRIO variants yields distinct deficits in behavior, neuronal development, and synaptic transmission in mice",https://elifesciences.org/articles/103620,2025-06-09T00:00:00Z,"Genetic variants in TRIO are associated with neurodevelopmental disorders (NDDs) including schizophrenia (SCZ), autism spectrum disorder (ASD), and intellectual disability. TRIO uses its two guanine nucleotide exchange factor (GEF) domains to activate GTPases…","<table><tr><th>Reagent type (species) or resource</th><th>Designation</th><th>Source or reference</th><th>Identifiers</th><th>Additional information</th></tr>
<tr><td>Strain, strain background (Mus … [+36582 chars]",newsapi,2025-06-09 00:00:00+00:00
PR Newswire UK,EthicAI Advisory Limited: Cambridge spinout launches new tool to boost confidence in AI,https://www.prnewswire.co.uk/news-releases/ethicai-advisory-limited-cambridge-spinout-launches-new-tool-to-boost-confidence-in-ai-302474274.html,2025-06-08T23:01:00Z,"LONDON, June 9, 2025 /PRNewswire/ -- EthicAI Advisory Limited (""EthicAI""), a University of Cambridge spinout and global leader in the ethical and responsible assurance of artificial intelligence, has launched a cloud-based AI assurance SaaS platform to addres…","LONDON, June 9, 2025 /PRNewswire/ -- EthicAI Advisory Limited (""EthicAI""), a University of Cambridge spinout and global leader in the ethical and responsible assurance of artificial intelligence, has… [+3188 chars]",newsapi,2025-06-08 23:01:00+00:00
Royal Society of Chemistry,Highly UV-responsive indium-free Zn–Sn–Al–O phototransistor for optoelectronic artificial synapses,https://pubs.rsc.org/en/content/articlelanding/2025/tc/d5tc01255d,2025-06-08T23:00:00Z,"J. Mater. Chem. C, 2025, Advance ArticleDOI: 10.1039/D5TC01255D, PaperShice Wei, Xin Zhang, Bojia Chen, Jiyuan Zhu, Xuefeng Wu, David W. Zhang, Qing-Qing Sun, Shen Hu, Li JiIndium-free Zn–Sn–Al–O phototransistors demonstrate exceptional UV responsiveness and …","Conventional computing systems based on the von Neumann architecture face critical bottlenecks in power efficiency and parallel processing capabilities, significantly constraining their potential for… [+1962 chars]",newsapi,2025-06-08 23:00:00+00:00
Benzinga,Compyl Secures $12M Series A Funding to Expand AI-Powered GRC Platform Amid Rapid Growth,https://www.benzinga.com/news/topics/25/06/45829753/compyl-secures-12m-series-a-funding-to-expand-ai-powered-grc-platform-amid-rapid-growth,2025-06-08T21:01:13Z,,"Compyl, a New York-based provider of a unified governance, risk, and compliance platform, has raised $12 million in a Series A funding round led by Venture Guides. The company said in a statement tha… [+2214 chars]",newsapi,2025-06-08 21:01:13+00:00
Slashdot.org,Carlos Alcaraz rallies past Jannik Sinner in epic French Open final - The Washington Post,https://slashdot.org/firehose.pl?op=view&amp;id=177965113,2025-06-08T20:52:27Z,Carlos Alcaraz rallies past Jannik Sinner in epic French Open finalThe Washington Post Alcaraz prevails vs. Sinner in French Open thrillerESPN French Open 2025 results: Carlos Alcaraz fights back to beat Jannik Sinner in classic Roland Garros finalBBC PHOTOS:…,The Fine Print: The following comments are owned by whoever posted them. We are not responsible for them in any way.,newsapi,2025-06-08 20:52:27+00:00
Brothers-brick.com,An aquatic bird breaks new ground by flying high,https://www.brothers-brick.com/2025/06/08/an-aquatic-bird-breaks-new-ground-by-flying-high/,2025-06-08T19:00:04Z,"@ballomnomnom helps a penguin get powered-up with this propulsive rocket pack.
The post An aquatic bird breaks new ground by flying high appeared first on The Brothers Brick.","The Brothers Brick respects your online privacy and security. In accordance with the General Data Protection Regulation (GDPR) effective on May 25, 2018, we are providing greater transparency, and we… [+137 chars]",newsapi,2025-06-08 19:00:04+00:00
Pypi.org,nabla-ml 25.6082039,https://pypi.org/project/nabla-ml/25.6082039/,2025-06-08T18:39:36Z,Dynamic neural networks and function transformations in Python + Mojo,"A required part of this site couldnt load. This may be due to a browser
 extension, network issues, or browser settings. Please check your
 connection, disable any ad blockers, or try using a diffe… [+12 chars]",newsapi,2025-06-08 18:39:36+00:00
BleepingComputer,toughbook cf-19 mk5 driver help,https://www.bleepingcomputer.com/forums/t/808816/toughbook-cf-19-mk5-driver-help/,2025-06-08T18:20:47Z,"toughbook cf-19 mk5 driver help - posted in Internal Hardware: I cant find the right driver for m toughbook cf-19. the two driver i looking is! I am running windows 10 64 bit.
 
* Windows Description - PCI Data Acquisition and Signal Processing Controller
* H…","I can't find the right driver for m toughbook cf-19. the two driver i looking is! I am running windows 10 64 bit.
* Windows Description - PCI Data Acquisition and Signal Processing Controller
* Har… [+1170 chars]",newsapi,2025-06-08 18:20:47+00:00
Science 2.0,Win A MSCA Post-Doctoral Fellowship!,https://www.science20.com/tommaso_dorigo/win_a_msca_postdoctoral_fellowship-257470,2025-06-08T16:54:42Z,"Applications for MSCA Post-doctoral fellowships are on, and will be so until September 10 this year. What that means is that if you have less than 8 years of experience after your Ph.D., you can pair up with a research institute in Europe to present a researc…","Applications for MSCA Post-doctoral fellowships are on, and will be so until September 10 this year. What that means is that if you have less than 8 years of experience after your Ph.D., you can pair… [+10081 chars]",newsapi,2025-06-08 16:54:42+00:00
Storagereview.com,PNY CS2150 Review: Budget Price with Serious Trade-Offs,https://www.storagereview.com/review/pny-cs2150-review-budget-price-with-serious-trade-offs,2025-06-08T16:45:40Z,"Although it's a very affordable Gen5 SSD, it barely outperforms older Gen4 competitors.

<!--more-->The PNY CS2150 is positioned as an entry-level PCIe Gen5 SSD, making no promises of competing with the fastest drives on the market. Available in 1TB and 2TB c…","Although it’s a very affordable Gen5 SSD, it barely outperforms older Gen4 competitors.
The PNY CS2150 is positioned as an entry-level PCIe Gen5 SSD, making no promises of competing with the fastest… [+23253 chars]",newsapi,2025-06-08 16:45:40+00:00
Columbia.edu,An Ocean-Mapping Expert Predicts a “Huge Influx of Data” Will Soon Reveal Hidden Parts of Our Planet,https://news.climate.columbia.edu/2025/06/08/an-ocean-mapping-expert-predicts-a-huge-influx-of-data-will-soon-reveal-hidden-parts-of-our-planet/,2025-06-08T16:02:19Z,"In honor of World Oceans Day, marine geophysicist Vicki Ferrini discusses the current state of ocean research, and the important role international collaboration plays in this field.","R/V Marcus G. Langseth anchored in the port of Manzanillo, Mexico. Photo: Brandon Shuck
Today is UN World Oceans Day, and this years theme is Wonder: Sustaining What Sustains Us. One researcher who … [+6342 chars]",newsapi,2025-06-08 16:02:19+00:00
Columbia.edu,Leveraging the Power of Open Source Data To Map the World’s Oceans,https://news.climate.columbia.edu/2025/06/08/leveraging-the-power-of-open-source-data-to-map-the-worlds-oceans/,2025-06-08T16:02:19Z,"In honor of World Oceans Day, marine geophysicist Vicki Ferrini discusses the current state of ocean research, and the important role international collaboration plays in this field.","R/V Marcus G. Langseth anchored in the port of Manzanillo, Mexico. Photo: Brandon Shuck
Today is UN World Oceans Day, and this years theme is Wonder: Sustaining What Sustains Us. One researcher who … [+6342 chars]",newsapi,2025-06-08 16:02:19+00:00
Standardsapplied.com,Show HN: CurveFit Pro – Advanced nonlinear curve fitting in the browser,https://www.standardsapplied.com/curvefit-pro.html,2025-06-08T15:31:11Z,"We are pleased to announce a new version of our curve fitting web app with a whole new backend, front end, and all of the bells and whistles. If you see anything left out, or that could be improved, please let us know!! We'd love to hear any feedback from thi…","Basic and Widely-Applicable Models
Linear (y = a·x + b)
    
 Linear models describe proportional relationships between x and y. Use this for data that trends steadily in one direction, such as ca… [+32576 chars]",newsapi,2025-06-08 15:31:11+00:00
Cointelegraph,Gaming data is the next AI battleground,https://cointelegraph.com/news/gaming-data-next-ai-battleground,2025-06-08T15:00:00Z,Gaming’s behavioral data is rapidly becoming the most sought-after resource in AI. Game telemetry fuels next-gen AI agents for everything from logistics to finance. The battle for gaming data is on.,"Opinion by: T-RO, co-founder of GamerBoom
Forget the old pitch about interactive media. Every dungeon crawl, clutch revive and deck shuffle is time-stamped, geo-located and tied to an explicit objec… [+5079 chars]",newsapi,2025-06-08 15:00:00+00:00
