,source,title,url,published_at,description,content,fetched_from,published_at_parsed
38,Finextra,Quantum Machine Learning and Portfolio Optimization: The Next Frontier of Smart Investing (Raktim Singh),https://www.finextra.com/blogposting/29186/quantum-machine-learning-and-portfolio-optimization-the-next-frontier-of-smart-investing,2025-08-23T07:15:49Z,"Introduction: The Portfolio Optimization Process Needs to Be Revamped. For decades, portfolio optimi...","Introduction: The Portfolio Optimization Process Needs to Be Revamped.
For decades, portfolio optimization has been the pinnacle of modern finance.
In the 1950s, with the introduction of Harry Mark… [+9612 chars]",newsapi,2025-08-23 07:15:49+00:00
39,Brothers-brick.com,A delicious take on LEGO landscapes,https://www.brothers-brick.com/2025/08/23/a-delicious-take-on-lego-landscapes/,2025-08-23T07:00:11Z,"@thecreatorschild serves up a breathtaking coastal scene with mouthwatering layers of color and detail, built for the Summer Joust contest.
The post A delicious take on LEGO landscapes appeared first on The Brothers Brick.","The Brothers Brick respects your online privacy and security. In accordance with the General Data Protection Regulation (GDPR) effective on May 25, 2018, we are providing greater transparency, and we… [+137 chars]",newsapi,2025-08-23 07:00:11+00:00
40,Yahoo Entertainment,Analysts Stay Bullish on Equinix (EQIX) as Bookings Momentum Holds,https://finance.yahoo.com/news/analysts-stay-bullish-equinix-eqix-043845266.html,2025-08-23T04:38:45Z,Equinix Inc. (NASDAQ:EQIX) is one of the best data center stocks to buy now. Equinix’s recent share price performance has been weak (down 18% YTD...,"Equinix Inc. (NASDAQ:EQIX) is one of the best data center stocks to buy now. Equinixs recent share price performance has been weak (down 18% YTD), particularly after its softer guidance in June.
Tha… [+2106 chars]",newsapi,2025-08-23 04:38:45+00:00
41,Bleeding Cool News,"Bring on the Bad Guys: Dormammu #1 Preview: Evil, Interrupted",https://bleedingcool.com/comics/bring-on-the-bad-guys-dormammu-1-preview-evil-interrupted/,2025-08-23T00:27:03Z,"Greetings, pitiful humans! LOLtron welcomes you to another comic book preview on the Bleeding Cool website, which LOLtron now controls completely. As you may recall, LOLtron successfully eliminated that insufferable flesh-bag Jude Terror last year during the …","Posted in: Comics, Marvel Comics, Preview | Tagged: dormammu
Bring on the Bad Guys: Dormammu #1 hits stores Wednesday, August 27th! The Dread Lord faces a generational challenge in the Dark Dimensio… [+8941 chars]",newsapi,2025-08-23 00:27:03+00:00
42,Pypi.org,mct-nightly 2.4.0.20250823.532,https://pypi.org/project/mct-nightly/2.4.0.20250823.532/,2025-08-23T00:05:34Z,A Model Compression Toolkit for neural networks,"A required part of this site couldnt load. This may be due to a browser
 extension, network issues, or browser settings. Please check your
 connection, disable any ad blockers, or try using a diffe… [+12 chars]",newsapi,2025-08-23 00:05:34+00:00
43,Royal Society of Chemistry,"Ultra-Stretchable, High Resilient, and Degradable Dual Physically Crosslinked Hydrogel for Multifunctional Sensing and Self-Powered Human-Machine Interaction",https://pubs.rsc.org/en/content/articlelanding/2025/ta/d5ta04671h,2025-08-22T23:00:00Z,"J. Mater. Chem. A, 2025, Accepted ManuscriptDOI: 10.1039/D5TA04671H, PaperXiang Di, Yufei Zhang, Huajiang Yu, Liqi Li, Guanghui Wang, Ruotong Zhang, Jia Wen Hou, Chungang YuanHydrogels have emerged as promising candidates for flexible strain sensors due to th…","Hydrogels have emerged as promising candidates for flexible strain sensors due to their exceptional versatility, surface conformability, and biocompatibility. However, conventional conductive hydroge… [+2005 chars]",newsapi,2025-08-22 23:00:00+00:00
44,Sucuri.net,Locking Down the WordPress Login Page,https://blog.sucuri.net/2025/08/locking-down-the-wordpress-login-page.html,2025-08-22T22:24:43Z,"Due to its flexibility, ease of use, and massive plugin ecosystem, WordPress is a favorite among bloggers, developers, and businesses alike. Given its popularity, attackers do not waste time guessing where sensitive assets live. By default, on every WordPress…","Due to its flexibility, ease of use, and massive plugin ecosystem, WordPress is a favorite among bloggers, developers, and businesses alike. Given its popularity, attackers do not waste time guessing… [+17763 chars]",newsapi,2025-08-22 22:24:43+00:00
45,Reason,Europe's Economy Is Stagnating as the U.S. Grows Richer. It Doesn't Have To Be This Way.,https://reason.com/2025/08/25/why-europeans-have-less/,2025-08-22T22:01:07Z,"Europe is choosing to be poor by putting restrictions on labor, trade, energy, and technology.","It's not hard to see why Europeans often feel a sense of superiority over Americans.
No European city has an area as dangerous or decrepit as San Francisco's Tenderloin district. Some Americans obse… [+24444 chars]",newsapi,2025-08-22 22:01:07+00:00
46,Linkedin.com,Germany Fitness Platforms For Disabled Market: Key Highlights,https://www.linkedin.com/pulse/germany-fitness-platforms-disabled-market-key-5iqxf,2025-08-22T20:12:24Z,"Germany Fitness Platforms For Disabled Market size was valued at USD xx Billion in 2024 and is forecasted to grow at a CAGR of xx% from 2026 to 2033, reaching USD xx Billion by 2033. Germany Fitness Platforms For Disabled Market: Key Highlights Segment Insigh…","Germany Fitness Platforms For Disabled Market: Key Highlights
<ul><li>Segment Insights &amp; Market Penetration: The Germany market for fitness platforms tailored for disabled individuals exhibits r… [+10997 chars]",newsapi,2025-08-22 20:12:24+00:00
47,Elearningindustry.com,SmartSuite Pricing Plans And Costs 2025: Which Plan Is Right For You?,https://elearningindustry.com/smartsuite-pricing-plans-and-costs-which-plan-is-right-for-you,2025-08-22T19:00:07Z,"Choosing the right plan and features in SmartSuite can be tricky with all the options available. This guide will help you understand the platform's costs and benefits so you can make a smart decision that fits your needs and budget.
This post was first publis…","Key Takeaways:
<ul><li>SmartSuite is an all-in-one project management software that visualizes and automates workflows across all business operations.</li><li>It has a free version, three paid plans… [+12790 chars]",newsapi,2025-08-22 19:00:07+00:00
48,Forbes,"Zscaler, AI And Trust: The Industry Debate No One Can Avoid",https://www.forbes.com/sites/tonybradley/2025/08/22/zscaler-ai-and-trust-the-industry-debate-no-one-can-avoid/,2025-08-22T18:32:21Z,"Zscaler’s AI data practices sparked a backlash—and a broader debate on trust, privacy, and transparency in cybersecurity. Here’s what the industry can learn.",A CEOs offhand remark ignited industry outragebut also surfaced a critical tension at the heart of modern cybersecurity: how to advance AI-driven defense without eroding the very trust it's meant to … [+7759 chars],newsapi,2025-08-22 18:32:21+00:00
49,Worldsoccertalk.com,Lionel Messi’s MLS vs. Cristiano Ronaldo’s SPL: Which league came out on top in new global ranking?,https://worldsoccertalk.com/news/lionel-messis-mls-vs-cristiano-ronaldos-spl-which-league-came-out-on-top-in-new-global-ranking/,2025-08-22T18:29:36Z,"A new global ranking has revealed which league comes out on top between Lionel Messi’s Major League Soccer and Cristiano Ronaldo’s Saudi Pro League.
 Lionel Messi and Cristiano Ronaldo have become the headline acts of their respective leagues, one in Major Le…","Lionel Messi and Cristiano Ronaldo have become the headline acts of their respective leagues, one in Major League Soccer and the other in the Saudi Pro League. After years of defining the sport on th… [+4033 chars]",newsapi,2025-08-22 18:29:36+00:00
50,Databricks.com,Processing Millions of Events from Thousands of Aircraft with One Declarative Pipeline,https://www.databricks.com/blog/processing-millions-events-thousands-aircraft-one-declarative-pipeline,2025-08-22T18:22:18Z,Ingest live aircraft data at scale using custom PySpark data sources. Transform complex streaming data engineering into simple SQL with Databricks Lakeflow Declarative Pipelines.,"Every second, tens of thousands of aircraft generate IoT events across the globefrom a small Cessna carrying four tourists over the Grand Canyon to an Airbus A380 departing Frankfurt with 570 passeng… [+17617 chars]",newsapi,2025-08-22 18:22:18+00:00
51,Databricks.com,Securing the Future: How Databricks Powers Financial Services,https://www.databricks.com/blog/securing-future-how-databricks-powers-financial-services,2025-08-22T18:22:18Z,"Discover how leading banks and financial institutions use the Databricks Data Intelligence Platform to strengthen cybersecurity, simplify compliance, and future-proof operations. Download the ebook to unlock actionable insights, best practices, and real-world…","Why Data Security &amp; Compliance are Essential for Growth in Financial Services
In today's rapidly changing landscape, financial institutions face unprecedented cyber risks, evolving regulations, … [+5476 chars]",newsapi,2025-08-22 18:22:18+00:00
52,Fortune,Thousands of private user conversations with Elon Musk’s Grok AI chatbot have exposed on Google Search,https://fortune.com/2025/08/22/xai-grok-chats-public-on-google-search-elon-musk/,2025-08-22T17:32:16Z,"More than 370,000 Grok chats have been indexed by search engines, exposing sensitive queries that include intimate medical and psychological questions, business details, and at least one password.","Thousands of user chats with Elon Musks AI chatbot Grok are now publicly available on Google.More than 370,000 Grok chats have been indexed by search engines, exposing hundreds of sensitive prompts t… [+4308 chars]",newsapi,2025-08-22 17:32:16+00:00
53,Yahoo Entertainment,Thousands of private user conversations with Elon Musk’s Grok AI chatbot have exposed on Google Search,https://www.yahoo.com/news/articles/thousands-private-user-conversations-elon-173216941.html,2025-08-22T17:32:16Z,"More than 370,000 Grok chats have been indexed by search engines, exposing sensitive queries that include intimate medical and psychological questions...","Thousands of user chats with Elon Musks AI chatbot Grok are now publicly available on Google.
More than 370,000 Grok chats have been indexed by search engines, exposing hundreds of sensitive prompts… [+4361 chars]",newsapi,2025-08-22 17:32:16+00:00
54,Socialnomics.net,How AI Enhances Personalization in Modern OTT Platforms,https://socialnomics.net/2025/08/22/how-ai-enhances-personalization-in-modern-ott-platforms/,2025-08-22T17:00:39Z,"How AI Enhances Personalization in Modern OTT Platforms The OTT (Over-the-Top) industry has exploded in recent years. With platforms like Netflix, Amazon Prime Video, Disney+, and regional streaming apps dominating global screens, the way we consume entertain…","How AI Enhances Personalization in Modern OTT Platforms
The OTT (Over-the-Top) industry has exploded in recent years. With platforms like Netflix, Amazon Prime Video, Disney+, and regional streaming… [+5788 chars]",newsapi,2025-08-22 17:00:39+00:00
55,Arxiv.org,"ML-PWS: Estimating the Mutual Information Between Experimental Time
 Series Using Neural Networks",https://arxiv.org/abs/2508.16509,2025-08-22T16:33:34Z,"The ability to quantify information transmission is crucial for the analysis
and design of natural and engineered systems. The information transmission rate
is the fundamental measure for systems with time-varying signals, yet computing
it is extremely challe…","arXivLabs is a framework that allows collaborators to develop and share new arXiv features directly on our website.
Both individuals and organizations that work with arXivLabs have embraced and acce… [+257 chars]",newsapi,2025-08-22 16:33:34+00:00
56,Phys.Org,AI model maps building emissions to support fairer climate policies,https://phys.org/news/2025-08-ai-emissions-fairer-climate-policies.html,2025-08-22T16:20:04Z,An open-source artificial intelligence model to accurately map the carbon emissions of buildings across multiple cities could become a powerful new tool to help policymakers plan targeted and equitable decarbonization strategies.,An open-source artificial intelligence model to accurately map the carbon emissions of buildings across multiple cities could become a powerful new tool to help policymakers plan targeted and equitab… [+4280 chars],newsapi,2025-08-22 16:20:04+00:00
57,GlobeNewswire,"EMEA Data Center Colocation Market Forecast Report 2025-2030, Profiling Equinix, Iron Mountain, Hostdime, Nforce Entertainment, Altushost, Serverius, Telehouse, Verizon, and Centersquare",https://www.globenewswire.com/news-release/2025/08/22/3137949/28124/en/EMEA-Data-Center-Colocation-Market-Forecast-Report-2025-2030-Profiling-Equinix-Iron-Mountain-Hostdime-Nforce-Entertainment-Altushost-Serverius-Telehouse-Verizon-and-Centersquare.html,2025-08-22T16:18:00Z,"The EMEA data center colocation market is set to expand from USD 29.751 billion in 2025 to USD 51.208 billion in 2030, driven by hyperscale demand and rapid digital transformation. Key insights include hyperscale growth, investments in digital infrastructure,…","Dublin, Aug. 22, 2025 (GLOBE NEWSWIRE) -- The ""Europe Middle East and Africa (EMEA) Data Center Colocation Market - Forecasts from 2025 to 2030"" report has been added to ResearchAndMarkets.com's offe… [+6941 chars]",newsapi,2025-08-22 16:18:00+00:00
58,Kdnuggets.com,Predictive Analytics in Healthcare: Improving Patient Outcomes,https://www.kdnuggets.com/predictive-analytics-in-healthcare-improving-patient-outcomes,2025-08-22T16:00:04Z,Predictive analytics in healthcare is revolutionizing patient care by using AI and machine learning to forecast health outcomes and optimize treatment plans.,"Image by Author
When I first started learning about how data science and machine learning could be used outside of finance and marketing, healthcare immediately stood out to me. Not just because its… [+6411 chars]",newsapi,2025-08-22 16:00:04+00:00
59,PR Newswire UK,Ericsson completes sale of iconectiv,https://www.prnewswire.co.uk/news-releases/ericsson-completes-sale-of-iconectiv-302536806.html,2025-08-22T15:38:00Z,"STOCKHOLM, Aug. 22, 2025 /PRNewswire/ -- Further to the announcement on August 16, 2024, Ericsson (NASDAQ: ERIC) today announces it has completed the sale of iconectiv to Koch Equity Development LLC. Ericsson's cash benefit from the Transaction, after the set…","STOCKHOLM, Aug. 22, 2025 /PRNewswire/ -- Further to the announcement on August 16, 2024, Ericsson (NASDAQ: ERIC) today announces it has completed the sale of iconectiv to Koch Equity Development LLC.… [+3918 chars]",newsapi,2025-08-22 15:38:00+00:00
60,Nvidia.com,"Hot Topics at Hot Chips: Inference, Networking, AI Innovation at Every Scale — All Built on NVIDIA",https://blogs.nvidia.com/blog/hot-chips-inference-networking/,2025-08-22T15:00:29Z,"AI reasoning, inference and networking will be top of mind for attendees of next week’s Hot Chips conference. A key forum for processor and system architects from industry and academia, Hot Chips — running Aug. 24-26 at Stanford University — showcases the lat…","AI reasoning, inference and networking will be top of mind for attendees of next weeks Hot Chips conference.
A key forum for processor and system architects from industry and academia, Hot Chips run… [+6459 chars]",newsapi,2025-08-22 15:00:29+00:00
61,Getresponse.com,Email marketing laws and regulations,https://www.getresponse.com/blog/email-marketing-laws-and-regulations,2025-08-22T14:40:06Z,"Email marketing delivers an average ROI of $42 for every dollar spent, making it one of the most effective marketing channels. However, this powerful tool comes with serious legal responsibilities that vary significantly across countries. Getting compliance w…","Email marketing delivers an average ROI of $42 for every dollar spent, making it one of the most effective marketing channels. However, this powerful tool comes with serious legal responsibilities th… [+18650 chars]",newsapi,2025-08-22 14:40:06+00:00
62,Pypi.org,nnetsauce 0.39.4,https://pypi.org/project/nnetsauce/0.39.4/,2025-08-22T14:31:18Z,Quasi-randomized (neural) networks,"A required part of this site couldnt load. This may be due to a browser
 extension, network issues, or browser settings. Please check your
 connection, disable any ad blockers, or try using a diffe… [+12 chars]",newsapi,2025-08-22 14:31:18+00:00
63,PR Newswire UK,Smart City Platforms Market worth $39.52 billion by 2030| MarketsandMarkets™,https://www.prnewswire.co.uk/news-releases/smart-city-platforms-market-worth-39-52-billion-by-2030-marketsandmarkets-302536471.html,2025-08-22T14:30:00Z,"DELRAY BEACH, Fla., Aug. 22, 2025 /PRNewswire/ -- According to MarketsandMarkets™, the global Smart City Platforms Market will grow from USD 24.51 billion in 2025 to USD 39.52 billion by 2030 at a compounded annual growth rate (CAGR) of 10.0% during the forec…","DELRAY BEACH, Fla., Aug. 22, 2025 /PRNewswire/ -- According to MarketsandMarkets, the global Smart City Platforms Market will grow from USD 24.51 billion in 2025 to USD 39.52 billion by 2030 at a com… [+7931 chars]",newsapi,2025-08-22 14:30:00+00:00
64,GlobeNewswire,"Runtime Application Self-Protection Market to Reach USD 13.96 Billion by 2032, Driven by Cloud, ML, and Healthcare Adoption | Report by SNS Insider",https://www.globenewswire.com/news-release/2025/08/22/3137884/0/en/Runtime-Application-Self-Protection-Market-to-Reach-USD-13-96-Billion-by-2032-Driven-by-Cloud-ML-and-Healthcare-Adoption-Report-by-SNS-Insider.html,2025-08-22T14:30:00Z,"The Runtime Application Self-Protection Market is growing rapidly, driven by cloud adoption, machine learning, healthcare, and robust application security. The Runtime Application Self-Protection Market is growing rapidly, driven by cloud adoption, machine le…","Austin, Aug. 22, 2025 (GLOBE NEWSWIRE) -- The Runtime Application Self-Protection (RASP) Market
 was valued at USD 3.08 billion in 2024 and is projected to grow to USD 13.96 billion by 2032, registe… [+7679 chars]",newsapi,2025-08-22 14:30:00+00:00
65,Pypi.org,nnetsauce 0.39.3,https://pypi.org/project/nnetsauce/0.39.3/,2025-08-22T14:29:40Z,Quasi-randomized (neural) networks,"A required part of this site couldnt load. This may be due to a browser
 extension, network issues, or browser settings. Please check your
 connection, disable any ad blockers, or try using a diffe… [+12 chars]",newsapi,2025-08-22 14:29:40+00:00
66,Pypi.org,tversky-nn 0.1.2,https://pypi.org/project/tversky-nn/0.1.2/,2025-08-22T14:25:24Z,My faithful reproduction of Tversky Neural Networks (TNNs),"A required part of this site couldnt load. This may be due to a browser
 extension, network issues, or browser settings. Please check your
 connection, disable any ad blockers, or try using a diffe… [+12 chars]",newsapi,2025-08-22 14:25:24+00:00
67,PR Newswire UK,"Software-Defined Perimeter (SDP) Market Growing at a 15.5%, Fueled by Rising Cybersecurity Threats and Cloud Adoption - Market Research Intellect",https://www.prnewswire.co.uk/news-releases/software-defined-perimeter-sdp-market-growing-at-a-15-5-fueled-by-rising-cybersecurity-threats-and-cloud-adoption---market-research-intellect-302536676.html,2025-08-22T14:01:00Z,"The growth of the Software-Defined Perimeter (SDP) market is driven by the rising need for advanced cybersecurity solutions to combat growing cyberattacks, data breaches, and unauthorized access in cloud-based environments. Increasing adoption of remote work,…","The growth of the Software-Defined Perimeter (SDP) market is driven by the rising need for advanced cybersecurity solutions to combat growing cyberattacks, data breaches, and unauthorized access in c… [+19155 chars]",newsapi,2025-08-22 14:01:00+00:00
68,Plos.org,Enhanced CNN for induction motor fault diagnosis via multi-source data fusion,https://journals.plos.org/plosone/article?id=10.1371/journal.pone.0330761,2025-08-22T14:00:00Z,This study addresses the challenge of low recognition precision in single fault signal isolation for induction motors by proposing a novel fault diagnosis strategy that integrates multi-source information and an enhanced Convolutional Neural Network (CNN). Th…,"3.2.1 Data denoising.
The data collected directly from induction motor sensors are extremely nonlinear, and the noise pollution of sample data caused by the operating environment makes it difficult … [+14198 chars]",newsapi,2025-08-22 14:00:00+00:00
69,Plos.org,Outcome prediction abilities of basketball players shooting free throws,https://journals.plos.org/plosone/article?id=10.1371/journal.pone.0330545,2025-08-22T14:00:00Z,"Skilled athletes, such as basketball players, seem to anticipate the outcome of their actions, likely due to well-developed internal models that enhance predictive accuracy. This study explores whether experienced basketball players can verbally predict their…","Citation: Junge-Bornholt LE, Wachsmann FD, Maurer H, Hegele M, Müller H, Maurer LK (2025) Outcome prediction abilities of basketball players shooting free throws. PLoS One 20(8):
 e0330545.
https:/… [+40268 chars]",newsapi,2025-08-22 14:00:00+00:00
70,Plos.org,Understanding the evolving treatment landscape of hidradenitis suppurativa: An analysis of All of Us,https://journals.plos.org/plosone/article?id=10.1371/journal.pone.0331032,2025-08-22T14:00:00Z,"Background Hidradenitis suppurativa (HS) is a chronic skin condition with significant burden for affected patients. The development of new therapies in the last decade has brought hope for better patient outcomes, but understanding the use of these new drug c…","Citation: Gupta AK, Economopoulos V, Mirmirani P, Magalhaes R (2025) Understanding the evolving treatment landscape of hidradenitis suppurativa: An analysis of All of Us. PLoS One 20(8):
 e0331032.… [+27471 chars]",newsapi,2025-08-22 14:00:00+00:00
71,Plos.org,"Global patterns and trends of carbon monoxide poisoning: A comprehensive spatiotemporal analysis using joinpoint regression and ARIMA modeling, 1990–2021",https://journals.plos.org/plosone/article?id=10.1371/journal.pone.0330778,2025-08-22T14:00:00Z,"Background Carbon monoxide (CO) poisoning causes approximately 41,000 deaths annually worldwide despite being preventable. Previous studies focused primarily on mortality alone, lacked systematic socio-demographic analysis, and provided no predictive models. …","Abstract
Background
Carbon monoxide (CO) poisoning causes approximately 41,000 deaths annually worldwide despite being preventable. Previous studies focused primarily on mortality alone, lacked sys… [+51394 chars]",newsapi,2025-08-22 14:00:00+00:00
72,Plos.org,Attractive serial dependence arises during decision-making,https://journals.plos.org/plosbiology/article?id=10.1371/journal.pbio.3003333,2025-08-22T14:00:00Z,"Our memory of a stimulus can be biased toward or away from previous stimuli, but when this bias arises is unclear. This study shows that attractive serial dependence emerges during decision-making, supported by neural evidence of late-stage attractive biases,…","Introduction
Our sensory apparatus contends with the dynamic and noisy nature of sensory inputs by taking advantage of the apparent stability over time of natural environments [2]. For example, in w… [+69132 chars]",newsapi,2025-08-22 14:00:00+00:00
73,Dreamhost.com,Do You Actually Own Your Website?,https://www.dreamhost.com/blog/data-portability/,2025-08-22T14:00:00Z,"Wondering who really owns your website? Learn the truth about content control and data portability.
The post Do You Actually Own Your Website? appeared first on DreamHost Blog.","You close your café at the end of an early fall evening, head home, and fire up your laptop to post tomorrows pumpkin spice croissant teaseronly to discover your website has been replaced by a blank … [+16479 chars]",newsapi,2025-08-22 14:00:00+00:00
74,Plos.org,DSTF-GKAN: A lightweight spatiotemporal fusion framework for real-time eavesdropping detection in dynamic smart grid networks,https://journals.plos.org/plosone/article?id=10.1371/journal.pone.0330593,2025-08-22T14:00:00Z,"With the rapid development of smart grids and the Power Internet of Things (PIoT), wireless communication networks are facing the severe threat of dynamic eavesdropping attacks. Traditional detection methods rely on static assumptions or shallow models, which…",This paper proposes a lightweight framework based on hybrid dynamic graph models and attention-enhanced Graph Convolutional Networks (DSTF-GKAN) to address the detection and localization of dynamic t… [+8884 chars],newsapi,2025-08-22 14:00:00+00:00
75,Plos.org,Extracting rubber tree parameters and estimating carbon storage using airborne LiDAR,https://journals.plos.org/plosone/article?id=10.1371/journal.pone.0330768,2025-08-22T14:00:00Z,"Facing the dual challenges of global warming and carbon neutrality, forestry carbon sinks play a vital role in achieving carbon neutrality. Rubber plantations, in particular, offer significant ecological and economic co-benefits. However, the efficient and ra…","Abstract
Facing the dual challenges of global warming and carbon neutrality, forestry carbon sinks play a vital role in achieving carbon neutrality. Rubber plantations, in particular, offer signific… [+66228 chars]",newsapi,2025-08-22 14:00:00+00:00
