source,title,url,published_at,description,content,fetched_from,published_at_parsed
GlobeNewswire,"Integrated Patient Care Systems Industry Report 2025: Expansion of Chronic Disease Management and Multidisciplinary Care Models Propels Adoption of Platforms That Link Providers, Specialists, and Patients",https://www.globenewswire.com/news-release/2025/06/05/3094621/28124/en/Integrated-Patient-Care-Systems-Industry-Report-2025-Expansion-of-Chronic-Disease-Management-and-Multidisciplinary-Care-Models-Propels-Adoption-of-Platforms-That-Link-Providers-Spe.html,2025-06-05T16:00:00Z,"Integrated systems are pivotal in modern healthcare, enhancing patient data coordination, reducing medical errors, and enabling value-based care. By leveraging digital technologies like AI and cloud computing, these systems ensure efficient, patient-centered …","Dublin, June 05, 2025 (GLOBE NEWSWIRE) -- The ""Integrated Patient Care Systems - Global Strategic Business Report"" has been added to ResearchAndMarkets.com's offering.
The global market for Integrat… [+10123 chars]",newsapi,2025-06-05 16:00:00+00:00
GlobeNewswire,Trade 350 App: This Trade 350 App Establishes New Standard for Retail Traders in 2025—Advanced AI Signals Backed by Military-Grade Security,https://www.globenewswire.com/news-release/2025/06/05/3094551/0/en/Trade-350-App-This-Trade-350-App-Establishes-New-Standard-for-Retail-Traders-in-2025-Advanced-AI-Signals-Backed-by-Military-Grade-Security.html,2025-06-05T14:57:00Z,Trade 350 App Ignites the 2025 Trading Revolution with Next-Gen AI and Unbeatable Security Trade 350 App Ignites the 2025 Trading Revolution with Next-Gen AI and Unbeatable Security,"New York City, June 05, 2025 (GLOBE NEWSWIRE) -- In an industry crowded with promises and half-measures, Trade 350 App
 emerges as a true trailblazer. Launched in early 2023 by a team of seasoned qu… [+67699 chars]",newsapi,2025-06-05 14:57:00+00:00
Fox News,"Major data broker hack impacts 364,000 individuals’ data",https://www.foxnews.com/tech/major-data-broker-hack-impacts-over-364000-individuals-data,2025-06-05T14:00:34Z,"Personal information from 364,000 people was compromised in a LexisNexis data breach that went undetected for months, highlighting privacy risks.","Americans personal data is now spread across more digital platforms than ever. From online shopping habits to fitness tracking logs, personal information ends up in hundreds of company databases. Whi… [+8767 chars]",newsapi,2025-06-05 14:00:34+00:00
Plos.org,A comparative overview of aggregation methods of a graphical risk assessment: An analysis based on a critical infrastructure project,https://journals.plos.org/plosone/article?id=10.1371/journal.pone.0325267,2025-06-05T14:00:00Z,"We compare the traditional risk and opportunity assessment method, which relies on fixed values for impacts (or potentials) and probabilities, with a graphical approach that incorporates the representation of uncertainties. To date, this graphical risk assess…","Abstract
We compare the traditional risk and opportunity assessment method, which relies on fixed values for impacts (or potentials) and probabilities, with a graphical approach that incorporates th… [+54364 chars]",newsapi,2025-06-05 14:00:00+00:00
GlobeNewswire,KraneShares Launches First Global Humanoid & Embodied Intelligence ETF (Ticker: KOID) On Nasdaq,https://www.globenewswire.com/news-release/2025/06/05/3094434/0/en/KraneShares-Launches-First-Global-Humanoid-Embodied-Intelligence-ETF-Ticker-KOID-On-Nasdaq.html,2025-06-05T13:00:00Z,"NEW YORK, June 05, 2025 (GLOBE NEWSWIRE) -- Krane Funds Advisors, LLC (“KraneShares”), an asset management firm known for its global exchange-traded funds (ETFs), announced the launch of the KraneShares Global Humanoid and Embodied Intelligence Index ETF (Tic…","NEW YORK, June 05, 2025 (GLOBE NEWSWIRE) -- Krane Funds Advisors, LLC (KraneShares), an asset management firm known for its global exchange-traded funds (ETFs), announced the launch of the KraneShare… [+15989 chars]",newsapi,2025-06-05 13:00:00+00:00
W3.org,Proposed Group: Semantic Construction Product Data Community Group,https://www.w3.org/community/blog/2025/06/05/proposed-group-semantic-construction-product-data-community-group/,2025-06-05T12:59:53Z,"The Semantic Construction Product Data Community Group has been proposed by Baran Bacak: Product information in the construction industry today is highly fragmented—scattered across Environmental Product Declarations (EPDs), BIM models (e.g., IFC), Product Da…","The Semantic Construction Product Data Community Group has been proposed by Baran Bacak:
Product information in the construction industry today is highly fragmentedscattered across Environmental Pro… [+2394 chars]",newsapi,2025-06-05 12:59:53+00:00
Securityaffairs.com,"Critical flaw in Cisco ISE impacts cloud deployments on AWS, Microsoft Azure, and Oracle Cloud Infrastructure",https://securityaffairs.com/178659/uncategorized/critical-flaw-in-cisco-ise-impacts-cloud-deployments-on-aws-microsoft-azure-and-oracle-cloud-infrastructure.html,2025-06-05T08:31:27Z,"Cisco fixed a critical flaw in the Identity Services Engine (ISE) that could allow unauthenticated attackers to conduct malicious actions. A vulnerability tracked as CVE-2025-20286 (CVSS score 9.9) in cloud deployments of Cisco ISE on AWS, Microsoft Azure, an…","Critical flaw in Cisco ISE impacts cloud deployments on AWS, Microsoft Azure, and Oracle Cloud Infrastructure
 | Ukraines military intelligence agency stole 4.4GB of highly classified internal data … [+170023 chars]",newsapi,2025-06-05 08:31:27+00:00
Securityaffairs.com,Law enforcement seized the carding marketplace BidenCash,https://securityaffairs.com/178655/cyber-crime/law-enforcement-seized-the-carding-marketplace-bidencash.html,2025-06-05T05:51:23Z,"U.S. and Dutch authorities took down 145 domains tied to the BidenCash cybercrime marketplace in a coordinated law enforcement operation. The US DoJ announced the seizure of approximately 145 darknet and clear web domains, and cryptocurrency funds associated …","Ukraines military intelligence agency stole 4.4GB of highly classified internal data from Tupolev
 | HPE fixed multiple flaws in its StoreOnce software
 | Roundcube Webmail under fire: critical exp… [+169909 chars]",newsapi,2025-06-05 05:51:23+00:00
Hospitality Net,The evolution of DMOs: From marketing to management in a data-driven era,https://www.hospitalitynet.org/opinion/4127501.html,2025-06-05T05:48:00Z,The DMO has evolved significantly in the last three to five years. What originated as destination marketing organizations have become destination management organizations. And this isn’t just a name change. These were initially born as independent e...,The DMO has evolved significantly in the last three to five years. What originated as destination marketing organizations have become destination management organizations. And this isn't just a name … [+8995 chars],newsapi,2025-06-05 05:48:00+00:00
eWeek,6 Best AI-Powered BI Tools for Smarter Analytics 2025,https://www.eweek.com/cloud/best-ai-bi-tools/,2025-06-05T01:18:57Z,"Discover the best AI powered BI tools to transform data into actionable insights, automate analysis, and drive smarter business decisions.
The post 6 Best AI-Powered BI Tools for Smarter Analytics 2025 appeared first on eWEEK.","eWEEK content and product recommendations are editorially independent. We may make money when you click on links to our partners. Learn More.
Business intelligence (BI) software tools help organizat… [+19884 chars]",newsapi,2025-06-05 01:18:57+00:00
EFF,Statement on California State Senate Advancing Dangerous Surveillance Bill,https://www.eff.org/deeplinks/2025/06/statement-california-state-senate-advancing-dangerous-surveillance-bill,2025-06-04T21:45:23Z,"In the wake of the California State Senate’s passage of S.B. 690, the Electronic Frontier Foundation (EFF), TechEquity, Consumer Federation of California, Tech Oversight California, and ACLU California Action issued a joint statement warning that the bill wou…","In the wake of the California State Senates passage of S.B. 690, the Electronic Frontier Foundation (EFF), TechEquity, Consumer Federation of California, Tech Oversight California, and ACLU Californi… [+1243 chars]",newsapi,2025-06-04 21:45:23+00:00
Securityaffairs.com,Ukraine’s military intelligence agency stole 4.4GB of highly classified internal data from Tupolev,https://securityaffairs.com/178641/hacking/ukraines-military-intelligence-agency-stole-4-4gb-of-highly-classified-internal-data-from-tupolev.html,2025-06-04T20:03:53Z,"Ukraine’s GUR hacked the Russian aerospace and defense company Tupolev, stealing 4.4GB of highly classified internal data. Ukraine’s military intelligence agency GUR (aka HUR) claims the hack of the Russian aerospace and defense company Tupolev. According to …","Ukraines military intelligence agency stole 4.4GB of highly classified internal data from Tupolev
 | HPE fixed multiple flaws in its StoreOnce software
 | Roundcube Webmail under fire: critical exp… [+169909 chars]",newsapi,2025-06-04 20:03:53+00:00
Forbes,CMOs Plan Big Investments In AI For The Next Three Years,https://www.forbes.com/sites/cmo/2025/06/04/cmos-plan-big-investments-in-ai-for-the-next-three-years/,2025-06-04T16:53:16Z,"Also in the Forbes CMO newsletter: How Kellanova uses data clean room technology, X plans a WhatsApp competitor, MLB invests in pro softball league.","This is the published version of Forbes' CMO newsletter, which offers the latest news for chief marketing officers and other messaging-focused leaders. Click here to get it delivered to your inbox ev… [+15621 chars]",newsapi,2025-06-04 16:53:16+00:00
Foreign Policy,How Will Revoking Chinese Student Visas Actually Work?,http://foreignpolicy.com/2025/06/04/china-student-visa-revocation-ccp-trump-state-rubio-universities/,2025-06-04T16:06:12Z,"Though the Trump administration hasn’t provided details, a rough estimate suggests a staggering impact.","On May 28, U.S. Secretary of State Marco Rubio announced that the United States would aggressively revoke visas for Chinese students, including those with connections to the Chinese Communist Party [… [+11425 chars]",newsapi,2025-06-04 16:06:12+00:00
Martech.zone,"CMO MarTech Investments in 2025: AI, Automation, and Customer Experience",https://martech.zone/marketing-technology-investments/,2025-06-04T15:51:52Z,"As we reach the midpoint of 2025, the marketing technology (MarTech) landscape continues to evolve at a breakneck pace. For businesses, marketers, and sales leaders, understanding where Chief Marketing Officers (CMOs) are directing their technology budgets of…","As we reach the midpoint of 2025, the marketing technology (MarTech) landscape continues to evolve at a breakneck pace. For businesses, marketers, and sales leaders, understanding where Chief Marketi… [+7275 chars]",newsapi,2025-06-04 15:51:52+00:00
Forbes,How Data Clean Room Technology Can Show Marketing Impact,https://www.forbes.com/sites/meganpoinski/2025/06/04/how-data-clean-room-technology-can-show-marketing-impact/,2025-06-04T15:43:03Z,Kellanova Senior Director of Intelligence and Insights Louise Cotterill and Chief Growth Officer Charisse Hughes talk about their successful use of the tech.,"Last year, international food giant Kellanova (part of the company formerly known as Kellogg) was hoping to improve sales of its Special K cereal in the U.K. as competition increased. Their hypothesi… [+14291 chars]",newsapi,2025-06-04 15:43:03+00:00
Esri.com,ArcGIS for Power BI join layer improvements,https://www.esri.com/arcgis-blog/products/power-bi/analytics/arcgis-for-power-bi-join-layer-improvements,2025-06-04T15:30:49Z,"Learn about the new and improved join layer interface and features (highlighting, appended fields, styling) using sample data and examples","ArcGIS for Power BI 2024.2 introduces several improvements to the join layer feature. These improvements include highlight interaction (in addition to filter), styling of the joined result layer, and… [+32638 chars]",newsapi,2025-06-04 15:30:49+00:00
Securityaffairs.com,HPE fixed multiple flaws in its StoreOnce software,https://securityaffairs.com/178629/security/hpe-fixed-multiple-flaws-in-its-storeonce-software.html,2025-06-04T13:29:26Z,"Hewlett Packard Enterprise (HPE) addressed multiple flaws in its StoreOnce data backup and deduplication solution. HPE has released security patches for eight vulnerabilities in its StoreOnce backup solution. These issues could allow remote code execution, au…","HPE fixed multiple flaws in its StoreOnce software
 | Roundcube Webmail under fire: critical exploit found after a decade
 | Cartier disclosed a data breach following a cyber attack
 | U.S. CISA a… [+169807 chars]",newsapi,2025-06-04 13:29:26+00:00
itnewsonline.com,data . world launches Data Marketplace : A revolutionary e - commerce experience transforms enterprise data discovery,https://www.itnewsonline.com/PRNewswire/data.world-launches-Data-Marketplace-A-revolutionary-e-commerce-experience-transforms-enterprise-data-discovery/1061688,,itnewsonline.com,20250603T114500Z,gdelt,
indiatvnews.com,Jaish done and dusted after Operation Sindoor ? JeM headquarters in Bahawalpur marked  permanently closed  ,https://www.indiatvnews.com/news/world/jaish-done-and-dusted-after-operation-sindoor-jem-headquarters-in-bahawalpur-marked-permanently-closed-2025-06-07-993622,,indiatvnews.com,20250607T031500Z,gdelt,
aravot.am,Դատախազությունում մեկ անձից գնումների աճը պայմանավորված է եղել էլեկտրոնային արդարադատության համար տվյալների պահոցի համակարգի ձեռքբերմամբ . Մհեր Ափրիկյան,https://www.aravot.am/2025/06/06/1492323/,,aravot.am,20250606T141500Z,gdelt,
blogs.itmedia.co.jp,未経験から100日後にGTMのプロになる話 【 Day 81 】 〜【 実践編 】 ECサイトのGTM設定とコンバージョン最適化 〜： 秋山大志のそれとりあえず作ってみようか 。： オルタナティブ ・ ブログ,https://blogs.itmedia.co.jp/agile/2025/06/GTM100DAY_DAY81.html,,blogs.itmedia.co.jp,20250607T003000Z,gdelt,
laborpraxis.vogel.de,Datenflut und Formulare – so kommt Ordnung ins Labor 4 . 0,https://www.laborpraxis.vogel.de/datenflut-und-formulare-so-kommt-ordnung-ins-labor-40-a-bf89897720c70243231fe2d5e9ad8977/,,laborpraxis.vogel.de,20250605T084500Z,gdelt,
globenewswire.com,Viridien sets new seismic data acquisition standard with,https://www.globenewswire.com/news-release/2025/06/03/3092433/0/en/Viridien-sets-new-seismic-data-acquisition-standard-with-launch-of-Sercel-Accel-the-world-s-first-onshore-drop-node-solution.html,,globenewswire.com,20250603T061500Z,gdelt,
ewn.co.za,SARS announces tax season to get underway on 7 July,https://www.ewn.co.za/2025/06/03/sars-announces-tax-season-to-get-underway-on-7-july,,ewn.co.za,20250603T051500Z,gdelt,
finanznachrichten.de,"Sensirion Holding AG : Sensirion geht Partnerschaft mit Sintropy . ai und Repcom ein , um Innovationen in der AI - gesteuerten Sensortechnologie voranzutreiben",https://www.finanznachrichten.de/nachrichten-2025-06/65581928-sensirion-holding-ag-sensirion-geht-partnerschaft-mit-sintropy-ai-und-repcom-ein-um-innovationen-in-der-ai-gesteuerten-sensortechnologie-voranzutrei-022.htm,,finanznachrichten.de,20250604T111500Z,gdelt,
manilatimes.net,Viridien sets new seismic data acquisition standard with launch of Sercel Accel - the world first onshore drop node solution,https://www.manilatimes.net/2025/06/03/tmt-newswire/globenewswire/viridien-sets-new-seismic-data-acquisition-standard-with-launch-of-sercel-accel-the-worlds-first-onshore-drop-node-solution/2126207,,manilatimes.net,20250603T061500Z,gdelt,
news.china.com.cn,云南花卉产业首笔数据交易完成签约,http://news.china.com.cn/2025-06/04/content_117910895.shtml,,news.china.com.cn,20250604T103000Z,gdelt,
news.cn,云南花卉产业首笔数据交易完成签约 - 新华网,http://www.news.cn/politics/20250604/081bb806fc6c4ce68f2d3973923bd01d/c.html,,news.cn,20250604T104500Z,gdelt,
merkur.de,"Sicherheits - Panne bei Microsoft : Experten verraten , wie Sie Ihre Daten schützen können",http://www.merkur.de/verbraucher/sicherheits-panne-bei-microsoft-experten-verraten-wie-sie-ihre-daten-schuetzen-koennen-93768876.html,,merkur.de,20250604T113000Z,gdelt,
tvn24.pl,Nowe oszustwo . GUS ostrzega - TVN24 Biznes,https://tvn24.pl/biznes/dlafirm/nowe-oszustwo-gus-ostrzega-st8502292,,tvn24.pl,20250609T133000Z,gdelt,
hna.de,"Sicherheits - Panne bei Microsoft : Experten verraten , wie Sie Ihre Daten schützen können",https://www.hna.de/verbraucher/sicherheits-panne-bei-microsoft-experten-verraten-wie-sie-ihre-daten-schuetzen-koennen-93768872.html,,hna.de,20250604T113000Z,gdelt,
hna.de,"Sicherheits - Panne bei Microsoft : Experten verraten , wie Sie Ihre Daten schützen können",http://www.hna.de/verbraucher/sicherheits-panne-bei-microsoft-experten-verraten-wie-sie-ihre-daten-schuetzen-koennen-93768872.html,,hna.de,20250604T113000Z,gdelt,
wa.de,"Sicherheits - Panne bei Microsoft : Experten verraten , wie Sie Ihre Daten schützen können",http://www.wa.de/verbraucher/sicherheits-panne-bei-microsoft-experten-verraten-wie-sie-ihre-daten-schuetzen-koennen-93768873.html,,wa.de,20250604T113000Z,gdelt,
come-on.de,"Sicherheits - Panne bei Microsoft : Experten verraten , wie Sie Ihre Daten schützen können",http://www.come-on.de/verbraucher/sicherheits-panne-bei-microsoft-experten-verraten-wie-sie-ihre-daten-schuetzen-koennen-93768873.html,,come-on.de,20250604T114500Z,gdelt,
noa.al,Këmbimi valutor / Çfarë po ndodh sot me monedhat e huaja ? Me sa po blihen dhe shiten dollari dhe euro,https://noa.al/lajmi/2025/06/2514134.html,,noa.al,20250610T074500Z,gdelt,
connect.de,Crocodilus : Neue Android - Malware legt gefälschte Kontakte für Social Engineering an,https://www.connect.de/news/crocodilus-android-malware-schadsoftware-3209605.html,,connect.de,20250605T143000Z,gdelt,
sat1.de,Bürgergeld - Empfänger : Bas will  mafiöse Strukturen  zerschlagen,https://www.sat1.de/serien/newstime/news/buergergeld-empfaenger-bas-will-mafioese-strukturen-zerschlagen-544108,,sat1.de,20250604T021500Z,gdelt,
syri.net,Çfarë po ndodh sot me monedhat e huaja ? Ja me sa - Syri,https://www.syri.net/ekonomi/794512/cfare-po-ndodh-sot-me-monedhat-e-huaja-ja-me-sa-po-blihen-dhe-shiten-dollari-dhe-euro/,,syri.net,20250609T061500Z,gdelt,
vaartha.com,AP Village Secretariat,https://vaartha.com/ap-village-secretariat/andhra-pradesh/499258/,,vaartha.com,20250608T081500Z,gdelt,
wgospodarce.pl,Uwaga ! Wyłudzają dane z firm na „ ankietera GUS  ,https://wgospodarce.pl/informacje/150703-uwaga-wyludzaja-dane-z-firm-na-ankietera-gus,,wgospodarce.pl,20250609T144500Z,gdelt,
nbcchicago.com,"NBA team sponsorship revenue up 8 % to $1 . 6 billion , boosted by jersey patches",https://www.nbcchicago.com/news/business/money-report/nba-team-sponsorship-revenue-up-8-to-1-6-billion-boosted-by-jersey-patches/3761095/,,nbcchicago.com,20250605T133000Z,gdelt,
chip.de,Android : Darum sehen Sie dieses  N - Symbol immer wieder,https://www.chip.de/news/Android-Darum-sehen-Sie-dieses-N-Symbol-immer-wieder_185978926.html,,chip.de,20250609T091500Z,gdelt,
blic.rs,Poznato stanje dečaka ( 2 ) iz Leskovca koji se polio vrelom vodom,https://www.blic.rs/vesti/drustvo/poznato-stanje-decaka-2-iz-leskovca-koji-se-polio-vrelom-vodom/9xs3d3z,,blic.rs,20250605T140000Z,gdelt,
tass.ru,Рынок акций РФ на открытии основной торговой сессии растет,https://tass.ru/ekonomika/24182465,,tass.ru,20250610T074500Z,gdelt,
itbear.com.cn,元宇宙时代来临 ， 3D数字内容如何重塑商业版图 ？- 游戏之家 - ITBear科技资讯,http://www.itbear.com.cn/html/2025-06/850238.html,,itbear.com.cn,20250610T030000Z,gdelt,
electronicdesign.com,Collaboration for Mechanical & PCB Designers,https://www.electronicdesign.com/resources/white-paper/whitepaper/55292537/collaboration-for-mechanical-pcb-designers,,electronicdesign.com,20250604T191500Z,gdelt,
syri.net,Çfarë po ndodh sot me monedhat e huaja ? Ja me sa - Syri Kosova,https://www.syri.net/syri_kosova/ekonomi-lajme/577082/cfare-po-ndodh-sot-me-monedhat-e-huaja-ja-me-sa-po-blihen-dhe-shiten-dollari-dhe-euro/,,syri.net,20250608T083000Z,gdelt,
instalki.pl,Aktualizacja danych płatności na Netflix może skończyć się fatalnie,https://www.instalki.pl/news/bezpieczenstwo/aktualizacja-danych-platnosci-na-netflix/,,instalki.pl,20250610T124500Z,gdelt,
1in.am,Իրանի հետախուզության հաջողությունն ու Թրամփի « հաճոյախոսությունը » ,https://www.1in.am/3579023.html,,1in.am,20250610T100000Z,gdelt,
aviationweek.com,Space Force And NGA Delineate Commercial Data - Buying Roles,https://aviationweek.com/space/budget-policy-regulation/space-force-nga-delineate-commercial-data-buying-roles,,aviationweek.com,20250604T093000Z,gdelt,
proactiveinvestors.com,Chewy downgraded by Jefferies over valuation concerns,https://www.proactiveinvestors.com/companies/news/1072508/chewy-downgraded-by-jefferies-over-valuation-concerns-1072508.html,,proactiveinvestors.com,20250605T191500Z,gdelt,
zawya.com,Ghana Minerals Commission Showcases Drone Technology at Mining in Motion 2025,https://www.zawya.com/en/press-release/africa-press-releases/ghanas-minerals-commission-showcases-drone-technology-at-mining-in-motion-2025-b0c3lxru,,zawya.com,20250604T123000Z,gdelt,
finance.sina.com.cn,英国手机盗窃案激增 ： 苹果被指从中牟利 ！ ,https://finance.sina.com.cn/tech/roll/2025-06-05/doc-ineyzhca3458960.shtml,,finance.sina.com.cn,20250605T093000Z,gdelt,
n.yam.com,苗栗頭份市親子公園迎暑假 市長羅雪珠籲遵守規範共創美好環境,https://n.yam.com/Article/20250605608079,,n.yam.com,20250605T140000Z,gdelt,
life.ru,Курс турецкой лиры впервые в истории опустился ниже двух рублей,https://life.ru/p/1759717,,life.ru,20250609T100000Z,gdelt,
finanzen.net,Pressestimme :  Die Glocke  zu Maßnahmen gegen Bürgergeld - Betrug,https://www.finanzen.net/nachricht/aktien/pressestimme-die-glocke-zu-massnahmen-gegen-buergergeld-betrug-14540543,,finanzen.net,20250605T040000Z,gdelt,
finanznachrichten.de,Pressestimme :  Die Glocke  zu Maßnahmen gegen Bürgergeld - Betrug,https://www.finanznachrichten.de/nachrichten-2025-06/65589007-pressestimme-die-glocke-zu-massnahmen-gegen-buergergeld-betrug-016.htm,,finanznachrichten.de,20250605T043000Z,gdelt,
ntvbd.com,শাহজালাল বিমানবন্দরে ইমিগ্রেশন পুলিশের সার্ভার সচল,https://www.ntvbd.com/bangladesh/news-1567293,,ntvbd.com,20250603T081500Z,gdelt,
finanznachrichten.de,"Black Book Research : European Health IT Leaders Look to Denmark and Finland as Models for EHR Interoperability and Patient Access , Black Book Survey Reveals",https://www.finanznachrichten.de/nachrichten-2025-06/65611354-black-book-research-european-health-it-leaders-look-to-denmark-and-finland-as-models-for-ehr-interoperability-and-patient-access-black-book-survey-r-200.htm,,finanznachrichten.de,20250607T171500Z,gdelt,
prnewswire.com,Envision Energy in - house Blade Test Facility Earns IECRE Approval with Zero Non - Conformities,https://www.prnewswire.com/news-releases/envision-energys-in-house-blade-test-facility-earns-iecre-approval-with-zero-non-conformities-302477469.html,,prnewswire.com,20250610T083000Z,gdelt,
itbear.com.cn,我国探日卫星  羲和二号  首秀 ， 高清捕捉太阳耀斑震撼瞬间 ！- 信息流 - ITBear科技资讯,http://www.itbear.com.cn/html/2025-06/849927.html,,itbear.com.cn,20250609T163000Z,gdelt,
welt.de,Umweltminister lernt Pflanzenbestimmung per App,https://www.welt.de/regionales/niedersachsen/article256224290/umweltminister-lernt-pflanzenbestimmung-per-app.html,,welt.de,20250607T153000Z,gdelt,
heise.de,Ausgediente Smartphones sollen als Mini - Datenzentren Umwelt überwachen,https://www.heise.de/news/Mini-Datenzentren-Umgebaute-ausgediente-Smartphones-ueberwachen-Meere-10435234.html,,heise.de,20250606T093000Z,gdelt,
aktiencheck.de,AngloGold Ashanti Aktie : Goldgräberstimmung verfliegt () ,https://www.aktiencheck.de/news/Artikel-AngloGold_Ashanti_Aktie_Goldgraeberstimmung_verfliegt-18642300,,aktiencheck.de,20250608T101500Z,gdelt,
tass.ru,Индекс фондовой биржи Гонконга показал рост на фоне переговоров КНР и США,https://tass.ru/ekonomika/24181523,,tass.ru,20250610T054500Z,gdelt,
1prime.ru,"Банк России обозначил официальный курс юаня , доллара и евро на 11 июня",https://1prime.ru/20250610/valyuta-858379130.html,,1prime.ru,20250610T160000Z,gdelt,
yahoo.com,Got a scam DMV text ? How they got your number,https://www.yahoo.com/news/got-scam-dmv-text-got-112743670.html,,yahoo.com,20250605T133000Z,gdelt,
komando.com,Elder fraud is exploding : Your data is making it worse,https://www.komando.com/news/security/elder-fraud-is-exploding-your-data-is-making-it-worse/,,komando.com,20250609T083000Z,gdelt,
9to5mac.com,"Why you should delete your personal data from the internet , and how to keep it from resurfacing",https://9to5mac.com/2025/06/09/why-you-should-delete-your-personal-data-from-the-internet-and-how-to-keep-it-from-resurfacing-sponsored/,,9to5mac.com,20250609T231500Z,gdelt,
eff.org,Hell No : The ODNI Wants to Make it Easier for the Government to Buy Your Data Without Warrant,https://www.eff.org/deeplinks/2025/06/hell-no-odni-wants-make-it-easier-government-buy-your-data-without-warrant,,eff.org,20250603T234500Z,gdelt,
