,source,title,url,published_at,description,content,fetched_from,published_at_parsed,combined_text,relevance_score,summary
126,openpr.com,High Precision Industrial Data Acquisition Equipment Market,https://www.openpr.com/news/4148727/high-precision-industrial-data-acquisition-equipment-market,,openpr.com,20250819T014500Z,gdelt,,High Precision Industrial Data Acquisition Equipment Market. openpr.com. ,0.5662614,"I am sorry, I do not have access to external websites or local files. Therefore, I cannot summarize the article you have provided."
71,GlobeNewswire,Vietnam Data Center Colocation Market Supply & Demand Analysis 2025-2030 - Vietnam's Data Center Facilities to Achieve Over 90% Occupancy by 2030,https://www.globenewswire.com/news-release/2025/08/22/3137739/28124/en/Vietnam-Data-Center-Colocation-Market-Supply-Demand-Analysis-2025-2030-Vietnam-s-Data-Center-Facilities-to-Achieve-Over-90-Occupancy-by-2030.html,2025-08-22T10:33:00Z,"The rising demand for scalable, high-performance data infrastructure boosts wholesale colocation adoption across key industries such as cloud services, telecommunications, and financial services. Supported by governmental digitalization efforts, the market pr…","Dublin, Aug. 22, 2025 (GLOBE NEWSWIRE) -- The ""Vietnam Data Center Colocation Market - Supply &amp; Demand Analysis 2025-2030"" has been added to ResearchAndMarkets.com's offering.
The Vietnam Data C… [+5702 chars]",newsapi,2025-08-22 10:33:00+00:00,"Vietnam Data Center Colocation Market Supply & Demand Analysis 2025-2030 - Vietnam's Data Center Facilities to Achieve Over 90% Occupancy by 2030. The rising demand for scalable, high-performance data infrastructure boosts wholesale colocation adoption across key industries such as cloud services, telecommunications, and financial services. Supported by governmental digitalization efforts, the market pr…. ",0.42688912,"Vietnam's data center colocation market will see over 90% occupancy by 2030 due to rising digital transformation demand. Wholesale colocation adoption grows significantly, driven by cloud, telecom, and financial sectors needing scalable infrastructure. Government digitalization efforts powerfully support market growth, fueling demand for data center facilities across the country.
"
166,knowyourmobile.com,Data Removal Services : The Ultimate Guide For Dealing With Data Brokers,https://www.knowyourmobile.com/data-removal-services/,,knowyourmobile.com,20250818T193000Z,gdelt,,Data Removal Services : The Ultimate Guide For Dealing With Data Brokers. knowyourmobile.com. ,0.42105576,"Data brokers collect and sell personal information, impacting privacy and security for most people. Data removal services assist in opting out of broker databases, costing from $80 to $400 annually. Around 70-80% of brokers comply with opt-out requests, reducing online exposure significantly.
"
120,finanznachrichten.de,Precisely and Opendatasoft Partner to Deliver Trusted AI - Ready Data for the Modern Enterprise,https://www.finanznachrichten.de/nachrichten-2025-08/66216997-precisely-and-opendatasoft-partner-to-deliver-trusted-ai-ready-data-for-the-modern-enterprise-008.htm,,finanznachrichten.de,20250819T140000Z,gdelt,,Precisely and Opendatasoft Partner to Deliver Trusted AI - Ready Data for the Modern Enterprise. finanznachrichten.de. ,0.41964865,"Precisely and Opendatasoft partnered to provide enterprises with AI-ready data solutions, enhancing data management. The partnership aims to improve data quality, likely increasing AI model accuracy and reliability for users. Modern enterprises will benefit from better data governance, leading to more effective AI-driven decision-making processes.
"
90,GlobeNewswire,Australia Data Center Colocation Market Analysis and Competition Outlook to 2030 | 37 New Data Center Facilities Set to Transform Australia's Digital Landscape,https://www.globenewswire.com/news-release/2025/08/21/3137221/28124/en/Australia-Data-Center-Colocation-Market-Analysis-and-Competition-Outlook-to-2030-37-New-Data-Center-Facilities-Set-to-Transform-Australia-s-Digital-Landscape.html,2025-08-21T13:19:00Z,"Around 500 industrial parks, including prominent ones like Sydney and Bundaberg, offer strategic operational benefits, attracting leading colocation operators like Equinix, NEXTDC, and newcomers like Vantage Data Centers. Around 500 industrial parks, includin…","Dublin, Aug. 21, 2025 (GLOBE NEWSWIRE) -- The ""Australia Data Center Colocation Market - Supply &amp; Demand Analysis 2025-2030"" report has been added to ResearchAndMarkets.com's offering.
The Austr… [+5667 chars]",newsapi,2025-08-21 13:19:00+00:00,"Australia Data Center Colocation Market Analysis and Competition Outlook to 2030 | 37 New Data Center Facilities Set to Transform Australia's Digital Landscape. Around 500 industrial parks, including prominent ones like Sydney and Bundaberg, offer strategic operational benefits, attracting leading colocation operators like Equinix, NEXTDC, and newcomers like Vantage Data Centers. Around 500 industrial parks, includin…. ",0.38533723,"Australia's data center market is booming, with 37 new facilities expected by 2030, transforming the digital landscape. Strategic industrial parks (around 500) are attracting colocation giants like Equinix and NEXTDC due to operational advantages. The report analyzes supply and demand trends from 2025-2030, offering crucial insights for data center investment strategies.
"
74,The Next Web,European space tech has data to sell — but where are the buyers?,https://thenextweb.com/news/europe-space-tech-data-buyers,2025-08-22T06:15:55Z,"The European space industry is booming. Yet despite the boom, the industry is struggling to find commercial buyers for arguably its most valuable output: data.  At the Living Planet Symposium 2025 in Vienna, the European Space Agency (ESA) and private sector …","The European space industry is booming. Yet despite the boom, the industry is struggling to find commercial buyers for arguably its most valuable output: data. 
At the Living Planet Symposium 2025 i… [+7682 chars]",newsapi,2025-08-22 06:15:55+00:00,"European space tech has data to sell — but where are the buyers?. The European space industry is booming. Yet despite the boom, the industry is struggling to find commercial buyers for arguably its most valuable output: data.  At the Living Planet Symposium 2025 in Vienna, the European Space Agency (ESA) and private sector …. ",0.3770018,"European space industry data faces commercialization challenges despite a current industry boom. ESA seeks private sector collaboration at events like the Living Planet Symposium 2025 to boost data sales. The article highlights a critical need to connect valuable space-derived data with potential market applications.
"
119,prnewswire.com,Precisely and Opendatasoft Partner to Deliver Trusted AI - Ready Data for the Modern Enterprise,http://www.prnewswire.com/news-releases/precisely-and-opendatasoft-partner-to-deliver-trusted-ai-ready-data-for-the-modern-enterprise-302533509.html,,prnewswire.com,20250819T140000Z,gdelt,,Precisely and Opendatasoft Partner to Deliver Trusted AI - Ready Data for the Modern Enterprise. prnewswire.com. ,0.3688497,"Precisely and Opendatasoft partnered to offer AI-ready data, essential for modern enterprises and their data initiatives. This partnership combines Precisely's data integrity with Opendatasoft's data sharing, boosting insights. The integration streamlines data accessibility, enhancing AI model accuracy and decision-making, likely improving ROI.
"
113,Finextra,A Data Dilemma: Reclaiming Time for Profit in the Financial Markets - A Business Perspective (Erica Andersen),https://www.finextra.com/blogposting/29143/a-data-dilemma-reclaiming-time-for-profit-in-the-financial-markets---a-business-perspective,2025-08-18T17:04:27Z,"The financial markets are a relentless, data-driven ecosystem. Success hinges on the speed and accu","The financial markets are a relentless, data-driven ecosystem. Success hinges on the speed and accuracy with which institutions can extract, analyze, and interpret the torrent of market information. … [+11972 chars]",newsapi,2025-08-18 17:04:27+00:00,"A Data Dilemma: Reclaiming Time for Profit in the Financial Markets - A Business Perspective (Erica Andersen). The financial markets are a relentless, data-driven ecosystem. Success hinges on the speed and accu. ",0.36398822,"Financial firms struggle with data, spending up to 70% of time managing it instead of analysis. Reducing data management time could significantly boost profitability by focusing on valuable insights. Data startups should offer solutions that enhance accuracy and speed of analysis which directly impact ROI.
"
102,GlobeNewswire,"Data Broker Industry Analysis Report 2025: Trends and Revenue Projections by Data Types, Pricing Models, Applications, End-Users and Regional Markets to 2034",https://www.globenewswire.com/news-release/2025/08/20/3136224/28124/en/Data-Broker-Industry-Analysis-Report-2025-Trends-and-Revenue-Projections-by-Data-Types-Pricing-Models-Applications-End-Users-and-Regional-Markets-to-2034.html,2025-08-20T09:09:00Z,"Data broker market set to grow at a CAGR of 9.8%, driven by personalized data demand and e-commerce expansion Data broker market set to grow at a CAGR of 9.8%, driven by personalized data demand and e-commerce expansion","Dublin, Aug. 20, 2025 (GLOBE NEWSWIRE) -- The ""Data Broker Market Report 2025"" has been added to ResearchAndMarkets.com's offering.
The data broker market is projected to experience significant grow… [+6088 chars]",newsapi,2025-08-20 09:09:00+00:00,"Data Broker Industry Analysis Report 2025: Trends and Revenue Projections by Data Types, Pricing Models, Applications, End-Users and Regional Markets to 2034. Data broker market set to grow at a CAGR of 9.8%, driven by personalized data demand and e-commerce expansion Data broker market set to grow at a CAGR of 9.8%, driven by personalized data demand and e-commerce expansion. ",0.3634252,"The data broker market is expected to grow at a CAGR of 9.8% until 2034 due to personalized data demand. E-commerce expansion drives the demand for data, presenting opportunities for relevant data startups. The market report covers data types, pricing models, applications, end-users, and regional markets for strategic analysis.
"
208,en.vietnamplus.vn,PM approves national data strategy to accelerate digital government,https://en.vietnamplus.vn/pm-approves-national-data-strategy-to-drive-digital-government-post324861.vnp,,en.vietnamplus.vn,20250819T060000Z,gdelt,,PM approves national data strategy to accelerate digital government. en.vietnamplus.vn. ,0.36299306,"Vietnam's PM approved a national data strategy aiming for 80% of public services online by 2025. The strategy prioritizes data infrastructure, focusing on data collection, sharing, and security, hoping for better digital government. Vietnam targets 100% of national databases connected and open by 2030, fostering data-driven innovation.
"
